geoid,name,total,male_total,female_total,total_same_house,male_same_house,female_same_house,total_moved_within_county,male_moved_within_county,female_moved_within_county,total_moved_from_different_county_in_same_state,male_moved_from_different_county_in_same_state,female_moved_from_different_county_in_same_state,total_moved_from_different_state,male_moved_from_different_state,female_moved_from_different_state,total_moved_from_abroad,male_moved_from_abroad,female_moved_from_abroad,county,county subdivision,state
1603991242,"Glenns Ferry CCD, Elmore County, Idaho",2126.0,1077.0,1049.0,1871.0,941.0,930.0,218.0,115.0,103.0,30.0,18.0,12.0,7.0,3.0,4.0,0.0,0.0,0.0,039,91242,16
1603992300,"Mountain Home CCD, Elmore County, Idaho",23246.0,12106.0,11140.0,18033.0,9181.0,8852.0,2394.0,1334.0,1060.0,678.0,396.0,282.0,1534.0,799.0,735.0,607.0,396.0,211.0,039,92300,16
1604390161,"Ashton CCD, Fremont County, Idaho",2332.0,1237.0,1095.0,1993.0,1009.0,984.0,226.0,160.0,66.0,20.0,10.0,10.0,36.0,10.0,26.0,57.0,48.0,9.0,043,90161,16
1604393496,"Teton-Newdale CCD, Fremont County, Idaho",1453.0,729.0,724.0,1135.0,545.0,590.0,69.0,20.0,49.0,133.0,102.0,31.0,116.0,62.0,54.0,0.0,0.0,0.0,043,93496,16
1604393910,"Yellowstone National Park CCD, Fremont County, Idaho",0.0,0.0,0.0,0.0,0.0,0.0,0.0,0.0,0.0,0.0,0.0,0.0,0.0,0.0,0.0,0.0,0.0,0.0,043,93910,16
1604391725,"Island Park CCD, Fremont County, Idaho",1129.0,552.0,577.0,1041.0,508.0,533.0,18.0,6.0,12.0,32.0,17.0,15.0,38.0,21.0,17.0,0.0,0.0,0.0,043,91725,16
1607390793,"Duck Valley CCD, Owyhee County, Idaho",244.0,90.0,154.0,228.0,85.0,143.0,0.0,0.0,0.0,0.0,0.0,0.0,16.0,5.0,11.0,0.0,0.0,0.0,073,90793,16
1605192335,"Mud Lake-Hamer CCD, Jefferson County, Idaho",1964.0,1004.0,960.0,1784.0,923.0,861.0,79.0,38.0,41.0,66.0,29.0,37.0,23.0,14.0,9.0,12.0,0.0,12.0,051,92335,16
1606192576,"Nez Perce CCD, Lewis County, Idaho",737.0,405.0,332.0,623.0,328.0,295.0,52.0,33.0,19.0,54.0,40.0,14.0,8.0,4.0,4.0,0.0,0.0,0.0,061,92576,16
1602193285,"South and West Boundary CCD, Boundary County, Idaho",1227.0,642.0,585.0,929.0,543.0,386.0,26.0,0.0,26.0,40.0,0.0,40.0,232.0,99.0,133.0,0.0,0.0,0.0,021,93285,16
1606193300,"South Lewis CCD, Lewis County, Idaho",19.0,9.0,10.0,19.0,9.0,10.0,0.0,0.0,0.0,0.0,0.0,0.0,0.0,0.0,0.0,0.0,0.0,0.0,061,93300,16
1606590863,"East Madison CCD, Madison County, Idaho",136.0,74.0,62.0,126.0,67.0,59.0,0.0,0.0,0.0,3.0,0.0,3.0,7.0,7.0,0.0,0.0,0.0,0.0,065,90863,16
1606592956,"Rexburg CCD, Madison County, Idaho",31046.0,15368.0,15678.0,18737.0,9392.0,9345.0,5608.0,2908.0,2700.0,1448.0,596.0,852.0,4615.0,2078.0,2537.0,638.0,394.0,244.0,065,92956,16
1607992679,"Osburn-Wallace CCD, Shoshone County, Idaho",3850.0,1929.0,1921.0,3285.0,1641.0,1644.0,411.0,212.0,199.0,82.0,47.0,35.0,70.0,27.0,43.0,2.0,2.0,0.0,079,92679,16
