geoid,name,total,white_alone,black_alone,american_indian_and_alaska_native,asian_alone,native_hawaiian_and_pacific_islander,other_alone,two_or_more_races,latino_alone,county,county subdivision,state,asian_all,other_all
5601593465,"Torrington CCD, Goshen County, Wyoming",11940.0,10186.0,9.0,128.0,54.0,0.0,0.0,227.0,1336.0,015,93465,56,54.0,355.0
5601591430,"Goshen Hole CCD, Goshen County, Wyoming",1156.0,1096.0,0.0,0.0,0.0,0.0,0.0,5.0,55.0,015,91430,56,0.0,5.0
5601592585,"Rawhide Creek CCD, Goshen County, Wyoming",383.0,340.0,0.0,0.0,3.0,0.0,0.0,7.0,33.0,015,92585,56,3.0,7.0
5604191155,"Evanston CCD, Uinta County, Wyoming",14473.0,12161.0,18.0,196.0,23.0,0.0,0.0,311.0,1764.0,041,91155,56,23.0,507.0
5604190440,"Bridger Valley CCD, Uinta County, Wyoming",6285.0,6035.0,11.0,0.0,2.0,0.0,0.0,118.0,119.0,041,90440,56,2.0,118.0
5604393300,"Ten Sleep CCD, Washakie County, Wyoming",735.0,711.0,0.0,0.0,0.0,0.0,0.0,20.0,4.0,043,93300,56,0.0,20.0
5604393795,"Worland CCD, Washakie County, Wyoming",7518.0,6072.0,25.0,29.0,11.0,0.0,0.0,210.0,1171.0,043,93795,56,11.0,239.0
5601793410,"Thermopolis West CCD, Hot Springs County, Wyoming",4062.0,3867.0,0.0,104.0,0.0,0.0,0.0,15.0,76.0,017,93410,56,0.0,119.0
5601793355,"Thermopolis East CCD, Hot Springs County, Wyoming",410.0,367.0,0.0,3.0,0.0,0.0,0.0,24.0,16.0,017,93355,56,0.0,27.0
5601391045,"Dubois CCD, Fremont County, Wyoming",1590.0,1477.0,56.0,16.0,4.0,0.0,0.0,0.0,37.0,013,91045,56,4.0,16.0
5601392035,"Lander CCD, Fremont County, Wyoming",11203.0,9748.0,26.0,587.0,5.0,22.0,0.0,488.0,327.0,013,92035,56,27.0,1075.0
5601393080,"Shoshoni CCD, Fremont County, Wyoming",657.0,537.0,10.0,2.0,0.0,0.0,0.0,25.0,83.0,013,93080,56,0.0,27.0
5603592475,"Pinedale CCD, Sublette County, Wyoming",6988.0,6355.0,0.0,15.0,5.0,0.0,0.0,15.0,598.0,035,92475,56,5.0,30.0
5603590385,"Boulder CCD, Sublette County, Wyoming",190.0,173.0,0.0,0.0,4.0,0.0,0.0,4.0,9.0,035,90385,56,4.0,4.0
5603590330,"Big Piney CCD, Sublette County, Wyoming",2859.0,2428.0,0.0,0.0,1.0,0.0,0.0,306.0,124.0,035,90330,56,1.0,306.0
5604593520,"Upton CCD, Weston County, Wyoming",1355.0,1163.0,20.0,0.0,34.0,0.0,0.0,94.0,44.0,045,93520,56,34.0,94.0
5604592255,"Newcastle CCD, Weston County, Wyoming",5762.0,5359.0,13.0,6.0,271.0,0.0,0.0,54.0,59.0,045,92255,56,271.0,60.0
5600390688,"Central Big Horn CCD, Big Horn County, Wyoming",3392.0,2876.0,19.0,21.0,4.0,17.0,0.0,42.0,413.0,003,90688,56,21.0,63.0
5600392393,"North Big Horn CCD, Big Horn County, Wyoming",5406.0,4687.0,49.0,40.0,34.0,0.0,3.0,54.0,539.0,003,92393,56,34.0,97.0
5601393742,"Wind River Reservation CCD, Fremont County, Wyoming",26819.0,16453.0,125.0,7322.0,31.0,2.0,0.0,597.0,2289.0,013,93742,56,33.0,7919.0
5601793744,"Wind River Reservation CCD, Hot Springs County, Wyoming",269.0,244.0,0.0,0.0,0.0,0.0,0.0,25.0,0.0,017,93744,56,0.0,25.0
5600393142,"South Big Horn CCD, Big Horn County, Wyoming",3122.0,2946.0,4.0,46.0,4.0,0.0,0.0,29.0,93.0,003,93142,56,4.0,75.0
5602791128,"East Niobrara CCD, Niobrara County, Wyoming",902.0,823.0,0.0,79.0,0.0,0.0,0.0,0.0,0.0,027,91128,56,0.0,79.0
5602793603,"West Niobrara CCD, Niobrara County, Wyoming",1577.0,1384.0,3.0,23.0,17.0,0.0,0.0,43.0,107.0,027,93603,56,17.0,66.0
5600591265,"Gillette South CCD, Campbell County, Wyoming",18042.0,15737.0,38.0,171.0,103.0,0.0,16.0,356.0,1621.0,005,91265,56,103.0,543.0
5600591210,"Gillette North CCD, Campbell County, Wyoming",30074.0,26445.0,104.0,223.0,126.0,0.0,0.0,745.0,2431.0,005,91210,56,126.0,968.0
5602390055,"Afton CCD, Lincoln County, Wyoming",13111.0,12271.0,31.0,16.0,32.0,0.0,0.0,246.0,515.0,023,90055,56,32.0,262.0
5602391980,"Kemmerer West CCD, Lincoln County, Wyoming",1374.0,1292.0,0.0,0.0,0.0,0.0,0.0,22.0,60.0,023,91980,56,0.0,22.0
5602391925,"Kemmerer East CCD, Lincoln County, Wyoming",4306.0,3827.0,25.0,36.0,17.0,6.0,0.0,128.0,267.0,023,91925,56,23.0,164.0
5601991870,"Kaycee CCD, Johnson County, Wyoming",872.0,718.0,0.0,22.0,0.0,0.0,0.0,46.0,86.0,019,91870,56,0.0,68.0
5601990495,"Buffalo CCD, Johnson County, Wyoming",7690.0,7136.0,122.0,205.0,0.0,0.0,0.0,131.0,96.0,019,90495,56,0.0,336.0
5602590550,"Casper CCD, Natrona County, Wyoming",54814.0,46758.0,887.0,411.0,353.0,5.0,0.0,1173.0,5227.0,025,90550,56,358.0,1584.0
5602590660,"Casper South CCD, Natrona County, Wyoming",13478.0,12386.0,15.0,17.0,77.0,0.0,12.0,155.0,816.0,025,90660,56,77.0,184.0
5602590605,"Casper North CCD, Natrona County, Wyoming",5959.0,5246.0,0.0,18.0,114.0,0.0,0.0,216.0,365.0,025,90605,56,114.0,234.0
5602591705,"Hells Half Acre CCD, Natrona County, Wyoming",6772.0,6098.0,76.0,73.0,103.0,0.0,0.0,164.0,258.0,025,91705,56,103.0,237.0
5602190770,"Cheyenne East CCD, Laramie County, Wyoming",10511.0,9155.0,276.0,7.0,78.0,0.0,0.0,182.0,813.0,021,90770,56,78.0,189.0
5602190715,"Cheyenne CCD, Laramie County, Wyoming",76818.0,59347.0,2078.0,771.0,952.0,86.0,37.0,1419.0,12128.0,021,90715,56,1038.0,2227.0
5602190825,"Cheyenne West CCD, Laramie County, Wyoming",6485.0,5444.0,120.0,0.0,64.0,5.0,0.0,271.0,581.0,021,90825,56,69.0,271.0
5602192420,"Pine Bluffs CCD, Laramie County, Wyoming",3217.0,2797.0,49.0,0.0,0.0,0.0,0.0,54.0,317.0,021,92420,56,0.0,54.0
5600990990,"Douglas CCD, Converse County, Wyoming",9871.0,9009.0,1.0,8.0,0.0,0.0,0.0,45.0,808.0,009,90990,56,0.0,53.0
5600991375,"Glenrock CCD, Converse County, Wyoming",4295.0,3919.0,0.0,11.0,0.0,0.0,0.0,65.0,300.0,009,91375,56,0.0,76.0
5603991815,"Jackson Hole CCD, Teton County, Wyoming",21806.0,17716.0,104.0,58.0,430.0,0.0,4.0,106.0,3388.0,039,91815,56,430.0,168.0
5603993905,"Yellowstone National Park CCD, Teton County, Wyoming",602.0,450.0,3.0,4.0,74.0,0.0,7.0,13.0,51.0,039,93905,56,74.0,24.0
5603990110,"Alta CCD, Teton County, Wyoming",515.0,515.0,0.0,0.0,0.0,0.0,0.0,0.0,0.0,039,90110,56,0.0,0.0
5603791540,"Green River South CCD, Sweetwater County, Wyoming",3976.0,3315.0,21.0,0.0,59.0,0.0,0.0,17.0,564.0,037,91540,56,59.0,17.0
5603791485,"Green River North CCD, Sweetwater County, Wyoming",11177.0,8834.0,9.0,63.0,63.0,0.0,0.0,122.0,2086.0,037,91485,56,63.0,185.0
5603792750,"Rock Springs North CCD, Sweetwater County, Wyoming",28867.0,22841.0,314.0,191.0,130.0,205.0,12.0,720.0,4454.0,037,92750,56,335.0,923.0
5603793575,"Wamsutter CCD, Sweetwater County, Wyoming",378.0,342.0,0.0,0.0,7.0,0.0,0.0,6.0,23.0,037,93575,56,7.0,6.0
5603792805,"Rock Springs South CCD, Sweetwater County, Wyoming",129.0,128.0,0.0,0.0,0.0,0.0,0.0,1.0,0.0,037,92805,56,0.0,1.0
5603193630,"Wheatland CCD, Platte County, Wyoming",6105.0,5403.0,2.0,3.0,29.0,0.0,0.0,199.0,469.0,031,93630,56,29.0,202.0
5603190880,"Chugwater CCD, Platte County, Wyoming",481.0,467.0,0.0,0.0,1.0,0.0,0.0,1.0,12.0,031,90880,56,1.0,1.0
5603191320,"Glendo CCD, Platte County, Wyoming",601.0,593.0,0.0,0.0,0.0,0.0,0.0,8.0,0.0,031,91320,56,0.0,8.0
5603191595,"Guernsey CCD, Platte County, Wyoming",1516.0,1298.0,1.0,0.0,13.0,0.0,0.0,7.0,197.0,031,91595,56,13.0,7.0
5603392970,"Sheridan South CCD, Sheridan County, Wyoming",6062.0,5887.0,0.0,66.0,72.0,0.0,0.0,0.0,37.0,033,92970,56,72.0,66.0
5603393025,"Sheridan West CCD, Sheridan County, Wyoming",2725.0,2533.0,13.0,46.0,0.0,0.0,0.0,4.0,129.0,033,93025,56,0.0,50.0
5603392915,"Sheridan CCD, Sheridan County, Wyoming",21177.0,19021.0,254.0,187.0,125.0,0.0,0.0,494.0,1096.0,033,92915,56,125.0,681.0
5601192200,"Moorcroft CCD, Crook County, Wyoming",3343.0,3133.0,0.0,103.0,23.0,0.0,0.0,0.0,84.0,011,92200,56,23.0,103.0
5601193190,"Sundance CCD, Crook County, Wyoming",2897.0,2732.0,0.0,1.0,0.0,0.0,0.0,88.0,76.0,011,93190,56,0.0,89.0
5601191760,"Hulett CCD, Crook County, Wyoming",1107.0,1076.0,15.0,0.0,0.0,0.0,0.0,4.0,12.0,011,91760,56,0.0,4.0
5602990935,"Cody CCD, Park County, Wyoming",16403.0,14861.0,135.0,69.0,83.0,0.0,0.0,483.0,772.0,029,90935,56,83.0,552.0
5602992145,"Meeteetse CCD, Park County, Wyoming",1123.0,1071.0,0.0,18.0,0.0,0.0,0.0,15.0,19.0,029,92145,56,0.0,33.0
5602993850,"Yellowstone National Park CCD, Park County, Wyoming",240.0,224.0,0.0,0.0,4.0,0.0,0.0,0.0,12.0,029,93850,56,4.0,0.0
5602992530,"Powell CCD, Park County, Wyoming",11510.0,10389.0,21.0,61.0,66.0,3.0,20.0,74.0,876.0,029,92530,56,69.0,155.0
5600193135,"South Albany CCD, Albany County, Wyoming",1479.0,1369.0,0.0,6.0,52.0,0.0,0.0,12.0,40.0,001,93135,56,52.0,18.0
5600191100,"East Albany CCD, Albany County, Wyoming",101.0,101.0,0.0,0.0,0.0,0.0,0.0,0.0,0.0,001,91100,56,0.0,0.0
5600192695,"Rock River CCD, Albany County, Wyoming",396.0,385.0,4.0,0.0,0.0,0.0,0.0,0.0,7.0,001,92695,56,0.0,0.0
5600192090,"Laramie CCD, Albany County, Wyoming",35968.0,29597.0,490.0,262.0,1051.0,8.0,97.0,982.0,3481.0,001,92090,56,1059.0,1341.0
5600791650,"Hanna CCD, Carbon County, Wyoming",1456.0,1367.0,9.0,0.0,0.0,0.0,0.0,40.0,40.0,007,91650,56,0.0,40.0
5600792640,"Rawlins CCD, Carbon County, Wyoming",10596.0,7321.0,186.0,232.0,91.0,14.0,0.0,55.0,2697.0,007,92640,56,105.0,287.0
5600792860,"Saratoga CCD, Carbon County, Wyoming",3637.0,3504.0,0.0,0.0,16.0,0.0,0.0,43.0,74.0,007,92860,56,16.0,43.0
5601391842,"Jeffrey City CCD, Fremont County, Wyoming",85.0,80.0,0.0,0.0,0.0,0.0,0.0,5.0,0.0,013,91842,56,0.0,5.0
