geoid,name,total,male_total,female_total,total_same_house,male_same_house,female_same_house,total_moved_within_county,male_moved_within_county,female_moved_within_county,total_moved_from_different_county_in_same_state,male_moved_from_different_county_in_same_state,female_moved_from_different_county_in_same_state,total_moved_from_different_state,male_moved_from_different_state,female_moved_from_different_state,total_moved_from_abroad,male_moved_from_abroad,female_moved_from_abroad,county,county subdivision,state
1604393128,"St. Anthony CCD, Fremont County, Idaho",7854.0,4142.0,3712.0,6896.0,3588.0,3308.0,332.0,135.0,197.0,418.0,283.0,135.0,171.0,108.0,63.0,37.0,28.0,9.0,043,93128,16
1606593381,"Sugar City CCD, Madison County, Idaho",6060.0,3275.0,2785.0,5440.0,2957.0,2483.0,267.0,120.0,147.0,216.0,93.0,123.0,109.0,77.0,32.0,28.0,28.0,0.0,065,93381,16
1607992346,"Mullan CCD, Shoshone County, Idaho",842.0,400.0,442.0,697.0,345.0,352.0,115.0,46.0,69.0,24.0,5.0,19.0,6.0,4.0,2.0,0.0,0.0,0.0,079,92346,16
1607992392,"Murray CCD, Shoshone County, Idaho",459.0,237.0,222.0,449.0,237.0,212.0,10.0,0.0,10.0,0.0,0.0,0.0,0.0,0.0,0.0,0.0,0.0,0.0,079,92392,16
1607991794,"Kellogg CCD, Shoshone County, Idaho",6703.0,3257.0,3446.0,5489.0,2675.0,2814.0,740.0,311.0,429.0,317.0,206.0,111.0,157.0,65.0,92.0,0.0,0.0,0.0,079,91794,16
1607990230,"Avery-Clarkia CCD, Shoshone County, Idaho",436.0,266.0,170.0,346.0,208.0,138.0,24.0,5.0,19.0,17.0,16.0,1.0,15.0,5.0,10.0,34.0,32.0,2.0,079,90230,16
1604990644,"Cottonwood CCD, Idaho County, Idaho",2388.0,1479.0,909.0,1564.0,847.0,717.0,226.0,81.0,145.0,441.0,430.0,11.0,146.0,117.0,29.0,11.0,4.0,7.0,049,90644,16
1604991334,"Grangeville CCD, Idaho County, Idaho",5896.0,2871.0,3025.0,4802.0,2414.0,2388.0,701.0,244.0,457.0,349.0,213.0,136.0,44.0,0.0,44.0,0.0,0.0,0.0,049,91334,16
1604990897,"Elk City CCD, Idaho County, Idaho",2057.0,1030.0,1027.0,1846.0,936.0,910.0,31.0,0.0,31.0,114.0,52.0,62.0,57.0,39.0,18.0,9.0,3.0,6.0,049,90897,16
1604993013,"Riggins CCD, Idaho County, Idaho",1180.0,640.0,540.0,1061.0,553.0,508.0,63.0,51.0,12.0,46.0,26.0,20.0,10.0,10.0,0.0,0.0,0.0,0.0,049,93013,16
1604992553,"Nez Perce CCD, Idaho County, Idaho",4556.0,2377.0,2179.0,3912.0,2028.0,1884.0,181.0,106.0,75.0,262.0,143.0,119.0,195.0,100.0,95.0,6.0,0.0,6.0,049,92553,16
1608193611,"Victor CCD, Teton County, Idaho",5109.0,2563.0,2546.0,4406.0,2187.0,2219.0,291.0,136.0,155.0,14.0,10.0,4.0,332.0,182.0,150.0,66.0,48.0,18.0,081,93611,16
1608193473,"Tetonia CCD, Teton County, Idaho",2302.0,1267.0,1035.0,2064.0,1087.0,977.0,49.0,25.0,24.0,118.0,84.0,34.0,2.0,2.0,0.0,69.0,69.0,0.0,081,93473,16
1608190782,"Driggs CCD, Teton County, Idaho",3153.0,1697.0,1456.0,2424.0,1258.0,1166.0,164.0,79.0,85.0,3.0,0.0,3.0,562.0,360.0,202.0,0.0,0.0,0.0,081,90782,16
1607791127,"Fort Hall CCD, Power County, Idaho",802.0,394.0,408.0,702.0,364.0,338.0,24.0,0.0,24.0,53.0,20.0,33.0,8.0,0.0,8.0,15.0,10.0,5.0,077,91127,16
1607793082,"Rockland CCD, Power County, Idaho",760.0,410.0,350.0,650.0,346.0,304.0,26.0,19.0,7.0,71.0,39.0,32.0,10.0,3.0,7.0,3.0,3.0,0.0,077,93082,16
1607790092,"American Falls CCD, Power County, Idaho",5783.0,3007.0,2776.0,4833.0,2554.0,2279.0,577.0,241.0,336.0,296.0,169.0,127.0,77.0,43.0,34.0,0.0,0.0,0.0,077,90092,16
1607790115,"Arbon CCD, Power County, Idaho",197.0,129.0,68.0,191.0,126.0,65.0,0.0,0.0,0.0,3.0,0.0,3.0,3.0,3.0,0.0,0.0,0.0,0.0,077,90115,16
1608793703,"Weiser CCD, Washington County, Idaho",8053.0,4031.0,4022.0,7028.0,3440.0,3588.0,562.0,277.0,285.0,228.0,177.0,51.0,228.0,130.0,98.0,7.0,7.0,0.0,087,93703,16
1608790506,"Cambridge CCD, Washington County, Idaho",938.0,435.0,503.0,864.0,409.0,455.0,14.0,14.0,0.0,56.0,8.0,48.0,4.0,4.0,0.0,0.0,0.0,0.0,087,90506,16
1608792139,"Midvale CCD, Washington County, Idaho",860.0,413.0,447.0,827.0,399.0,428.0,0.0,0.0,0.0,15.0,2.0,13.0,16.0,12.0,4.0,2.0,0.0,2.0,087,92139,16
1603190046,"Albion CCD, Cassia County, Idaho",3125.0,1694.0,1431.0,2816.0,1526.0,1290.0,142.0,89.0,53.0,97.0,50.0,47.0,52.0,19.0,33.0,18.0,10.0,8.0,031,90046,16
1603190460,"Burley CCD, Cassia County, Idaho",14034.0,7053.0,6981.0,11726.0,5969.0,5757.0,846.0,322.0,524.0,959.0,479.0,480.0,480.0,271.0,209.0,23.0,12.0,11.0,031,90460,16
1607191472,"Holbrook CCD, Oneida County, Idaho",363.0,196.0,167.0,263.0,152.0,111.0,0.0,0.0,0.0,0.0,0.0,0.0,100.0,44.0,56.0,0.0,0.0,0.0,071,91472,16
1607192047,"Malad City CCD, Oneida County, Idaho",3865.0,1922.0,1943.0,3453.0,1716.0,1737.0,169.0,94.0,75.0,17.0,13.0,4.0,224.0,99.0,125.0,2.0,0.0,2.0,071,92047,16
1603190759,"Declo CCD, Cassia County, Idaho",3229.0,1631.0,1598.0,2958.0,1479.0,1479.0,35.0,29.0,6.0,203.0,104.0,99.0,14.0,0.0,14.0,19.0,19.0,0.0,031,90759,16
1603192645,"Oakley CCD, Cassia County, Idaho",2761.0,1463.0,1298.0,2225.0,1129.0,1096.0,291.0,172.0,119.0,77.0,41.0,36.0,158.0,111.0,47.0,10.0,10.0,0.0,031,92645,16
1604590966,"Emmett Valley CCD, Gem County, Idaho",12298.0,6036.0,6262.0,10898.0,5207.0,5691.0,605.0,352.0,253.0,454.0,249.0,205.0,341.0,228.0,113.0,0.0,0.0,0.0,045,90966,16
1604590943,"Emmett Bench CCD, Gem County, Idaho",2995.0,1584.0,1411.0,2468.0,1319.0,1149.0,317.0,176.0,141.0,176.0,62.0,114.0,34.0,27.0,7.0,0.0,0.0,0.0,045,90943,16
1604593427,"Sweet CCD, Gem County, Idaho",1436.0,638.0,798.0,1360.0,608.0,752.0,0.0,0.0,0.0,14.0,0.0,14.0,48.0,16.0,32.0,14.0,14.0,0.0,045,93427,16
1606392967,"Richfield CCD, Lincoln County, Idaho",1316.0,765.0,551.0,1110.0,646.0,464.0,97.0,34.0,63.0,57.0,42.0,15.0,52.0,43.0,9.0,0.0,0.0,0.0,063,92967,16
1606393243,"Shoshone CCD, Lincoln County, Idaho",3908.0,1935.0,1973.0,3376.0,1660.0,1716.0,275.0,142.0,133.0,205.0,93.0,112.0,15.0,5.0,10.0,37.0,35.0,2.0,063,93243,16
1608592001,"McCall CCD, Valley County, Idaho",7675.0,3770.0,3905.0,5683.0,2948.0,2735.0,989.0,532.0,457.0,574.0,125.0,449.0,425.0,163.0,262.0,4.0,2.0,2.0,085,92001,16
1608590552,"Cascade CCD, Valley County, Idaho",2274.0,1278.0,996.0,1704.0,833.0,871.0,110.0,109.0,1.0,190.0,171.0,19.0,270.0,165.0,105.0,0.0,0.0,0.0,085,90552,16
1608593358,"Stibnite CCD, Valley County, Idaho",41.0,28.0,13.0,41.0,28.0,13.0,0.0,0.0,0.0,0.0,0.0,0.0,0.0,0.0,0.0,0.0,0.0,0.0,085,93358,16
1604192185,"Mink Creek CCD, Franklin County, Idaho",878.0,487.0,391.0,666.0,362.0,304.0,111.0,57.0,54.0,0.0,0.0,0.0,52.0,19.0,33.0,49.0,49.0,0.0,041,92185,16
1604190713,"Dayton CCD, Franklin County, Idaho",2869.0,1379.0,1490.0,2596.0,1255.0,1341.0,90.0,25.0,65.0,58.0,29.0,29.0,102.0,53.0,49.0,23.0,17.0,6.0,041,90713,16
1600390667,"Council CCD, Adams County, Idaho",2413.0,1231.0,1182.0,2044.0,1047.0,997.0,117.0,61.0,56.0,169.0,73.0,96.0,83.0,50.0,33.0,0.0,0.0,0.0,003,90667,16
1600392484,"New Meadows CCD, Adams County, Idaho",1488.0,770.0,718.0,1327.0,685.0,642.0,58.0,34.0,24.0,54.0,36.0,18.0,49.0,15.0,34.0,0.0,0.0,0.0,003,92484,16
1604192921,"Preston CCD, Franklin County, Idaho",9238.0,4757.0,4481.0,7928.0,4050.0,3878.0,331.0,194.0,137.0,216.0,115.0,101.0,701.0,360.0,341.0,62.0,38.0,24.0,041,92921,16
1606991909,"Leland CCD, Nez Perce County, Idaho",314.0,146.0,168.0,300.0,140.0,160.0,0.0,0.0,0.0,8.0,6.0,2.0,6.0,0.0,6.0,0.0,0.0,0.0,069,91909,16
1606992599,"Nez Perce CCD, Nez Perce County, Idaho",4692.0,2417.0,2275.0,4068.0,2108.0,1960.0,329.0,187.0,142.0,105.0,43.0,62.0,183.0,76.0,107.0,7.0,3.0,4.0,069,92599,16
1606991955,"Lewiston CCD, Nez Perce County, Idaho",34448.0,16999.0,17449.0,28622.0,14081.0,14541.0,3284.0,1550.0,1734.0,966.0,497.0,469.0,1525.0,822.0,703.0,51.0,49.0,2.0,069,91955,16
1605390874,"Eden-Hazelton CCD, Jerome County, Idaho",2306.0,1190.0,1116.0,2122.0,1099.0,1023.0,61.0,20.0,41.0,82.0,63.0,19.0,31.0,3.0,28.0,10.0,5.0,5.0,053,90874,16
1605391748,"Jerome CCD, Jerome County, Idaho",19453.0,9818.0,9635.0,16831.0,8343.0,8488.0,1394.0,734.0,660.0,775.0,477.0,298.0,254.0,181.0,73.0,199.0,83.0,116.0,053,91748,16
1605391587,"Hunt CCD, Jerome County, Idaho",793.0,376.0,417.0,486.0,235.0,251.0,128.0,27.0,101.0,151.0,86.0,65.0,0.0,0.0,0.0,28.0,28.0,0.0,053,91587,16
1605590621,"Coeur d'Alene CCD, Kootenai County, Idaho",76791.0,37619.0,39172.0,63099.0,30833.0,32266.0,8199.0,4050.0,4149.0,1542.0,724.0,818.0,3839.0,1951.0,1888.0,112.0,61.0,51.0,055,90621,16
1605592875,"Post Falls-Rathdrum CCD, Kootenai County, Idaho",50532.0,25126.0,25406.0,42696.0,21177.0,21519.0,5471.0,2688.0,2783.0,294.0,138.0,156.0,1959.0,1015.0,944.0,112.0,108.0,4.0,055,92875,16
1605593887,"Worley CCD, Kootenai County, Idaho",2694.0,1362.0,1332.0,2382.0,1189.0,1193.0,74.0,41.0,33.0,63.0,47.0,16.0,175.0,85.0,90.0,0.0,0.0,0.0,055,93887,16
1605591426,"Harrison CCD, Kootenai County, Idaho",2921.0,1339.0,1582.0,2583.0,1205.0,1378.0,109.0,50.0,59.0,118.0,38.0,80.0,102.0,43.0,59.0,9.0,3.0,6.0,055,91426,16
1605593312,"Spirit Lake-Athol CCD, Kootenai County, Idaho",15413.0,7783.0,7630.0,13065.0,6586.0,6479.0,1313.0,646.0,667.0,307.0,200.0,107.0,694.0,317.0,377.0,34.0,34.0,0.0,055,93312,16
1606190690,"Craigmont CCD, Lewis County, Idaho",720.0,352.0,368.0,661.0,326.0,335.0,9.0,3.0,6.0,30.0,10.0,20.0,20.0,13.0,7.0,0.0,0.0,0.0,061,90690,16
1606193864,"Winchester CCD, Lewis County, Idaho",576.0,327.0,249.0,492.0,276.0,216.0,25.0,19.0,6.0,45.0,23.0,22.0,14.0,9.0,5.0,0.0,0.0,0.0,061,93864,16
1606191771,"Kamiah CCD, Lewis County, Idaho",1738.0,815.0,923.0,1563.0,750.0,813.0,68.0,22.0,46.0,87.0,30.0,57.0,20.0,13.0,7.0,0.0,0.0,0.0,061,91771,16
1606792760,"Paul CCD, Minidoka County, Idaho",3052.0,1574.0,1478.0,2714.0,1426.0,1288.0,64.0,28.0,36.0,128.0,67.0,61.0,144.0,51.0,93.0,2.0,2.0,0.0,067,92760,16
1606793105,"Rupert CCD, Minidoka County, Idaho",9956.0,5144.0,4812.0,8223.0,4283.0,3940.0,786.0,388.0,398.0,674.0,340.0,334.0,189.0,106.0,83.0,84.0,27.0,57.0,067,93105,16
1606792162,"Minidoka CCD, Minidoka County, Idaho",1299.0,672.0,627.0,1206.0,603.0,603.0,53.0,46.0,7.0,13.0,0.0,13.0,9.0,5.0,4.0,18.0,18.0,0.0,067,92162,16
1606791449,"Heyburn CCD, Minidoka County, Idaho",5879.0,2800.0,3079.0,5211.0,2417.0,2794.0,151.0,87.0,64.0,250.0,148.0,102.0,213.0,118.0,95.0,54.0,30.0,24.0,067,91449,16
1608391495,"Hollister CCD, Twin Falls County, Idaho",2323.0,1102.0,1221.0,2149.0,1015.0,1134.0,35.0,19.0,16.0,98.0,41.0,57.0,31.0,17.0,14.0,10.0,10.0,0.0,083,91495,16
1608390437,"Buhl CCD, Twin Falls County, Idaho",9334.0,4798.0,4536.0,8234.0,4347.0,3887.0,347.0,178.0,169.0,385.0,148.0,237.0,332.0,102.0,230.0,36.0,23.0,13.0,083,90437,16
1608392415,"Murtaugh CCD, Twin Falls County, Idaho",1152.0,564.0,588.0,1007.0,480.0,527.0,59.0,35.0,24.0,54.0,22.0,32.0,15.0,10.0,5.0,17.0,17.0,0.0,083,92415,16
1608393818,"West Salmon Falls CCD, Twin Falls County, Idaho",248.0,136.0,112.0,236.0,132.0,104.0,0.0,0.0,0.0,0.0,0.0,0.0,12.0,4.0,8.0,0.0,0.0,0.0,083,93818,16
1608391840,"Kimberly CCD, Twin Falls County, Idaho",8454.0,4370.0,4084.0,7292.0,3923.0,3369.0,784.0,276.0,508.0,130.0,75.0,55.0,223.0,90.0,133.0,25.0,6.0,19.0,083,91840,16
1608390989,"Filer CCD, Twin Falls County, Idaho",5783.0,2842.0,2941.0,4855.0,2390.0,2465.0,539.0,291.0,248.0,228.0,97.0,131.0,161.0,64.0,97.0,0.0,0.0,0.0,083,90989,16
1608393565,"Twin Falls CCD, Twin Falls County, Idaho",53530.0,25936.0,27594.0,44012.0,21092.0,22920.0,5490.0,2874.0,2616.0,2295.0,1048.0,1247.0,1623.0,892.0,731.0,110.0,30.0,80.0,083,93565,16
1607392369,"Murphy CCD, Owyhee County, Idaho",1515.0,866.0,649.0,1426.0,795.0,631.0,53.0,40.0,13.0,1.0,0.0,1.0,25.0,21.0,4.0,10.0,10.0,0.0,073,92369,16
1601390529,"Carey CCD, Blaine County, Idaho",1126.0,608.0,518.0,999.0,516.0,483.0,36.0,16.0,20.0,34.0,22.0,12.0,52.0,52.0,0.0,5.0,2.0,3.0,013,90529,16
1607391311,"Grand View CCD, Owyhee County, Idaho",1082.0,550.0,532.0,901.0,444.0,457.0,45.0,29.0,16.0,95.0,53.0,42.0,41.0,24.0,17.0,0.0,0.0,0.0,073,91311,16
1607392070,"Marsing CCD, Owyhee County, Idaho",3246.0,1547.0,1699.0,2757.0,1366.0,1391.0,197.0,90.0,107.0,211.0,62.0,149.0,81.0,29.0,52.0,0.0,0.0,0.0,073,92070,16
1607391518,"Homedale CCD, Owyhee County, Idaho",4430.0,2393.0,2037.0,3654.0,1983.0,1671.0,104.0,46.0,58.0,366.0,206.0,160.0,284.0,151.0,133.0,22.0,7.0,15.0,073,91518,16
1607390414,"Bruneau CCD, Owyhee County, Idaho",711.0,310.0,401.0,586.0,241.0,345.0,29.0,11.0,18.0,90.0,55.0,35.0,6.0,3.0,3.0,0.0,0.0,0.0,073,90414,16
1601391817,"Ketchum CCD, Blaine County, Idaho",6651.0,3494.0,3157.0,5947.0,2993.0,2954.0,304.0,154.0,150.0,54.0,44.0,10.0,282.0,239.0,43.0,64.0,64.0,0.0,013,91817,16
1601391380,"Hailey-Bellevue CCD, Blaine County, Idaho",13563.0,6790.0,6773.0,12147.0,6228.0,5919.0,668.0,227.0,441.0,374.0,145.0,229.0,374.0,190.0,184.0,0.0,0.0,0.0,013,91380,16
1601591633,"Idaho City CCD, Boise County, Idaho",3198.0,1708.0,1490.0,2822.0,1464.0,1358.0,16.0,4.0,12.0,260.0,180.0,80.0,100.0,60.0,40.0,0.0,0.0,0.0,015,91633,16
1601591541,"Horseshoe Bend CCD, Boise County, Idaho",1626.0,851.0,775.0,1467.0,750.0,717.0,79.0,54.0,25.0,75.0,44.0,31.0,0.0,0.0,0.0,5.0,3.0,2.0,015,91541,16
1601591173,"Garden Valley CCD, Boise County, Idaho",2106.0,1101.0,1005.0,1709.0,885.0,824.0,131.0,84.0,47.0,145.0,45.0,100.0,104.0,80.0,24.0,17.0,7.0,10.0,015,91173,16
1602190391,"Bonners Ferry CCD, Boundary County, Idaho",7103.0,3634.0,3469.0,6499.0,3418.0,3081.0,178.0,71.0,107.0,331.0,106.0,225.0,88.0,32.0,56.0,7.0,7.0,0.0,021,90391,16
1602192323,"Moyie Springs CCD, Boundary County, Idaho",2862.0,1271.0,1591.0,2483.0,1082.0,1401.0,9.0,8.0,1.0,135.0,105.0,30.0,195.0,68.0,127.0,40.0,8.0,32.0,021,92323,16
1602391564,"Howe CCD, Butte County, Idaho",303.0,151.0,152.0,275.0,138.0,137.0,1.0,1.0,0.0,21.0,6.0,15.0,4.0,4.0,0.0,2.0,2.0,0.0,023,91564,16
1602390138,"Arco CCD, Butte County, Idaho",2296.0,1187.0,1109.0,2103.0,1086.0,1017.0,55.0,28.0,27.0,45.0,25.0,20.0,93.0,48.0,45.0,0.0,0.0,0.0,023,90138,16
1602991104,"Fort Hall CCD, Caribou County, Idaho",0.0,0.0,0.0,0.0,0.0,0.0,0.0,0.0,0.0,0.0,0.0,0.0,0.0,0.0,0.0,0.0,0.0,0.0,029,91104,16
1602993266,"Soda Springs CCD, Caribou County, Idaho",3579.0,1824.0,1755.0,3216.0,1629.0,1587.0,196.0,93.0,103.0,47.0,28.0,19.0,118.0,72.0,46.0,2.0,2.0,0.0,029,93266,16
1602990253,"Bancroft CCD, Caribou County, Idaho",774.0,410.0,364.0,712.0,373.0,339.0,0.0,0.0,0.0,46.0,27.0,19.0,8.0,2.0,6.0,8.0,8.0,0.0,029,90253,16
1602991288,"Grace CCD, Caribou County, Idaho",2178.0,1104.0,1074.0,1933.0,975.0,958.0,178.0,102.0,76.0,24.0,11.0,13.0,18.0,9.0,9.0,25.0,7.0,18.0,029,91288,16
1602993657,"Wayan CCD, Caribou County, Idaho",224.0,78.0,146.0,224.0,78.0,146.0,0.0,0.0,0.0,0.0,0.0,0.0,0.0,0.0,0.0,0.0,0.0,0.0,029,93657,16
1604790322,"Bliss CCD, Gooding County, Idaho",1143.0,536.0,607.0,1050.0,495.0,555.0,63.0,21.0,42.0,6.0,2.0,4.0,16.0,14.0,2.0,8.0,4.0,4.0,047,90322,16
1604793726,"Wendell CCD, Gooding County, Idaho",5100.0,2614.0,2486.0,4236.0,2207.0,2029.0,476.0,229.0,247.0,254.0,109.0,145.0,121.0,60.0,61.0,13.0,9.0,4.0,047,93726,16
1604791265,"Gooding CCD, Gooding County, Idaho",6286.0,3359.0,2927.0,5093.0,2641.0,2452.0,834.0,505.0,329.0,260.0,133.0,127.0,99.0,80.0,19.0,0.0,0.0,0.0,047,91265,16
1604791357,"Hagerman CCD, Gooding County, Idaho",2491.0,1206.0,1285.0,2080.0,987.0,1093.0,137.0,72.0,65.0,199.0,108.0,91.0,72.0,36.0,36.0,3.0,3.0,0.0,047,91357,16
1600191863,"Kuna CCD, Ada County, Idaho",23062.0,11980.0,11082.0,20329.0,10839.0,9490.0,2023.0,819.0,1204.0,188.0,90.0,98.0,485.0,212.0,273.0,37.0,20.0,17.0,001,91863,16
1600190368,"Boise Hills CCD, Ada County, Idaho",7160.0,3384.0,3776.0,6447.0,3054.0,3393.0,432.0,205.0,227.0,0.0,0.0,0.0,281.0,125.0,156.0,0.0,0.0,0.0,001,90368,16
1600190805,"Eagle CCD, Ada County, Idaho",39801.0,19895.0,19906.0,34335.0,16972.0,17363.0,2627.0,1312.0,1315.0,656.0,449.0,207.0,2082.0,1086.0,996.0,101.0,76.0,25.0,001,90805,16
1600190345,"Boise City CCD, Ada County, Idaho",340530.0,168361.0,172169.0,279440.0,138002.0,141438.0,37387.0,18001.0,19386.0,7104.0,3556.0,3548.0,14651.0,7732.0,6919.0,1948.0,1070.0,878.0,001,90345,16
1600192668,"Orchard CCD, Ada County, Idaho",20381.0,12097.0,8284.0,15448.0,8888.0,6560.0,2631.0,1544.0,1087.0,1312.0,1052.0,260.0,916.0,578.0,338.0,74.0,35.0,39.0,001,92668,16
1600593289,"South Bannock CCD, Bannock County, Idaho",5124.0,2520.0,2604.0,4498.0,2194.0,2304.0,360.0,180.0,180.0,112.0,77.0,35.0,154.0,69.0,85.0,0.0,0.0,0.0,005,93289,16
1600591058,"Fort Hall CCD, Bannock County, Idaho",2313.0,1259.0,1054.0,2114.0,1155.0,959.0,27.0,7.0,20.0,73.0,34.0,39.0,77.0,49.0,28.0,22.0,14.0,8.0,005,91058,16
1600591702,"Inkom CCD, Bannock County, Idaho",3819.0,1941.0,1878.0,3353.0,1661.0,1692.0,370.0,213.0,157.0,45.0,28.0,17.0,51.0,39.0,12.0,0.0,0.0,0.0,005,91702,16
1601193220,"Shelley CCD, Bingham County, Idaho",8071.0,4026.0,4045.0,7157.0,3528.0,3629.0,241.0,134.0,107.0,399.0,208.0,191.0,222.0,142.0,80.0,52.0,14.0,38.0,011,93220,16
1600792691,"Paris CCD, Bear Lake County, Idaho",1585.0,792.0,793.0,1416.0,711.0,705.0,131.0,64.0,67.0,9.0,4.0,5.0,29.0,13.0,16.0,0.0,0.0,0.0,007,92691,16
1600792208,"Montpelier CCD, Bear Lake County, Idaho",3496.0,1733.0,1763.0,3017.0,1502.0,1515.0,194.0,96.0,98.0,141.0,81.0,60.0,139.0,54.0,85.0,5.0,0.0,5.0,007,92208,16
1601192254,"Moreland CCD, Bingham County, Idaho",10567.0,5412.0,5155.0,9404.0,4715.0,4689.0,715.0,425.0,290.0,334.0,189.0,145.0,52.0,21.0,31.0,62.0,62.0,0.0,011,92254,16
1600592852,"Pocatello CCD, Bannock County, Idaho",71694.0,35579.0,36115.0,57515.0,28701.0,28814.0,8443.0,3749.0,4694.0,2862.0,1426.0,1436.0,2417.0,1432.0,985.0,457.0,271.0,186.0,005,92852,16
1600791219,"Georgetown CCD, Bear Lake County, Idaho",792.0,370.0,422.0,735.0,343.0,392.0,27.0,12.0,15.0,6.0,5.0,1.0,24.0,10.0,14.0,0.0,0.0,0.0,007,91219,16
1601190023,"Aberdeen CCD, Bingham County, Idaho",3561.0,1752.0,1809.0,3077.0,1511.0,1566.0,187.0,63.0,124.0,222.0,121.0,101.0,59.0,50.0,9.0,16.0,7.0,9.0,011,90023,16
1601190276,"Blackfoot CCD, Bingham County, Idaho",13937.0,6921.0,7016.0,11464.0,5725.0,5739.0,1469.0,732.0,737.0,405.0,221.0,184.0,574.0,218.0,356.0,25.0,25.0,0.0,011,90276,16
1601190207,"Atomic City CCD, Bingham County, Idaho",2009.0,1062.0,947.0,1802.0,934.0,868.0,90.0,33.0,57.0,75.0,61.0,14.0,35.0,27.0,8.0,7.0,7.0,0.0,011,90207,16
1601190069,"Alridge CCD, Bingham County, Idaho",532.0,305.0,227.0,532.0,305.0,227.0,0.0,0.0,0.0,0.0,0.0,0.0,0.0,0.0,0.0,0.0,0.0,0.0,011,90069,16
1601191081,"Fort Hall CCD, Bingham County, Idaho",2747.0,1341.0,1406.0,2604.0,1249.0,1355.0,48.0,44.0,4.0,48.0,30.0,18.0,47.0,18.0,29.0,0.0,0.0,0.0,011,91081,16
1601191012,"Firth CCD, Bingham County, Idaho",3195.0,1565.0,1630.0,2817.0,1355.0,1462.0,169.0,84.0,85.0,80.0,51.0,29.0,60.0,33.0,27.0,69.0,42.0,27.0,011,91012,16
1601991656,"Idaho Falls CCD, Bonneville County, Idaho",99034.0,49174.0,49860.0,80319.0,39609.0,40710.0,11554.0,5916.0,5638.0,2997.0,1487.0,1510.0,3524.0,1828.0,1696.0,640.0,334.0,306.0,019,91656,16
1601993404,"Swan Valley CCD, Bonneville County, Idaho",1252.0,591.0,661.0,1117.0,524.0,593.0,31.0,12.0,19.0,48.0,26.0,22.0,56.0,29.0,27.0,0.0,0.0,0.0,019,93404,16
1601993588,"Ucon CCD, Bonneville County, Idaho",6579.0,3606.0,2973.0,5631.0,3074.0,2557.0,424.0,193.0,231.0,289.0,197.0,92.0,216.0,123.0,93.0,19.0,19.0,0.0,019,93588,16
1601991679,"Idaho Falls West CCD, Bonneville County, Idaho",1723.0,856.0,867.0,1548.0,761.0,787.0,70.0,52.0,18.0,68.0,43.0,25.0,37.0,0.0,37.0,0.0,0.0,0.0,019,91679,16
1602593749,"West Camas CCD, Camas County, Idaho",589.0,289.0,300.0,491.0,235.0,256.0,51.0,32.0,19.0,0.0,0.0,0.0,47.0,22.0,25.0,0.0,0.0,0.0,025,93749,16
1602590828,"East Camas CCD, Camas County, Idaho",289.0,150.0,139.0,264.0,142.0,122.0,15.0,5.0,10.0,0.0,0.0,0.0,5.0,0.0,5.0,5.0,3.0,2.0,025,90828,16
1602791610,"Huston CCD, Canyon County, Idaho",3356.0,1524.0,1832.0,2889.0,1298.0,1591.0,240.0,100.0,140.0,72.0,54.0,18.0,155.0,72.0,83.0,0.0,0.0,0.0,027,91610,16
1602792093,"Melba CCD, Canyon County, Idaho",2577.0,1324.0,1253.0,2102.0,1019.0,1083.0,308.0,192.0,116.0,164.0,110.0,54.0,3.0,3.0,0.0,0.0,0.0,0.0,027,92093,16
1602792116,"Middleton CCD, Canyon County, Idaho",17658.0,8245.0,9413.0,14837.0,6998.0,7839.0,1342.0,641.0,701.0,579.0,280.0,299.0,869.0,295.0,574.0,31.0,31.0,0.0,027,92116,16
1602790483,"Caldwell CCD, Canyon County, Idaho",38557.0,18664.0,19893.0,30240.0,14275.0,15965.0,5305.0,2823.0,2482.0,1805.0,921.0,884.0,1142.0,586.0,556.0,65.0,59.0,6.0,027,90483,16
1602792438,"Nampa CCD, Canyon County, Idaho",128746.0,64717.0,64029.0,104603.0,52109.0,52494.0,12302.0,6361.0,5941.0,6463.0,3375.0,3088.0,4588.0,2501.0,2087.0,790.0,371.0,419.0,027,92438,16
1602793841,"Wilder CCD, Canyon County, Idaho",5284.0,2614.0,2670.0,4442.0,2214.0,2228.0,675.0,290.0,385.0,94.0,49.0,45.0,73.0,61.0,12.0,0.0,0.0,0.0,027,93841,16
1602792622,"Notus CCD, Canyon County, Idaho",2547.0,1262.0,1285.0,2070.0,1030.0,1040.0,402.0,177.0,225.0,25.0,12.0,13.0,50.0,43.0,7.0,0.0,0.0,0.0,027,92622,16
1602792714,"Parma CCD, Canyon County, Idaho",5588.0,2764.0,2824.0,4903.0,2466.0,2437.0,450.0,201.0,249.0,176.0,70.0,106.0,57.0,25.0,32.0,2.0,2.0,0.0,027,92714,16
1603592806,"Pierce-Headquarters CCD, Clearwater County, Idaho",1383.0,731.0,652.0,1248.0,645.0,603.0,54.0,31.0,23.0,4.0,3.0,1.0,54.0,29.0,25.0,23.0,23.0,0.0,035,92806,16
1603592530,"Nez Perce CCD, Clearwater County, Idaho",5577.0,3171.0,2406.0,4436.0,2408.0,2028.0,389.0,171.0,218.0,550.0,499.0,51.0,202.0,93.0,109.0,0.0,0.0,0.0,035,92530,16
1603590920,"Elk River CCD, Clearwater County, Idaho",339.0,169.0,170.0,269.0,124.0,145.0,0.0,0.0,0.0,24.0,16.0,8.0,46.0,29.0,17.0,0.0,0.0,0.0,035,90920,16
1603593680,"Weippe CCD, Clearwater County, Idaho",1172.0,626.0,546.0,1038.0,537.0,501.0,98.0,65.0,33.0,13.0,13.0,0.0,23.0,11.0,12.0,0.0,0.0,0.0,035,93680,16
1605192990,"Rigby CCD, Jefferson County, Idaho",18029.0,9233.0,8796.0,15525.0,7894.0,7631.0,829.0,425.0,404.0,1003.0,482.0,521.0,632.0,412.0,220.0,40.0,20.0,20.0,051,92990,16
1605193036,"Ririe CCD, Jefferson County, Idaho",1707.0,877.0,830.0,1561.0,803.0,758.0,67.0,27.0,40.0,25.0,8.0,17.0,54.0,39.0,15.0,0.0,0.0,0.0,051,93036,16
1605193059,"Roberts CCD, Jefferson County, Idaho",1365.0,757.0,608.0,1259.0,696.0,563.0,5.0,0.0,5.0,66.0,33.0,33.0,26.0,25.0,1.0,9.0,3.0,6.0,051,93059,16
1605191978,"Lewisville-Menan CCD, Jefferson County, Idaho",3943.0,1855.0,2088.0,3548.0,1658.0,1890.0,188.0,102.0,86.0,142.0,55.0,87.0,65.0,40.0,25.0,0.0,0.0,0.0,051,91978,16
1605791196,"Genesee CCD, Latah County, Idaho",1518.0,727.0,791.0,1247.0,600.0,647.0,118.0,52.0,66.0,56.0,24.0,32.0,97.0,51.0,46.0,0.0,0.0,0.0,057,91196,16
1605792277,"Moscow CCD, Latah County, Idaho",27812.0,14414.0,13398.0,18624.0,9487.0,9137.0,3670.0,1856.0,1814.0,2618.0,1503.0,1115.0,2423.0,1250.0,1173.0,477.0,318.0,159.0,057,92277,16
1605793542,"Troy-Juliaetta-Kendrick CCD, Latah County, Idaho",3545.0,1801.0,1744.0,2958.0,1480.0,1478.0,281.0,151.0,130.0,117.0,46.0,71.0,186.0,121.0,65.0,3.0,3.0,0.0,057,93542,16
1605790736,"Deary-Bovill CCD, Latah County, Idaho",1563.0,765.0,798.0,1420.0,693.0,727.0,117.0,51.0,66.0,7.0,2.0,5.0,19.0,19.0,0.0,0.0,0.0,0.0,057,90736,16
1605792898,"Potlatch CCD, Latah County, Idaho",3983.0,1979.0,2004.0,3473.0,1713.0,1760.0,393.0,204.0,189.0,92.0,44.0,48.0,25.0,18.0,7.0,0.0,0.0,0.0,057,92898,16
1605992737,"Patterson CCD, Lemhi County, Idaho",316.0,176.0,140.0,223.0,122.0,101.0,8.0,8.0,0.0,1.0,1.0,0.0,84.0,45.0,39.0,0.0,0.0,0.0,059,92737,16
1605991035,"Forney CCD, Lemhi County, Idaho",100.0,47.0,53.0,66.0,24.0,42.0,4.0,0.0,4.0,16.0,9.0,7.0,14.0,14.0,0.0,0.0,0.0,0.0,059,91035,16
1605991886,"Leadore CCD, Lemhi County, Idaho",598.0,290.0,308.0,523.0,252.0,271.0,0.0,0.0,0.0,12.0,6.0,6.0,61.0,30.0,31.0,2.0,2.0,0.0,059,91886,16
1605993174,"Salmon CCD, Lemhi County, Idaho",6667.0,3338.0,3329.0,5511.0,2773.0,2738.0,736.0,379.0,357.0,170.0,77.0,93.0,238.0,97.0,141.0,12.0,12.0,0.0,059,93174,16
1607591150,"Fruitland CCD, Payette County, Idaho",8195.0,3901.0,4294.0,6582.0,3201.0,3381.0,1029.0,433.0,596.0,234.0,93.0,141.0,325.0,160.0,165.0,25.0,14.0,11.0,075,91150,16
1607592783,"Payette CCD, Payette County, Idaho",9615.0,5077.0,4538.0,7362.0,3729.0,3633.0,1096.0,667.0,429.0,336.0,194.0,142.0,821.0,487.0,334.0,0.0,0.0,0.0,075,92783,16
1607592507,"New Plymouth CCD, Payette County, Idaho",4777.0,2336.0,2441.0,3972.0,1891.0,2081.0,490.0,258.0,232.0,85.0,50.0,35.0,197.0,111.0,86.0,33.0,26.0,7.0,075,92507,16
1600993450,"Tensed CCD, Benewah County, Idaho",649.0,316.0,333.0,539.0,256.0,283.0,40.0,18.0,22.0,35.0,29.0,6.0,35.0,13.0,22.0,0.0,0.0,0.0,009,93450,16
1600992829,"Plummer CCD, Benewah County, Idaho",1863.0,957.0,906.0,1578.0,825.0,753.0,103.0,52.0,51.0,93.0,35.0,58.0,89.0,45.0,44.0,0.0,0.0,0.0,009,92829,16
1600993151,"St. Maries CCD, Benewah County, Idaho",6482.0,3283.0,3199.0,5895.0,3028.0,2867.0,338.0,144.0,194.0,78.0,43.0,35.0,154.0,65.0,89.0,17.0,3.0,14.0,009,93151,16
1601790598,"Clark Fork CCD, Bonner County, Idaho",1992.0,1030.0,962.0,1688.0,883.0,805.0,179.0,85.0,94.0,59.0,24.0,35.0,64.0,38.0,26.0,2.0,0.0,2.0,017,90598,16
1601790299,"Blanchard-Glengary CCD, Bonner County, Idaho",14688.0,7550.0,7138.0,13258.0,6847.0,6411.0,490.0,316.0,174.0,413.0,164.0,249.0,527.0,223.0,304.0,0.0,0.0,0.0,017,90299,16
1601792944,"Priest River CCD, Bonner County, Idaho",5291.0,2623.0,2668.0,4666.0,2336.0,2330.0,378.0,168.0,210.0,50.0,41.0,9.0,186.0,71.0,115.0,11.0,7.0,4.0,017,92944,16
1601793197,"Sandpoint CCD, Bonner County, Idaho",19535.0,9537.0,9998.0,16078.0,7961.0,8117.0,1429.0,736.0,693.0,691.0,264.0,427.0,1320.0,559.0,761.0,17.0,17.0,0.0,017,93197,16
1603390851,"East Clark CCD, Clark County, Idaho",40.0,18.0,22.0,40.0,18.0,22.0,0.0,0.0,0.0,0.0,0.0,0.0,0.0,0.0,0.0,0.0,0.0,0.0,033,90851,16
1603393772,"West Clark CCD, Clark County, Idaho",986.0,529.0,457.0,840.0,432.0,408.0,39.0,21.0,18.0,47.0,45.0,2.0,60.0,31.0,29.0,0.0,0.0,0.0,033,93772,16
1603793335,"Stanley CCD, Custer County, Idaho",549.0,266.0,283.0,459.0,236.0,223.0,29.0,11.0,18.0,53.0,15.0,38.0,8.0,4.0,4.0,0.0,0.0,0.0,037,93335,16
1603790575,"Challis CCD, Custer County, Idaho",2268.0,1246.0,1022.0,2146.0,1177.0,969.0,77.0,46.0,31.0,16.0,16.0,0.0,29.0,7.0,22.0,0.0,0.0,0.0,037,90575,16
1603792024,"Mackay CCD, Custer County, Idaho",1296.0,639.0,657.0,1078.0,536.0,542.0,94.0,47.0,47.0,84.0,28.0,56.0,32.0,28.0,4.0,8.0,0.0,8.0,037,92024,16
1603990184,"Atlanta CCD, Elmore County, Idaho",447.0,242.0,205.0,409.0,218.0,191.0,4.0,4.0,0.0,4.0,4.0,0.0,17.0,3.0,14.0,13.0,13.0,0.0,039,90184,16
