B19001_001E,B19001_002E,B19001_003E,B19001_004E,B19001_005E,B19001_006E,B19001_007E,B19001_008E,B19001_009E,B19001_010E,B19001_011E,B19001_012E,B19001_013E,B19001_014E,B19001_015E,B19001_016E,B19001_017E,name,county,county subdivision,state
12392.0,787.0,732.0,599.0,486.0,614.0,813.0,694.0,767.0,722.0,1199.0,1673.0,1345.0,951.0,484.0,387.0,139.0,"Marana CCD, Pima County, Arizona",019,92040,04
1503.0,274.0,97.0,102.0,152.0,71.0,115.0,102.0,92.0,66.0,140.0,91.0,127.0,43.0,10.0,0.0,21.0,"Ajo CCD, Pima County, Arizona",019,90051,04
349216.0,27943.0,20437.0,20887.0,21677.0,19030.0,19807.0,16731.0,17809.0,14925.0,27762.0,33532.0,39992.0,24808.0,14817.0,14897.0,14162.0,"Tucson CCD, Pima County, Arizona",019,93570,04
33475.0,1819.0,1234.0,1735.0,1914.0,1922.0,1662.0,1941.0,1817.0,1739.0,3365.0,3980.0,4745.0,2605.0,1196.0,1092.0,709.0,"Arivaca CCD, Pima County, Arizona",019,90153,04
6084.0,391.0,189.0,149.0,235.0,332.0,208.0,254.0,227.0,98.0,601.0,662.0,833.0,673.0,515.0,365.0,352.0,"Gila Bend CCD, Maricopa County, Arizona",013,91377,04
147741.0,5075.0,2871.0,3534.0,3934.0,4255.0,5254.0,4868.0,5047.0,5308.0,10409.0,14999.0,21954.0,18643.0,12857.0,15140.0,13593.0,"Chandler CCD, Maricopa County, Arizona",013,90561,04
1159346.0,82077.0,53023.0,54888.0,62185.0,58233.0,59261.0,57001.0,60752.0,49799.0,98188.0,118710.0,140180.0,94755.0,54940.0,55224.0,60130.0,"Phoenix CCD, Maricopa County, Arizona",013,92601,04
98909.0,3204.0,1704.0,1785.0,2217.0,2767.0,3113.0,3368.0,3407.0,2937.0,6830.0,9559.0,14037.0,12633.0,9492.0,10863.0,10993.0,"Deer Valley CCD, Maricopa County, Arizona",013,90867,04
845.0,159.0,61.0,69.0,48.0,35.0,66.0,42.0,33.0,28.0,90.0,52.0,55.0,28.0,30.0,27.0,22.0,"St. Johns CCD, Maricopa County, Arizona",013,93009,04
897.0,185.0,95.0,37.0,42.0,51.0,76.0,39.0,51.0,52.0,37.0,81.0,58.0,50.0,17.0,8.0,18.0,"San Carlos CCD, Graham County, Arizona",009,93111,04
47690.0,2237.0,1750.0,2066.0,2212.0,2582.0,2906.0,2210.0,2535.0,2171.0,4301.0,5843.0,6418.0,4475.0,2070.0,2255.0,1659.0,"Wickenburg CCD, Maricopa County, Arizona",013,93774,04
21772.0,1220.0,733.0,803.0,648.0,894.0,996.0,1036.0,992.0,1124.0,2558.0,2747.0,3336.0,1994.0,1134.0,1002.0,555.0,"Buckeye CCD, Maricopa County, Arizona",013,90459,04
10430.0,802.0,581.0,671.0,670.0,686.0,513.0,637.0,606.0,596.0,808.0,1207.0,1281.0,452.0,370.0,241.0,309.0,"Payson CCD, Gila County, Arizona",007,92570,04
455.0,35.0,21.0,65.0,22.0,11.0,25.0,48.0,51.0,39.0,14.0,49.0,52.0,7.0,6.0,10.0,0.0,"Winkelman CCD, Gila County, Arizona",007,93927,04
2749.0,281.0,283.0,203.0,211.0,177.0,164.0,175.0,175.0,156.0,273.0,221.0,184.0,86.0,30.0,71.0,59.0,"Salt River CCD, Maricopa County, Arizona",013,93060,04
7132.0,595.0,508.0,529.0,558.0,559.0,371.0,359.0,395.0,380.0,540.0,548.0,859.0,503.0,129.0,221.0,78.0,"Globe-Miami CCD, Gila County, Arizona",007,91495,04
404.0,9.0,15.0,24.0,35.0,12.0,10.0,11.0,19.0,52.0,61.0,28.0,55.0,41.0,14.0,16.0,2.0,"Bonita-Klondyke CCD, Graham County, Arizona",009,90357,04
1393.0,151.0,94.0,61.0,61.0,110.0,88.0,53.0,65.0,12.0,112.0,173.0,235.0,55.0,88.0,35.0,0.0,"Pima CCD, Graham County, Arizona",009,92652,04
8282.0,822.0,502.0,414.0,507.0,384.0,416.0,265.0,419.0,428.0,614.0,963.0,1313.0,677.0,295.0,211.0,52.0,"Safford CCD, Graham County, Arizona",009,92907,04
14165.0,1504.0,1026.0,825.0,1132.0,1112.0,998.0,658.0,625.0,831.0,1228.0,1053.0,1342.0,712.0,413.0,415.0,291.0,"Nogales CCD, Santa Cruz County, Arizona",023,92295,04
1403.0,153.0,101.0,74.0,53.0,38.0,113.0,55.0,77.0,74.0,128.0,94.0,125.0,122.0,82.0,68.0,46.0,"Patagonia CCD, Santa Cruz County, Arizona",023,92550,04
5266.0,628.0,401.0,368.0,330.0,404.0,277.0,188.0,185.0,163.0,595.0,509.0,476.0,279.0,204.0,141.0,118.0,"Benson CCD, Cochise County, Arizona",003,90255,04
19951.0,1285.0,1166.0,1102.0,1044.0,1243.0,1087.0,831.0,1050.0,713.0,1751.0,2337.0,2584.0,1428.0,1067.0,778.0,485.0,"Sierra Vista CCD, Cochise County, Arizona",003,93182,04
4040.0,271.0,401.0,291.0,360.0,172.0,242.0,157.0,296.0,239.0,315.0,540.0,336.0,196.0,74.0,60.0,90.0,"Willcox CCD, Cochise County, Arizona",003,93825,04
5033.0,653.0,686.0,466.0,263.0,318.0,418.0,214.0,251.0,250.0,365.0,378.0,463.0,226.0,15.0,33.0,34.0,"Douglas CCD, Cochise County, Arizona",003,90969,04
12684.0,908.0,694.0,617.0,633.0,540.0,509.0,583.0,652.0,645.0,839.0,1227.0,1756.0,1132.0,789.0,462.0,698.0,"Bisbee CCD, Cochise County, Arizona",003,90306,04
8798.0,789.0,785.0,565.0,984.0,702.0,445.0,503.0,430.0,390.0,638.0,854.0,997.0,371.0,176.0,113.0,56.0,"Parker CCD, La Paz County, Arizona",012,92480,04
1453.0,153.0,93.0,155.0,79.0,113.0,89.0,61.0,71.0,98.0,89.0,100.0,135.0,117.0,40.0,52.0,8.0,"Elfrida CCD, Cochise County, Arizona",003,91122,04
733.0,64.0,88.0,45.0,92.0,32.0,41.0,54.0,42.0,33.0,32.0,76.0,47.0,56.0,17.0,9.0,5.0,"Bowie CCD, Cochise County, Arizona",003,90408,04
126.0,13.0,13.0,9.0,24.0,12.0,7.0,2.0,14.0,8.0,6.0,5.0,3.0,3.0,5.0,2.0,0.0,"Fort Apache CCD, Apache County, Arizona",001,91275,04
388.0,120.0,43.0,19.0,33.0,25.0,9.0,7.0,24.0,10.0,19.0,27.0,36.0,8.0,3.0,5.0,0.0,"Dennehotso CCD, Apache County, Arizona",001,90918,04
1265.0,312.0,147.0,91.0,101.0,64.0,77.0,61.0,45.0,55.0,90.0,96.0,50.0,34.0,20.0,16.0,6.0,"Sweetwater CCD, Apache County, Arizona",001,93315,04
5315.0,1439.0,505.0,401.0,309.0,342.0,354.0,238.0,160.0,189.0,365.0,370.0,366.0,148.0,76.0,46.0,7.0,"Chinle CCD, Apache County, Arizona",001,90612,04
6152.0,1585.0,551.0,417.0,449.0,281.0,298.0,315.0,240.0,232.0,369.0,523.0,418.0,239.0,109.0,99.0,27.0,"Fort Defiance CCD, Apache County, Arizona",001,91326,04
2868.0,100.0,194.0,179.0,97.0,139.0,85.0,112.0,198.0,107.0,264.0,425.0,495.0,211.0,133.0,81.0,48.0,"Eagar-Springerville CCD, Apache County, Arizona",001,91071,04
672.0,137.0,64.0,51.0,27.0,59.0,32.0,22.0,27.0,30.0,87.0,31.0,54.0,4.0,16.0,31.0,0.0,"Puerco CCD, Apache County, Arizona",001,92805,04
2744.0,175.0,170.0,270.0,147.0,130.0,144.0,208.0,180.0,124.0,303.0,200.0,245.0,274.0,130.0,34.0,10.0,"St. Johns CCD, Apache County, Arizona",001,92958,04
9045.0,1297.0,586.0,561.0,452.0,522.0,355.0,409.0,466.0,386.0,715.0,872.0,1149.0,535.0,359.0,252.0,129.0,"Tuba City CCD, Coconino County, Arizona",005,93519,04
2.0,2.0,0.0,0.0,0.0,0.0,0.0,0.0,0.0,0.0,0.0,0.0,0.0,0.0,0.0,0.0,0.0,"Havasupai CCD, Coconino County, Arizona",005,91530,04
0.0,0.0,0.0,0.0,0.0,0.0,0.0,0.0,0.0,0.0,0.0,0.0,0.0,0.0,0.0,0.0,0.0,"Hualapai CCD, Coconino County, Arizona",005,91683,04
10.0,0.0,0.0,10.0,0.0,0.0,0.0,0.0,0.0,0.0,0.0,0.0,0.0,0.0,0.0,0.0,0.0,"Hopi CCD, Coconino County, Arizona",005,91581,04
4119.0,384.0,80.0,335.0,204.0,286.0,380.0,237.0,200.0,80.0,325.0,429.0,504.0,248.0,219.0,117.0,91.0,"Williams CCD, Coconino County, Arizona",005,93876,04
53335.0,3432.0,2997.0,2744.0,3324.0,2962.0,2670.0,2759.0,3182.0,2395.0,5256.0,6052.0,6330.0,3621.0,2484.0,1776.0,1351.0,"Prescott CCD, Yavapai County, Arizona",025,92754,04
4112.0,323.0,263.0,260.0,397.0,381.0,243.0,278.0,162.0,208.0,329.0,450.0,425.0,150.0,102.0,98.0,43.0,"Congress CCD, Yavapai County, Arizona",025,90765,04
16083.0,1231.0,907.0,1052.0,1101.0,1261.0,769.0,755.0,884.0,1000.0,1540.0,2006.0,1611.0,977.0,464.0,254.0,271.0,"Mingus Mountain CCD, Yavapai County, Arizona",025,92193,04
53564.0,4125.0,3071.0,3282.0,3343.0,3528.0,3217.0,2985.0,2855.0,2658.0,4510.0,5453.0,6502.0,3561.0,1818.0,1513.0,1143.0,"Yuma CCD, Yuma County, Arizona",027,93978,04
2842.0,199.0,165.0,83.0,180.0,215.0,173.0,197.0,202.0,192.0,239.0,384.0,250.0,247.0,31.0,39.0,46.0,"Wellton CCD, Yuma County, Arizona",027,93672,04
15264.0,1306.0,1176.0,1483.0,1076.0,1212.0,1352.0,677.0,969.0,534.0,1493.0,1550.0,1092.0,646.0,218.0,278.0,202.0,"Somerton CCD, Yuma County, Arizona",027,93264,04
2317.0,61.0,40.0,99.0,51.0,91.0,143.0,82.0,224.0,135.0,162.0,365.0,411.0,219.0,108.0,103.0,23.0,"Clifton CCD, Greenlee County, Arizona",011,90663,04
1047.0,73.0,95.0,63.0,79.0,70.0,37.0,66.0,34.0,103.0,27.0,81.0,94.0,106.0,45.0,47.0,27.0,"Duncan CCD, Greenlee County, Arizona",011,91020,04
9103.0,938.0,626.0,522.0,746.0,563.0,391.0,615.0,439.0,437.0,1020.0,676.0,1073.0,438.0,329.0,208.0,82.0,"Eloy CCD, Pinal County, Arizona",021,91173,04
17672.0,1637.0,1099.0,991.0,980.0,1142.0,854.0,897.0,981.0,680.0,1549.0,1986.0,2229.0,969.0,562.0,756.0,360.0,"Snowflake CCD, Navajo County, Arizona",017,93213,04
2105.0,467.0,161.0,140.0,142.0,65.0,105.0,100.0,113.0,82.0,172.0,138.0,165.0,87.0,78.0,72.0,18.0,"Hopi CCD, Navajo County, Arizona",017,91632,04
1935.0,485.0,210.0,144.0,144.0,136.0,111.0,81.0,72.0,100.0,97.0,118.0,114.0,67.0,26.0,26.0,4.0,"Indian Wells CCD, Navajo County, Arizona",017,91785,04
8201.0,494.0,419.0,331.0,493.0,463.0,321.0,338.0,454.0,559.0,771.0,1007.0,1248.0,570.0,318.0,249.0,166.0,"Florence CCD, Pinal County, Arizona",021,91224,04
60551.0,4243.0,2057.0,3214.0,2861.0,3077.0,2878.0,3259.0,2775.0,3089.0,5600.0,7222.0,8781.0,5233.0,2488.0,1975.0,1799.0,"North Pinal CCD, Pinal County, Arizona",021,92346,04
5294.0,435.0,325.0,437.0,265.0,493.0,361.0,367.0,262.0,117.0,566.0,498.0,642.0,178.0,185.0,100.0,63.0,"Coolidge CCD, Pinal County, Arizona",021,90816,04
17169.0,1155.0,407.0,720.0,430.0,697.0,814.0,846.0,696.0,784.0,1538.0,2269.0,2535.0,1839.0,962.0,1022.0,455.0,"Maricopa-Stanfield CCD, Pinal County, Arizona",021,92091,04
2518.0,1026.0,212.0,213.0,132.0,187.0,67.0,62.0,169.0,50.0,86.0,39.0,216.0,59.0,0.0,0.0,0.0,"Gila River CCD, Pinal County, Arizona",021,91428,04
21137.0,1810.0,1121.0,1048.0,1369.0,1230.0,1251.0,1272.0,942.0,1045.0,2048.0,2214.0,2566.0,1338.0,861.0,741.0,281.0,"Casa Grande CCD, Pinal County, Arizona",021,90510,04
9437.0,550.0,285.0,262.0,475.0,484.0,541.0,437.0,499.0,466.0,904.0,1347.0,1326.0,804.0,330.0,472.0,255.0,"San Manuel CCD, Pinal County, Arizona",021,93162,04
27744.0,2497.0,2188.0,2732.0,1752.0,2198.0,1589.0,1476.0,1528.0,1037.0,2710.0,2576.0,2519.0,1275.0,701.0,574.0,392.0,"Kingman CCD, Mohave County, Arizona",015,91885,04
1062.0,99.0,100.0,104.0,85.0,161.0,48.0,30.0,45.0,0.0,53.0,83.0,139.0,44.0,0.0,30.0,41.0,"Ash Fork CCD, Yavapai County, Arizona",025,90204,04
4397.0,178.0,125.0,94.0,54.0,160.0,150.0,114.0,114.0,102.0,178.0,255.0,606.0,528.0,254.0,497.0,988.0,"Tonto National Forest CCD, Maricopa County, Arizona",013,93472,04
16871.0,1253.0,1096.0,827.0,811.0,932.0,875.0,1051.0,1040.0,742.0,1579.0,1840.0,2055.0,988.0,469.0,610.0,703.0,"Camp Verde-Sedona CCD, Yavapai County, Arizona",025,90484,04
33639.0,2792.0,1796.0,1802.0,1139.0,1731.0,1558.0,1346.0,1448.0,1377.0,2357.0,3405.0,4617.0,2953.0,1783.0,1647.0,1888.0,"Flagstaff CCD, Coconino County, Arizona",005,91198,04
773.0,20.0,40.0,46.0,84.0,57.0,52.0,48.0,15.0,29.0,48.0,120.0,87.0,31.0,51.0,0.0,45.0,"Kaibab Plateau CCD, Coconino County, Arizona",005,91838,04
27906.0,2139.0,1775.0,1650.0,2524.0,2201.0,2090.0,1514.0,1698.0,1620.0,2682.0,2668.0,2545.0,1302.0,537.0,528.0,433.0,"Bullhead City CCD, Mohave County, Arizona",015,90470,04
2548.0,319.0,60.0,217.0,95.0,81.0,270.0,280.0,184.0,175.0,251.0,133.0,259.0,57.0,80.0,63.0,24.0,"North Mohave CCD, Mohave County, Arizona",015,92340,04
25704.0,1451.0,1414.0,1349.0,1433.0,1586.0,1722.0,1562.0,1769.0,1279.0,2582.0,2511.0,2862.0,1780.0,1043.0,811.0,550.0,"Lake Havasu City CCD, Mohave County, Arizona",015,91964,04
2899.0,721.0,210.0,302.0,157.0,177.0,191.0,156.0,83.0,104.0,228.0,194.0,203.0,72.0,44.0,42.0,15.0,"Fort Apache CCD, Navajo County, Arizona",017,91279,04
5162.0,590.0,509.0,331.0,321.0,252.0,290.0,269.0,149.0,267.0,352.0,550.0,630.0,259.0,198.0,132.0,63.0,"Winslow-Holbrook CCD, Navajo County, Arizona",017,93952,04
2678.0,641.0,185.0,222.0,282.0,189.0,88.0,105.0,131.0,68.0,137.0,210.0,155.0,165.0,53.0,17.0,30.0,"Kayenta CCD, Navajo County, Arizona",017,91860,04
1435.0,291.0,144.0,116.0,41.0,93.0,55.0,133.0,103.0,47.0,79.0,26.0,96.0,129.0,41.0,34.0,7.0,"San Carlos CCD, Gila County, Arizona",007,93109,04
1615.0,174.0,155.0,132.0,182.0,94.0,153.0,65.0,97.0,56.0,145.0,86.0,151.0,5.0,80.0,40.0,0.0,"Tonto Basin CCD, Gila County, Arizona",007,93470,04
518.0,107.0,63.0,44.0,57.0,33.0,20.0,49.0,21.0,21.0,32.0,25.0,40.0,6.0,0.0,0.0,0.0,"Fort Apache CCD, Gila County, Arizona",007,91277,04
2880.0,71.0,86.0,176.0,452.0,119.0,113.0,192.0,78.0,258.0,308.0,270.0,299.0,222.0,121.0,86.0,29.0,"Cordes Lakes-Mayer CCD, Yavapai County, Arizona",025,90840,04
1800.0,487.0,211.0,172.0,89.0,92.0,63.0,95.0,99.0,76.0,119.0,103.0,104.0,46.0,22.0,10.0,12.0,"Piñon CCD, Navajo County, Arizona",017,92703,04
103.0,14.0,0.0,18.0,0.0,0.0,39.0,19.0,0.0,0.0,13.0,0.0,0.0,0.0,0.0,0.0,0.0,"Tohono O'odham Nation CCD, Pinal County, Arizona",021,93377,04
1944.0,512.0,159.0,181.0,130.0,69.0,82.0,105.0,95.0,64.0,133.0,120.0,194.0,25.0,20.0,49.0,6.0,"Tohono O'odham Nation CCD, Pima County, Arizona",019,93375,04
