1189.0,68.0,104.0,65.0,45.0,111.0,55.0,172.0,30.0,47.0,141.0,106.0,140.0,68.0,20.0,7.0,10.0,"Adolphus CCD, Allen County, Kentucky",003,90024,21
1242.0,75.0,54.0,37.0,74.0,70.0,37.0,98.0,57.0,34.0,122.0,175.0,103.0,96.0,68.0,57.0,85.0,"Settle CCD, Allen County, Kentucky",003,93136,21
563.0,55.0,67.0,62.0,18.0,14.0,28.0,42.0,31.0,22.0,56.0,51.0,76.0,0.0,23.0,13.0,5.0,"Holland CCD, Allen County, Kentucky",003,91760,21
992.0,85.0,76.0,59.0,53.0,26.0,64.0,57.0,51.0,52.0,70.0,111.0,144.0,55.0,30.0,41.0,18.0,"Halfway CCD, Allen County, Kentucky",003,91560,21
853.0,40.0,38.0,46.0,100.0,44.0,35.0,33.0,63.0,56.0,74.0,107.0,109.0,47.0,28.0,8.0,25.0,"North Middletown CCD, Bourbon County, Kentucky",017,92576,21
918.0,80.0,63.0,46.0,73.0,35.0,50.0,45.0,59.0,32.0,76.0,99.0,104.0,93.0,35.0,18.0,10.0,"Millersburg CCD, Bourbon County, Kentucky",017,92328,21
6345.0,510.0,326.0,382.0,388.0,508.0,338.0,357.0,290.0,136.0,549.0,533.0,868.0,548.0,208.0,257.0,147.0,"Paris CCD, Bourbon County, Kentucky",017,92680,21
2317.0,264.0,148.0,129.0,159.0,147.0,111.0,129.0,165.0,129.0,168.0,193.0,246.0,159.0,75.0,66.0,29.0,"Catlettsburg CCD, Boyd County, Kentucky",019,90632,21
11168.0,1700.0,939.0,586.0,728.0,579.0,534.0,621.0,453.0,378.0,871.0,915.0,1308.0,664.0,317.0,294.0,281.0,"Ashland CCD, Boyd County, Kentucky",019,90104,21
3011.0,123.0,49.0,146.0,190.0,96.0,257.0,60.0,235.0,116.0,287.0,481.0,372.0,292.0,131.0,83.0,93.0,"Cannonsburg CCD, Boyd County, Kentucky",019,90576,21
0.0,0.0,0.0,0.0,0.0,0.0,0.0,0.0,0.0,0.0,0.0,0.0,0.0,0.0,0.0,0.0,0.0,"Fort Knox CCD, Bullitt County, Kentucky",029,91296,21
3776.0,104.0,18.0,174.0,58.0,142.0,144.0,204.0,155.0,255.0,374.0,512.0,820.0,375.0,111.0,239.0,91.0,"Shepherdsville Southeast CCD, Bullitt County, Kentucky",029,93168,21
13914.0,718.0,548.0,744.0,710.0,733.0,709.0,819.0,781.0,715.0,1251.0,2050.0,1778.0,1244.0,609.0,363.0,142.0,"Shepherdsville Northwest CCD, Bullitt County, Kentucky",029,93160,21
1744.0,87.0,51.0,98.0,108.0,61.0,155.0,93.0,119.0,58.0,174.0,209.0,320.0,102.0,30.0,67.0,12.0,"Lebanon Junction CCD, Bullitt County, Kentucky",029,92008,21
9580.0,413.0,343.0,425.0,539.0,216.0,219.0,431.0,408.0,402.0,773.0,1052.0,1584.0,1317.0,628.0,554.0,276.0,"Mount Washington CCD, Bullitt County, Kentucky",029,92440,21
1824.0,133.0,202.0,94.0,178.0,141.0,89.0,110.0,103.0,50.0,162.0,125.0,206.0,124.0,52.0,26.0,29.0,"Marion CCD, Crittenden County, Kentucky",055,92240,21
1408.0,229.0,87.0,178.0,123.0,75.0,74.0,48.0,60.0,112.0,78.0,89.0,107.0,63.0,57.0,20.0,8.0,"Fulton CCD, Fulton County, Kentucky",075,91360,21
1055.0,183.0,128.0,109.0,92.0,71.0,83.0,34.0,31.0,45.0,83.0,92.0,57.0,32.0,0.0,12.0,3.0,"Hickman CCD, Fulton County, Kentucky",075,91712,21
958.0,116.0,68.0,64.0,59.0,70.0,88.0,86.0,65.0,60.0,58.0,40.0,61.0,77.0,30.0,8.0,8.0,"Flatgap CCD, Johnson County, Kentucky",115,91256,21
1118.0,73.0,86.0,124.0,136.0,59.0,34.0,101.0,43.0,31.0,90.0,111.0,119.0,11.0,40.0,60.0,0.0,"Oil Springs CCD, Johnson County, Kentucky",115,92600,21
5454.0,922.0,516.0,411.0,281.0,277.0,274.0,304.0,239.0,120.0,466.0,447.0,554.0,294.0,176.0,98.0,75.0,"Paintsville CCD, Johnson County, Kentucky",115,92672,21
1241.0,181.0,108.0,145.0,129.0,55.0,28.0,101.0,67.0,32.0,109.0,99.0,24.0,69.0,35.0,34.0,25.0,"Nippa CCD, Johnson County, Kentucky",115,92560,21
1501.0,216.0,164.0,172.0,54.0,117.0,136.0,40.0,65.0,29.0,116.0,118.0,121.0,67.0,42.0,39.0,5.0,"Hindman CCD, Knott County, Kentucky",119,91736,21
1029.0,144.0,111.0,137.0,95.0,96.0,15.0,78.0,49.0,36.0,68.0,65.0,82.0,46.0,0.0,7.0,0.0,"Mousie CCD, Knott County, Kentucky",119,92448,21
1554.0,313.0,115.0,147.0,100.0,101.0,79.0,60.0,114.0,70.0,106.0,125.0,137.0,13.0,19.0,25.0,30.0,"Carr Fork CCD, Knott County, Kentucky",119,90600,21
1105.0,120.0,117.0,88.0,58.0,52.0,25.0,65.0,69.0,38.0,152.0,103.0,86.0,31.0,39.0,62.0,0.0,"Emmalena CCD, Knott County, Kentucky",119,91160,21
1553.0,145.0,126.0,128.0,145.0,119.0,114.0,30.0,116.0,87.0,124.0,207.0,101.0,74.0,22.0,7.0,8.0,"Frenchburg CCD, Menifee County, Kentucky",165,91344,21
830.0,66.0,80.0,51.0,63.0,36.0,40.0,107.0,33.0,67.0,45.0,67.0,85.0,53.0,23.0,14.0,0.0,"Grassy Creek CCD, Morgan County, Kentucky",175,91456,21
1452.0,160.0,120.0,136.0,140.0,51.0,51.0,58.0,54.0,84.0,171.0,166.0,123.0,51.0,30.0,43.0,14.0,"West Liberty CCD, Morgan County, Kentucky",175,93656,21
756.0,36.0,82.0,86.0,89.0,57.0,39.0,12.0,32.0,65.0,41.0,77.0,77.0,28.0,20.0,10.0,5.0,"Wrigley CCD, Morgan County, Kentucky",175,93776,21
916.0,147.0,133.0,133.0,82.0,38.0,70.0,37.0,60.0,36.0,32.0,62.0,42.0,19.0,20.0,0.0,5.0,"Cannel City CCD, Morgan County, Kentucky",175,90568,21
789.0,41.0,46.0,82.0,29.0,46.0,54.0,33.0,31.0,37.0,77.0,108.0,89.0,43.0,54.0,19.0,0.0,"Penrod CCD, Muhlenberg County, Kentucky",177,92736,21
1357.0,96.0,80.0,29.0,55.0,100.0,197.0,88.0,110.0,25.0,100.0,220.0,102.0,102.0,36.0,14.0,3.0,"Bremen CCD, Muhlenberg County, Kentucky",177,90352,21
3089.0,347.0,273.0,217.0,235.0,236.0,184.0,116.0,109.0,194.0,228.0,298.0,344.0,112.0,29.0,119.0,48.0,"Central City CCD, Muhlenberg County, Kentucky",177,90680,21
1312.0,96.0,95.0,150.0,56.0,50.0,128.0,56.0,68.0,44.0,163.0,161.0,108.0,77.0,1.0,24.0,35.0,"Drakesboro CCD, Muhlenberg County, Kentucky",177,91080,21
4252.0,377.0,425.0,302.0,203.0,390.0,298.0,301.0,207.0,76.0,260.0,371.0,484.0,256.0,220.0,64.0,18.0,"Greenville CCD, Muhlenberg County, Kentucky",177,91520,21
617.0,43.0,42.0,42.0,14.0,21.0,12.0,18.0,72.0,71.0,61.0,77.0,87.0,38.0,19.0,0.0,0.0,"Rosewood CCD, Muhlenberg County, Kentucky",177,92952,21
6011.0,997.0,467.0,569.0,411.0,388.0,220.0,244.0,392.0,288.0,514.0,501.0,473.0,133.0,158.0,52.0,204.0,"Hazard CCD, Perry County, Kentucky",193,91648,21
1192.0,190.0,128.0,69.0,93.0,92.0,64.0,20.0,72.0,86.0,63.0,125.0,72.0,38.0,41.0,39.0,0.0,"Krypton CCD, Perry County, Kentucky",193,91944,21
640.0,89.0,74.0,74.0,45.0,67.0,57.0,12.0,49.0,14.0,37.0,41.0,34.0,43.0,4.0,0.0,0.0,"Daisy CCD, Perry County, Kentucky",193,90992,21
359.0,121.0,14.0,23.0,9.0,41.0,61.0,9.0,19.0,6.0,0.0,11.0,28.0,15.0,2.0,0.0,0.0,"Buckhorn CCD, Perry County, Kentucky",193,90408,21
1131.0,74.0,171.0,86.0,86.0,79.0,52.0,43.0,37.0,35.0,92.0,141.0,112.0,101.0,8.0,4.0,10.0,"Viper CCD, Perry County, Kentucky",193,93576,21
688.0,187.0,47.0,96.0,62.0,24.0,29.0,41.0,15.0,42.0,47.0,35.0,27.0,21.0,10.0,0.0,5.0,"Defiance-Vicco CCD, Perry County, Kentucky",193,91032,21
1016.0,151.0,99.0,51.0,24.0,46.0,44.0,34.0,60.0,55.0,76.0,123.0,146.0,18.0,34.0,26.0,29.0,"Dice CCD, Perry County, Kentucky",193,91048,21
2063.0,243.0,100.0,159.0,133.0,107.0,159.0,140.0,68.0,38.0,196.0,250.0,249.0,120.0,42.0,43.0,16.0,"Nancy CCD, Pulaski County, Kentucky",199,92488,21
663.0,91.0,31.0,101.0,46.0,50.0,53.0,38.0,21.0,38.0,71.0,73.0,7.0,21.0,7.0,10.0,5.0,"Mount Victory CCD, Pulaski County, Kentucky",199,92432,21
2278.0,363.0,136.0,218.0,99.0,104.0,189.0,88.0,38.0,180.0,192.0,151.0,178.0,275.0,11.0,21.0,35.0,"Eubank CCD, Pulaski County, Kentucky",199,91176,21
1037.0,159.0,79.0,153.0,93.0,25.0,46.0,69.0,72.0,28.0,41.0,117.0,96.0,24.0,7.0,11.0,17.0,"Shopville CCD, Pulaski County, Kentucky",199,93184,21
15179.0,2376.0,1286.0,1078.0,1050.0,921.0,775.0,543.0,844.0,938.0,974.0,1142.0,1311.0,829.0,588.0,315.0,209.0,"Somerset CCD, Pulaski County, Kentucky",199,93256,21
2033.0,324.0,192.0,136.0,154.0,108.0,135.0,120.0,74.0,65.0,156.0,181.0,240.0,104.0,4.0,18.0,22.0,"Science Hill CCD, Pulaski County, Kentucky",199,93104,21
2557.0,401.0,310.0,231.0,101.0,204.0,181.0,152.0,145.0,81.0,205.0,155.0,178.0,127.0,18.0,29.0,39.0,"Burnside CCD, Pulaski County, Kentucky",199,90456,21
382.0,37.0,82.0,30.0,37.0,10.0,13.0,60.0,0.0,41.0,22.0,7.0,36.0,7.0,0.0,0.0,0.0,"Malaga CCD, Wolfe County, Kentucky",237,92208,21
796.0,132.0,90.0,33.0,88.0,60.0,104.0,33.0,22.0,71.0,69.0,46.0,17.0,31.0,0.0,0.0,0.0,"Hazel Green CCD, Wolfe County, Kentucky",237,91656,21
1675.0,459.0,136.0,254.0,132.0,76.0,66.0,105.0,92.0,11.0,83.0,95.0,79.0,15.0,6.0,36.0,30.0,"Campton CCD, Wolfe County, Kentucky",237,90544,21
486.0,111.0,107.0,54.0,36.0,13.0,28.0,21.0,20.0,30.0,20.0,30.0,0.0,0.0,0.0,16.0,0.0,"Ashers Fork CCD, Clay County, Kentucky",051,90096,21
2148.0,383.0,72.0,265.0,211.0,90.0,96.0,160.0,59.0,154.0,90.0,152.0,298.0,118.0,0.0,0.0,0.0,"Burning Springs CCD, Clay County, Kentucky",051,90448,21
764.0,157.0,95.0,105.0,43.0,18.0,38.0,45.0,40.0,10.0,46.0,83.0,31.0,39.0,14.0,0.0,0.0,"Oneida CCD, Clay County, Kentucky",051,92616,21
1316.0,413.0,210.0,160.0,77.0,64.0,113.0,34.0,9.0,48.0,77.0,40.0,35.0,10.0,12.0,14.0,0.0,"Big Creek CCD, Clay County, Kentucky",051,90248,21
1952.0,463.0,153.0,208.0,110.0,95.0,124.0,111.0,59.0,41.0,99.0,148.0,127.0,100.0,41.0,17.0,56.0,"Manchester CCD, Clay County, Kentucky",051,92216,21
1053.0,161.0,147.0,131.0,37.0,137.0,29.0,58.0,47.0,39.0,48.0,45.0,133.0,22.0,9.0,0.0,10.0,"Sibert-Hima CCD, Clay County, Kentucky",051,93200,21
1148.0,103.0,120.0,90.0,95.0,83.0,134.0,29.0,60.0,15.0,36.0,196.0,81.0,66.0,0.0,31.0,9.0,"White Oak CCD, Adair County, Kentucky",001,93680,21
612.0,73.0,20.0,47.0,53.0,85.0,57.0,24.0,43.0,10.0,47.0,42.0,93.0,0.0,10.0,8.0,0.0,"Casey Creek CCD, Adair County, Kentucky",001,90624,21
532.0,36.0,50.0,62.0,76.0,29.0,39.0,30.0,46.0,45.0,24.0,36.0,35.0,0.0,8.0,5.0,11.0,"Glens Fork CCD, Adair County, Kentucky",001,91416,21
893.0,147.0,70.0,37.0,41.0,38.0,38.0,47.0,33.0,79.0,102.0,92.0,69.0,64.0,26.0,10.0,0.0,"Gradyville CCD, Adair County, Kentucky",001,91432,21
749.0,26.0,73.0,43.0,50.0,39.0,29.0,75.0,73.0,25.0,82.0,40.0,124.0,33.0,22.0,15.0,0.0,"Cane Valley CCD, Adair County, Kentucky",001,90552,21
3772.0,846.0,411.0,371.0,399.0,162.0,172.0,172.0,133.0,133.0,268.0,254.0,244.0,179.0,19.0,9.0,0.0,"Pineville CCD, Bell County, Kentucky",013,92808,21
3167.0,482.0,309.0,278.0,190.0,151.0,134.0,127.0,270.0,160.0,246.0,231.0,278.0,132.0,63.0,66.0,50.0,"Columbia CCD, Adair County, Kentucky",001,90784,21
638.0,185.0,52.0,10.0,9.0,43.0,93.0,27.0,33.0,12.0,22.0,59.0,62.0,31.0,0.0,0.0,0.0,"Kentucky Ridge CCD, Bell County, Kentucky",013,91920,21
5417.0,1221.0,765.0,484.0,352.0,293.0,445.0,256.0,325.0,297.0,252.0,145.0,278.0,124.0,55.0,71.0,54.0,"Middlesborough CCD, Bell County, Kentucky",013,92304,21
737.0,203.0,34.0,73.0,74.0,41.0,79.0,29.0,10.0,31.0,67.0,23.0,51.0,12.0,5.0,0.0,5.0,"Tejay CCD, Bell County, Kentucky",013,93456,21
499.0,52.0,123.0,59.0,15.0,74.0,39.0,0.0,15.0,0.0,40.0,20.0,23.0,28.0,11.0,0.0,0.0,"Pruden-Fonde CCD, Bell County, Kentucky",013,92864,21
661.0,94.0,100.0,62.0,75.0,37.0,26.0,15.0,43.0,32.0,42.0,67.0,20.0,36.0,0.0,6.0,6.0,"Haddix CCD, Breathitt County, Kentucky",025,91552,21
1438.0,221.0,179.0,120.0,124.0,110.0,67.0,68.0,34.0,20.0,103.0,117.0,139.0,45.0,3.0,61.0,27.0,"Jackson CCD, Breathitt County, Kentucky",025,91848,21
473.0,83.0,52.0,29.0,34.0,17.0,9.0,33.0,32.0,27.0,27.0,83.0,20.0,0.0,16.0,6.0,5.0,"Taulbee CCD, Breathitt County, Kentucky",025,93440,21
556.0,129.0,66.0,73.0,48.0,40.0,42.0,11.0,20.0,0.0,42.0,26.0,47.0,0.0,0.0,0.0,12.0,"Canoe CCD, Breathitt County, Kentucky",025,90584,21
838.0,177.0,70.0,95.0,60.0,121.0,81.0,10.0,19.0,22.0,36.0,52.0,41.0,37.0,0.0,10.0,7.0,"Hardshell CCD, Breathitt County, Kentucky",025,91592,21
794.0,181.0,83.0,68.0,37.0,66.0,45.0,24.0,21.0,21.0,61.0,65.0,29.0,33.0,31.0,24.0,5.0,"Oakdale CCD, Breathitt County, Kentucky",025,92592,21
582.0,124.0,99.0,63.0,52.0,55.0,30.0,0.0,21.0,20.0,34.0,23.0,30.0,6.0,19.0,0.0,6.0,"Rousseau CCD, Breathitt County, Kentucky",025,92960,21
1622.0,255.0,162.0,154.0,58.0,100.0,83.0,207.0,53.0,124.0,107.0,157.0,90.0,9.0,43.0,15.0,5.0,"Burkesville CCD, Cumberland County, Kentucky",057,90432,21
1461.0,151.0,66.0,161.0,71.0,44.0,88.0,59.0,164.0,117.0,108.0,158.0,108.0,100.0,26.0,26.0,14.0,"Wingo-Water Valley CCD, Graves County, Kentucky",083,93752,21
1139.0,68.0,52.0,51.0,37.0,71.0,93.0,70.0,67.0,77.0,107.0,111.0,131.0,74.0,34.0,66.0,30.0,"Sedalia CCD, Graves County, Kentucky",083,93128,21
1073.0,108.0,61.0,81.0,58.0,18.0,25.0,45.0,62.0,36.0,124.0,110.0,105.0,132.0,36.0,60.0,12.0,"Farmington CCD, Graves County, Kentucky",083,91216,21
805.0,40.0,86.0,20.0,42.0,11.0,62.0,34.0,23.0,26.0,113.0,70.0,65.0,104.0,63.0,29.0,17.0,"Fancy Farm CCD, Graves County, Kentucky",083,91208,21
5911.0,978.0,604.0,439.0,554.0,291.0,421.0,375.0,457.0,87.0,283.0,615.0,336.0,270.0,101.0,47.0,53.0,"Mayfield CCD, Graves County, Kentucky",083,92256,21
2113.0,51.0,74.0,181.0,191.0,105.0,65.0,85.0,81.0,87.0,234.0,244.0,289.0,226.0,28.0,108.0,64.0,"Symsonia CCD, Graves County, Kentucky",083,93432,21
1457.0,153.0,100.0,76.0,106.0,89.0,79.0,78.0,93.0,60.0,129.0,170.0,84.0,97.0,78.0,32.0,33.0,"Hardyville CCD, Hart County, Kentucky",099,91600,21
780.0,72.0,29.0,18.0,28.0,43.0,71.0,63.0,56.0,23.0,56.0,121.0,102.0,69.0,11.0,11.0,7.0,"Hammonville CCD, Hart County, Kentucky",099,91568,21
1115.0,139.0,58.0,133.0,112.0,44.0,86.0,62.0,72.0,62.0,77.0,73.0,87.0,41.0,40.0,29.0,0.0,"Bonnieville CCD, Hart County, Kentucky",099,90280,21
1937.0,281.0,158.0,118.0,179.0,129.0,103.0,72.0,168.0,111.0,168.0,221.0,152.0,39.0,12.0,0.0,26.0,"Munfordville CCD, Hart County, Kentucky",099,92472,21
2057.0,253.0,161.0,172.0,219.0,116.0,123.0,173.0,116.0,89.0,104.0,137.0,267.0,75.0,32.0,0.0,20.0,"Horse Cave CCD, Hart County, Kentucky",099,91784,21
1629.0,409.0,161.0,124.0,174.0,58.0,57.0,106.0,89.0,34.0,77.0,137.0,115.0,54.0,5.0,0.0,29.0,"Beattyville CCD, Lee County, Kentucky",129,90184,21
548.0,168.0,56.0,62.0,47.0,22.0,10.0,19.0,29.0,13.0,46.0,33.0,14.0,29.0,0.0,0.0,0.0,"St. Helens CCD, Lee County, Kentucky",129,93024,21
350.0,34.0,32.0,43.0,8.0,21.0,21.0,16.0,19.0,15.0,38.0,31.0,42.0,10.0,13.0,0.0,7.0,"Bradfordsville CCD, Marion County, Kentucky",155,90320,21
1683.0,454.0,169.0,148.0,103.0,79.0,72.0,23.0,56.0,66.0,128.0,119.0,139.0,71.0,20.0,34.0,2.0,"Vanceburg CCD, Lewis County, Kentucky",135,93560,21
247.0,10.0,12.0,0.0,19.0,13.0,18.0,25.0,7.0,0.0,21.0,15.0,57.0,8.0,31.0,0.0,11.0,"New Market CCD, Marion County, Kentucky",155,92536,21
458.0,33.0,37.0,48.0,31.0,20.0,21.0,34.0,14.0,15.0,36.0,24.0,60.0,38.0,37.0,9.0,1.0,"Raywick CCD, Marion County, Kentucky",155,92896,21
4296.0,436.0,360.0,321.0,282.0,370.0,348.0,198.0,270.0,204.0,258.0,386.0,350.0,269.0,106.0,32.0,106.0,"Lebanon CCD, Marion County, Kentucky",155,92000,21
1008.0,133.0,63.0,52.0,45.0,32.0,135.0,19.0,74.0,34.0,52.0,177.0,88.0,39.0,53.0,12.0,0.0,"Loretto CCD, Marion County, Kentucky",155,92088,21
670.0,30.0,58.0,15.0,46.0,24.0,10.0,33.0,48.0,14.0,79.0,79.0,73.0,63.0,49.0,26.0,23.0,"St. Mary CCD, Marion County, Kentucky",155,93032,21
336.0,43.0,41.0,11.0,27.0,25.0,9.0,20.0,38.0,13.0,18.0,18.0,41.0,12.0,7.0,13.0,0.0,"Gravel Switch CCD, Marion County, Kentucky",155,91464,21
2725.0,282.0,208.0,191.0,181.0,150.0,120.0,142.0,125.0,101.0,171.0,270.0,369.0,234.0,104.0,48.0,29.0,"Cadiz CCD, Trigg County, Kentucky",221,90480,21
7799.0,494.0,353.0,413.0,409.0,295.0,387.0,487.0,305.0,204.0,652.0,991.0,973.0,682.0,548.0,318.0,288.0,"Versailles CCD, Woodford County, Kentucky",239,93568,21
840.0,39.0,40.0,39.0,33.0,34.0,41.0,58.0,39.0,35.0,79.0,85.0,99.0,95.0,52.0,53.0,19.0,"Midway CCD, Woodford County, Kentucky",239,92312,21
26130.0,901.0,972.0,1600.0,960.0,1096.0,1032.0,1117.0,1285.0,1010.0,2576.0,2483.0,3695.0,2997.0,1505.0,1608.0,1293.0,"Florence CCD, Boone County, Kentucky",015,91272,21
6582.0,119.0,245.0,289.0,200.0,238.0,411.0,216.0,217.0,322.0,568.0,504.0,1186.0,841.0,442.0,576.0,208.0,"Burlington CCD, Boone County, Kentucky",015,90440,21
6079.0,32.0,55.0,91.0,169.0,76.0,15.0,223.0,155.0,105.0,600.0,769.0,1021.0,967.0,525.0,672.0,604.0,"Hebron CCD, Boone County, Kentucky",015,91680,21
7304.0,277.0,151.0,90.0,218.0,206.0,205.0,163.0,301.0,245.0,313.0,813.0,1067.0,799.0,650.0,823.0,983.0,"Walton CCD, Boone County, Kentucky",015,93592,21
1171.0,273.0,157.0,84.0,98.0,50.0,68.0,54.0,7.0,75.0,30.0,98.0,84.0,10.0,32.0,51.0,0.0,"Mozelle CCD, Leslie County, Kentucky",131,92456,21
1176.0,124.0,117.0,179.0,103.0,76.0,121.0,116.0,76.0,40.0,50.0,47.0,76.0,18.0,15.0,18.0,0.0,"Cutshin CCD, Leslie County, Kentucky",131,90976,21
1945.0,562.0,140.0,91.0,155.0,14.0,95.0,96.0,178.0,59.0,144.0,224.0,95.0,43.0,29.0,3.0,17.0,"Hyden CCD, Leslie County, Kentucky",131,91800,21
2365.0,36.0,0.0,0.0,13.0,82.0,106.0,84.0,75.0,42.0,111.0,130.0,259.0,288.0,239.0,315.0,585.0,"Keene CCD, Jessamine County, Kentucky",113,91912,21
2472.0,188.0,231.0,78.0,71.0,89.0,86.0,102.0,92.0,93.0,170.0,392.0,416.0,204.0,100.0,78.0,82.0,"Wilmore CCD, Jessamine County, Kentucky",113,93736,21
13700.0,1146.0,756.0,561.0,812.0,709.0,709.0,811.0,873.0,693.0,992.0,1627.0,1740.0,883.0,488.0,491.0,409.0,"Nicholasville CCD, Jessamine County, Kentucky",113,92552,21
1237.0,268.0,124.0,70.0,75.0,86.0,118.0,56.0,104.0,12.0,119.0,91.0,40.0,27.0,14.0,21.0,12.0,"Girdler CCD, Knox County, Kentucky",121,91400,21
3202.0,596.0,444.0,393.0,205.0,219.0,135.0,15.0,182.0,159.0,246.0,237.0,195.0,80.0,21.0,55.0,20.0,"Corbin CCD, Knox County, Kentucky",121,90824,21
359.0,163.0,6.0,48.0,35.0,6.0,11.0,4.0,42.0,0.0,0.0,8.0,27.0,9.0,0.0,0.0,0.0,"Trosper CCD, Knox County, Kentucky",121,93520,21
716.0,264.0,90.0,51.0,91.0,49.0,30.0,27.0,14.0,8.0,14.0,25.0,30.0,13.0,4.0,0.0,6.0,"Dewitt CCD, Knox County, Kentucky",121,91040,21
1094.0,297.0,92.0,59.0,91.0,68.0,87.0,56.0,37.0,57.0,60.0,47.0,70.0,68.0,5.0,0.0,0.0,"Gray CCD, Knox County, Kentucky",121,91472,21
5258.0,929.0,459.0,551.0,319.0,411.0,320.0,371.0,187.0,415.0,336.0,332.0,231.0,168.0,108.0,84.0,37.0,"Barbourville CCD, Knox County, Kentucky",121,90144,21
754.0,81.0,49.0,71.0,71.0,31.0,68.0,71.0,32.0,13.0,58.0,56.0,55.0,37.0,30.0,8.0,23.0,"Webbville CCD, Lawrence County, Kentucky",127,93640,21
679.0,127.0,99.0,25.0,61.0,47.0,11.0,33.0,31.0,0.0,64.0,125.0,40.0,11.0,0.0,0.0,5.0,"Blaine CCD, Lawrence County, Kentucky",127,90264,21
2653.0,384.0,414.0,92.0,197.0,197.0,55.0,96.0,167.0,143.0,132.0,152.0,317.0,124.0,78.0,52.0,53.0,"Louisa CCD, Lawrence County, Kentucky",127,92096,21
1891.0,341.0,147.0,105.0,119.0,103.0,126.0,56.0,46.0,57.0,207.0,153.0,115.0,117.0,88.0,69.0,42.0,"Morgantown CCD, Butler County, Kentucky",031,92392,21
655.0,99.0,49.0,52.0,17.0,72.0,33.0,31.0,41.0,34.0,25.0,48.0,115.0,16.0,17.0,6.0,0.0,"Jetson CCD, Butler County, Kentucky",031,91888,21
650.0,20.0,34.0,26.0,64.0,45.0,63.0,25.0,23.0,15.0,112.0,64.0,54.0,67.0,22.0,16.0,0.0,"Sugar Grove CCD, Butler County, Kentucky",031,93392,21
581.0,11.0,33.0,28.0,73.0,31.0,39.0,16.0,43.0,46.0,25.0,32.0,106.0,72.0,14.0,4.0,8.0,"Rochester CCD, Butler County, Kentucky",031,92936,21
2501.0,225.0,132.0,133.0,102.0,228.0,98.0,135.0,118.0,139.0,148.0,305.0,329.0,196.0,55.0,61.0,97.0,"Brownsville CCD, Edmonson County, Kentucky",061,90368,21
1283.0,104.0,53.0,97.0,82.0,57.0,136.0,191.0,33.0,48.0,180.0,40.0,131.0,80.0,0.0,44.0,7.0,"Welchs Creek CCD, Butler County, Kentucky",031,93648,21
2149.0,211.0,73.0,84.0,80.0,110.0,207.0,106.0,67.0,72.0,285.0,286.0,258.0,114.0,131.0,42.0,23.0,"Bedford CCD, Trimble County, Kentucky",223,90208,21
1454.0,76.0,63.0,76.0,92.0,105.0,119.0,50.0,92.0,55.0,197.0,82.0,169.0,109.0,106.0,15.0,48.0,"Milton CCD, Trimble County, Kentucky",223,92352,21
430.0,20.0,49.0,37.0,40.0,15.0,30.0,7.0,35.0,54.0,7.0,53.0,74.0,9.0,0.0,0.0,0.0,"Sunfish CCD, Edmonson County, Kentucky",061,93424,21
1413.0,221.0,153.0,66.0,118.0,117.0,51.0,118.0,63.0,68.0,173.0,29.0,94.0,68.0,37.0,32.0,5.0,"Brownsville North CCD, Edmonson County, Kentucky",061,90376,21
933.0,30.0,84.0,40.0,9.0,55.0,43.0,101.0,71.0,40.0,77.0,98.0,135.0,103.0,47.0,0.0,0.0,"Berry West CCD, Harrison County, Kentucky",097,90240,21
1662.0,153.0,112.0,173.0,145.0,99.0,106.0,115.0,114.0,94.0,99.0,134.0,173.0,100.0,34.0,7.0,4.0,"Clinton CCD, Hickman County, Kentucky",105,90752,21
5060.0,549.0,448.0,410.0,165.0,260.0,120.0,394.0,213.0,220.0,314.0,589.0,520.0,406.0,219.0,164.0,69.0,"Cynthiana CCD, Harrison County, Kentucky",097,90984,21
1114.0,90.0,46.0,112.0,117.0,69.0,72.0,34.0,46.0,40.0,141.0,133.0,80.0,63.0,20.0,38.0,13.0,"Berry CCD, Harrison County, Kentucky",097,90232,21
215.0,25.0,1.0,19.0,9.0,3.0,4.0,24.0,9.0,51.0,10.0,30.0,6.0,0.0,0.0,24.0,0.0,"Columbus CCD, Hickman County, Kentucky",105,90792,21
1772.0,220.0,206.0,134.0,63.0,137.0,112.0,49.0,122.0,34.0,205.0,127.0,157.0,159.0,32.0,9.0,6.0,"Brooksville CCD, Bracken County, Kentucky",023,90360,21
740.0,50.0,21.0,65.0,23.0,57.0,39.0,64.0,35.0,20.0,66.0,62.0,81.0,62.0,46.0,37.0,12.0,"Foster CCD, Bracken County, Kentucky",023,91304,21
915.0,131.0,49.0,59.0,27.0,57.0,87.0,45.0,9.0,17.0,50.0,108.0,124.0,63.0,66.0,13.0,10.0,"Augusta CCD, Bracken County, Kentucky",023,90128,21
901.0,75.0,25.0,32.0,30.0,103.0,33.0,29.0,52.0,30.0,92.0,123.0,146.0,61.0,7.0,29.0,34.0,"Southeast Lyon CCD, Lyon County, Kentucky",143,93272,21
2475.0,216.0,130.0,143.0,145.0,78.0,234.0,104.0,126.0,87.0,321.0,286.0,144.0,145.0,125.0,139.0,52.0,"Eddyville CCD, Lyon County, Kentucky",143,91104,21
10686.0,579.0,641.0,700.0,347.0,471.0,544.0,506.0,448.0,466.0,1271.0,1351.0,1500.0,869.0,381.0,205.0,407.0,"Bardstown CCD, Nelson County, Kentucky",179,90152,21
1303.0,148.0,42.0,58.0,85.0,58.0,113.0,46.0,36.0,98.0,171.0,96.0,147.0,85.0,79.0,22.0,19.0,"Bloomfield CCD, Nelson County, Kentucky",179,90272,21
1143.0,14.0,54.0,57.0,32.0,70.0,35.0,72.0,74.0,21.0,59.0,174.0,269.0,73.0,33.0,48.0,58.0,"Boston CCD, Nelson County, Kentucky",179,90304,21
2853.0,57.0,65.0,189.0,97.0,147.0,102.0,100.0,218.0,122.0,190.0,447.0,406.0,403.0,116.0,62.0,132.0,"Coxs Creek CCD, Nelson County, Kentucky",179,90880,21
1339.0,115.0,76.0,77.0,60.0,183.0,54.0,48.0,85.0,65.0,79.0,100.0,110.0,152.0,90.0,45.0,0.0,"New Haven CCD, Nelson County, Kentucky",179,92520,21
1917.0,234.0,144.0,215.0,31.0,78.0,138.0,150.0,118.0,143.0,138.0,134.0,183.0,159.0,0.0,0.0,52.0,"Mill Springs CCD, Wayne County, Kentucky",231,92344,21
1302.0,176.0,185.0,169.0,83.0,65.0,59.0,54.0,61.0,53.0,154.0,73.0,62.0,21.0,62.0,9.0,16.0,"Zula-Powersburg CCD, Wayne County, Kentucky",231,93792,21
555.0,104.0,26.0,51.0,28.0,43.0,68.0,11.0,2.0,17.0,123.0,27.0,20.0,8.0,27.0,0.0,0.0,"Gregory CCD, Wayne County, Kentucky",231,91528,21
444.0,47.0,36.0,49.0,32.0,23.0,39.0,26.0,28.0,19.0,31.0,66.0,28.0,20.0,0.0,0.0,0.0,"Coopersville CCD, Wayne County, Kentucky",231,90816,21
3793.0,504.0,415.0,309.0,270.0,260.0,291.0,239.0,253.0,180.0,337.0,313.0,197.0,153.0,54.0,4.0,14.0,"Monticello CCD, Wayne County, Kentucky",231,92368,21
1748.0,163.0,172.0,127.0,151.0,156.0,97.0,43.0,84.0,158.0,119.0,106.0,215.0,37.0,66.0,41.0,13.0,"Garrison CCD, Lewis County, Kentucky",135,91376,21
716.0,83.0,52.0,79.0,52.0,38.0,60.0,42.0,39.0,15.0,24.0,76.0,105.0,26.0,7.0,7.0,11.0,"Laurel-Petersville CCD, Lewis County, Kentucky",135,91984,21
1349.0,213.0,112.0,88.0,82.0,112.0,70.0,80.0,26.0,78.0,77.0,77.0,166.0,82.0,43.0,24.0,19.0,"Tollesboro CCD, Lewis County, Kentucky",135,93480,21
623.0,84.0,60.0,26.0,25.0,36.0,10.0,34.0,91.0,14.0,51.0,57.0,68.0,44.0,0.0,23.0,0.0,"South Crittenden CCD, Crittenden County, Kentucky",055,93265,21
1328.0,113.0,284.0,98.0,99.0,150.0,101.0,50.0,62.0,42.0,103.0,52.0,96.0,45.0,33.0,0.0,0.0,"Upper Tygart CCD, Carter County, Kentucky",043,93552,21
735.0,51.0,40.0,69.0,30.0,31.0,20.0,27.0,12.0,63.0,76.0,58.0,68.0,81.0,75.0,8.0,26.0,"East Crittenden CCD, Crittenden County, Kentucky",055,91098,21
1087.0,143.0,143.0,41.0,70.0,49.0,62.0,103.0,58.0,39.0,46.0,119.0,106.0,54.0,0.0,18.0,36.0,"Kettle-Peytonsburg CCD, Cumberland County, Kentucky",057,91924,21
1543.0,136.0,31.0,73.0,35.0,74.0,103.0,47.0,69.0,116.0,137.0,216.0,199.0,149.0,92.0,40.0,26.0,"Fort Knox CCD, Hardin County, Kentucky",093,91298,21
2611.0,245.0,144.0,158.0,220.0,98.0,22.0,53.0,72.0,122.0,182.0,331.0,342.0,193.0,242.0,100.0,87.0,"Grahamville-Heath CCD, McCracken County, Kentucky",145,91436,21
1592.0,60.0,86.0,47.0,165.0,52.0,77.0,104.0,152.0,37.0,111.0,223.0,206.0,147.0,38.0,78.0,9.0,"St. Johns-Freemont CCD, McCracken County, Kentucky",145,93028,21
1175.0,73.0,7.0,74.0,70.0,42.0,48.0,12.0,48.0,38.0,98.0,170.0,191.0,145.0,23.0,101.0,35.0,"Camelia CCD, McCracken County, Kentucky",145,90516,21
1013.0,60.0,16.0,25.0,6.0,65.0,26.0,18.0,53.0,27.0,50.0,95.0,123.0,119.0,54.0,108.0,168.0,"Ford-Boonesborough CCD, Clark County, Kentucky",049,91278,21
1166.0,72.0,39.0,37.0,52.0,39.0,71.0,7.0,35.0,51.0,130.0,216.0,174.0,112.0,65.0,56.0,10.0,"Southeast Clark CCD, Clark County, Kentucky",049,93269,21
1797.0,210.0,106.0,89.0,91.0,107.0,160.0,120.0,27.0,57.0,170.0,78.0,313.0,133.0,56.0,52.0,28.0,"Hickory-Lowes CCD, Graves County, Kentucky",083,91722,21
17002.0,1389.0,888.0,868.0,926.0,1052.0,1048.0,894.0,801.0,896.0,1454.0,1747.0,2155.0,1328.0,645.0,562.0,349.0,"Pond Creek CCD, Jefferson County, Kentucky",111,92820,21
9343.0,419.0,296.0,528.0,542.0,553.0,445.0,553.0,525.0,311.0,1326.0,884.0,1307.0,754.0,415.0,281.0,204.0,"South Dixie CCD, Jefferson County, Kentucky",111,93267,21
19003.0,1033.0,1167.0,1192.0,915.0,1257.0,933.0,1123.0,1201.0,995.0,1857.0,1760.0,3041.0,1357.0,598.0,388.0,186.0,"North Dixie CCD, Jefferson County, Kentucky",111,92572,21
996.0,110.0,139.0,26.0,49.0,84.0,65.0,82.0,42.0,23.0,85.0,73.0,103.0,55.0,26.0,34.0,0.0,"Clifford CCD, Lawrence County, Kentucky",127,90744,21
1172.0,257.0,113.0,68.0,135.0,61.0,53.0,61.0,95.0,16.0,81.0,87.0,107.0,19.0,10.0,9.0,0.0,"Adams CCD, Lawrence County, Kentucky",127,90016,21
3386.0,626.0,419.0,195.0,273.0,270.0,212.0,126.0,168.0,95.0,109.0,206.0,380.0,177.0,49.0,48.0,33.0,"Whitesburg CCD, Letcher County, Kentucky",133,93688,21
3194.0,499.0,253.0,404.0,165.0,259.0,129.0,211.0,123.0,234.0,235.0,139.0,290.0,177.0,35.0,10.0,31.0,"Jenkins CCD, Letcher County, Kentucky",133,91880,21
2287.0,429.0,110.0,203.0,206.0,150.0,282.0,72.0,202.0,71.0,143.0,188.0,107.0,75.0,49.0,0.0,0.0,"Blackey CCD, Letcher County, Kentucky",133,90256,21
678.0,124.0,111.0,44.0,64.0,23.0,10.0,92.0,4.0,26.0,46.0,62.0,25.0,23.0,24.0,0.0,0.0,"Colson CCD, Letcher County, Kentucky",133,90776,21
520.0,61.0,33.0,36.0,17.0,23.0,57.0,49.0,13.0,21.0,66.0,56.0,79.0,3.0,6.0,0.0,0.0,"Eolia CCD, Letcher County, Kentucky",133,91168,21
1328.0,247.0,105.0,121.0,62.0,184.0,48.0,35.0,34.0,16.0,112.0,53.0,214.0,40.0,42.0,1.0,14.0,"Salem CCD, Livingston County, Kentucky",139,93040,21
