8335.0,6954.0,593.0,458.0,0.0,0.0,33.0,19.0,6.0,0.0,28.0,4.0,0.0,0.0,0.0,8.0,0.0,6.0,0.0,0.0,89.0,0.0,0.0,0.0,19.0,118.0,"Sumas CCD, Whatcom County, Washington",073,93328,53
1211.0,1052.0,4.0,0.0,43.0,6.0,19.0,0.0,5.0,0.0,0.0,14.0,0.0,0.0,30.0,6.0,0.0,0.0,20.0,5.0,0.0,0.0,0.0,0.0,0.0,7.0,"Point Roberts CCD, Whatcom County, Washington",073,92560,53
14111.0,12967.0,159.0,327.0,38.0,0.0,179.0,0.0,238.0,106.0,29.0,13.0,0.0,0.0,0.0,0.0,19.0,11.0,0.0,0.0,0.0,10.0,0.0,0.0,15.0,0.0,"Granite Falls CCD, Snohomish County, Washington",061,91312,53
30248.0,25638.0,1797.0,1508.0,51.0,0.0,120.0,0.0,128.0,111.0,108.0,26.0,9.0,27.0,0.0,25.0,101.0,50.0,40.0,46.0,95.0,81.0,34.0,12.0,180.0,61.0,"Monroe CCD, Snohomish County, Washington",061,92000,53
28049.0,26045.0,550.0,335.0,23.0,0.0,180.0,0.0,203.0,121.0,95.0,0.0,12.0,9.0,10.0,0.0,8.0,65.0,255.0,59.0,9.0,32.0,0.0,0.0,22.0,16.0,"Arlington CCD, Snohomish County, Washington",061,90080,53
241586.0,179882.0,8707.0,5280.0,902.0,212.0,866.0,119.0,3279.0,1947.0,5663.0,2063.0,2665.0,3529.0,2719.0,2591.0,2218.0,2236.0,2737.0,1083.0,4763.0,2492.0,1124.0,388.0,2917.0,1204.0,"Edmonds CCD, Snohomish County, Washington",061,90992,53
171766.0,126294.0,10187.0,6547.0,512.0,96.0,557.0,51.0,2333.0,2731.0,2372.0,1058.0,775.0,1375.0,740.0,883.0,1501.0,1748.0,1452.0,1084.0,2709.0,2139.0,1015.0,810.0,2011.0,786.0,"Everett CCD, Snohomish County, Washington",061,91120,53
49584.0,39225.0,1420.0,247.0,198.0,0.0,167.0,0.0,702.0,369.0,2123.0,466.0,267.0,345.0,700.0,557.0,175.0,260.0,206.0,47.0,1003.0,457.0,70.0,39.0,266.0,275.0,"Maltby CCD, Snohomish County, Washington",061,91872,53
2915.0,2757.0,43.0,19.0,0.0,0.0,14.0,0.0,9.0,40.0,33.0,0.0,0.0,0.0,0.0,0.0,0.0,0.0,0.0,0.0,0.0,0.0,0.0,0.0,0.0,0.0,"Darrington CCD, Snohomish County, Washington",061,90839,53
23331.0,21405.0,809.0,407.0,73.0,6.0,50.0,58.0,19.0,30.0,15.0,12.0,0.0,0.0,116.0,0.0,0.0,7.0,46.0,0.0,51.0,25.0,39.0,10.0,153.0,0.0,"Lake Stevens CCD, Snohomish County, Washington",061,91584,53
33177.0,31741.0,419.0,180.0,103.0,0.0,33.0,0.0,111.0,93.0,64.0,0.0,16.0,21.0,63.0,28.0,47.0,15.0,75.0,16.0,38.0,97.0,1.0,0.0,16.0,0.0,"Stanwood CCD, Snohomish County, Washington",061,93248,53
70056.0,59444.0,3098.0,1784.0,218.0,45.0,156.0,25.0,827.0,342.0,532.0,179.0,116.0,62.0,132.0,186.0,181.0,317.0,773.0,438.0,793.0,305.0,14.0,20.0,64.0,5.0,"Marysville CCD, Snohomish County, Washington",061,91936,53
34869.0,31584.0,820.0,418.0,48.0,27.0,223.0,11.0,170.0,111.0,146.0,47.0,54.0,40.0,92.0,31.0,204.0,139.0,100.0,60.0,375.0,161.0,0.0,0.0,8.0,0.0,"Snohomish CCD, Snohomish County, Washington",061,93056,53
4474.0,4398.0,29.0,3.0,0.0,0.0,2.0,0.0,0.0,9.0,0.0,0.0,0.0,0.0,0.0,0.0,0.0,0.0,24.0,0.0,9.0,0.0,0.0,0.0,0.0,0.0,"North Bonneville CCD, Skamania County, Washington",059,92179,53
141.0,139.0,0.0,0.0,0.0,0.0,2.0,0.0,0.0,0.0,0.0,0.0,0.0,0.0,0.0,0.0,0.0,0.0,0.0,0.0,0.0,0.0,0.0,0.0,0.0,0.0,"North Skamania CCD, Skamania County, Washington",059,92216,53
13901.0,12614.0,742.0,309.0,22.0,0.0,17.0,25.0,21.0,0.0,0.0,5.0,0.0,29.0,0.0,0.0,0.0,0.0,0.0,0.0,34.0,39.0,0.0,0.0,16.0,28.0,"Sultan CCD, Snohomish County, Washington",061,93320,53
9470.0,8627.0,187.0,165.0,5.0,0.0,24.0,5.0,163.0,60.0,33.0,4.0,10.0,0.0,24.0,11.0,23.0,0.0,37.0,9.0,13.0,16.0,0.0,0.0,47.0,7.0,"Tulalip Reservation CCD, Snohomish County, Washington",061,93506,53
4581.0,4234.0,155.0,142.0,10.0,17.0,5.0,0.0,0.0,0.0,10.0,0.0,3.0,0.0,0.0,0.0,0.0,0.0,0.0,0.0,5.0,0.0,0.0,0.0,0.0,0.0,"Carson-Underwood CCD, Skamania County, Washington",059,90424,53
14112.0,3049.0,4722.0,6262.0,4.0,0.0,19.0,0.0,0.0,0.0,26.0,0.0,0.0,0.0,0.0,0.0,0.0,0.0,0.0,0.0,6.0,0.0,0.0,0.0,0.0,24.0,"Mattawa-Royal City CCD, Grant County, Washington",025,91944,53
15313.0,14564.0,386.0,116.0,35.0,16.0,5.0,1.0,0.0,0.0,72.0,11.0,0.0,0.0,0.0,27.0,0.0,0.0,12.0,0.0,17.0,0.0,40.0,0.0,11.0,0.0,"Camano Island CCD, Island County, Washington",029,90400,53
543.0,473.0,42.0,27.0,1.0,0.0,0.0,0.0,0.0,0.0,0.0,0.0,0.0,0.0,0.0,0.0,0.0,0.0,0.0,0.0,0.0,0.0,0.0,0.0,0.0,0.0,"Neilton CCD, Grays Harbor County, Washington",027,92136,53
11977.0,11270.0,245.0,39.0,79.0,0.0,55.0,0.0,0.0,0.0,45.0,0.0,0.0,17.0,7.0,35.0,0.0,0.0,23.0,0.0,115.0,43.0,0.0,0.0,4.0,0.0,"Central Whidbey Island CCD, Island County, Washington",029,90528,53
34980.0,30895.0,876.0,347.0,258.0,23.0,118.0,64.0,38.0,12.0,73.0,56.0,0.0,18.0,22.0,26.0,0.0,0.0,824.0,737.0,298.0,219.0,0.0,0.0,76.0,0.0,"North Whidbey Island CCD, Island County, Washington",029,92256,53
13498.0,12894.0,244.0,47.0,62.0,22.0,39.0,0.0,48.0,0.0,22.0,0.0,0.0,0.0,6.0,11.0,0.0,0.0,11.0,0.0,19.0,7.0,0.0,0.0,66.0,0.0,"South Whidbey Island CCD, Island County, Washington",029,93168,53
7325.0,6986.0,24.0,0.0,35.0,0.0,42.0,16.0,0.0,0.0,0.0,0.0,26.0,0.0,69.0,82.0,0.0,0.0,45.0,0.0,0.0,0.0,0.0,0.0,0.0,0.0,"Ocean Shores CCD, Grays Harbor County, Washington",027,92296,53
396.0,382.0,14.0,0.0,0.0,0.0,0.0,0.0,0.0,0.0,0.0,0.0,0.0,0.0,0.0,0.0,0.0,0.0,0.0,0.0,0.0,0.0,0.0,0.0,0.0,0.0,"Yakama Nation Reservation CCD, Klickitat County, Washington",039,93896,53
5763.0,5293.0,135.0,57.0,0.0,0.0,22.0,0.0,82.0,17.0,24.0,0.0,8.0,38.0,0.0,0.0,0.0,0.0,63.0,20.0,4.0,0.0,0.0,0.0,0.0,0.0,"West Mason CCD, Mason County, Washington",045,93734,53
13789.0,13371.0,163.0,212.0,0.0,0.0,0.0,0.0,0.0,0.0,0.0,0.0,0.0,0.0,0.0,0.0,0.0,0.0,3.0,8.0,0.0,0.0,0.0,0.0,25.0,7.0,"Union-Grapeview CCD, Mason County, Washington",045,93528,53
8242.0,7308.0,319.0,523.0,0.0,0.0,0.0,0.0,0.0,0.0,0.0,0.0,0.0,0.0,0.0,0.0,0.0,0.0,29.0,23.0,8.0,20.0,0.0,0.0,12.0,0.0,"Belfair-Tahuya CCD, Mason County, Washington",045,90162,53
7361.0,7075.0,160.0,0.0,0.0,0.0,40.0,0.0,3.0,0.0,0.0,0.0,0.0,0.0,0.0,0.0,0.0,0.0,41.0,0.0,42.0,0.0,0.0,0.0,0.0,0.0,"Timber Lake-Harstine Island CCD, Mason County, Washington",045,93444,53
6637.0,6181.0,44.0,284.0,0.0,0.0,0.0,0.0,13.0,34.0,0.0,0.0,0.0,0.0,0.0,0.0,0.0,21.0,20.0,0.0,16.0,0.0,12.0,0.0,12.0,0.0,"Westport CCD, Grays Harbor County, Washington",027,93739,53
6104.0,5706.0,109.0,34.0,3.0,0.0,65.0,0.0,0.0,0.0,0.0,0.0,92.0,25.0,0.0,0.0,0.0,0.0,1.0,2.0,0.0,0.0,0.0,0.0,21.0,46.0,"Montesano CCD, Grays Harbor County, Washington",027,92008,53
14134.0,13543.0,181.0,37.0,44.0,14.0,82.0,20.0,59.0,7.0,32.0,1.0,0.0,18.0,1.0,0.0,0.0,0.0,39.0,0.0,0.0,25.0,14.0,0.0,7.0,10.0,"Key Peninsula-Anderson Island CCD, Pierce County, Washington",053,91480,53
1618.0,1575.0,18.0,4.0,0.0,0.0,2.0,0.0,0.0,0.0,0.0,6.0,0.0,0.0,0.0,0.0,0.0,0.0,12.0,0.0,1.0,0.0,0.0,0.0,0.0,0.0,"Cathlamet CCD, Wahkiakum County, Washington",069,90478,53
8393.0,8127.0,36.0,0.0,0.0,0.0,27.0,0.0,17.0,95.0,0.0,0.0,0.0,0.0,34.0,31.0,17.0,0.0,0.0,0.0,8.0,0.0,0.0,0.0,1.0,0.0,"Spokane South CCD, Spokane County, Washington",063,93224,53
24676.0,22793.0,727.0,234.0,46.0,7.0,71.0,0.0,158.0,40.0,36.0,24.0,22.0,107.0,92.0,9.0,0.0,0.0,0.0,0.0,93.0,33.0,86.0,65.0,33.0,0.0,"Cheney-Medical Lake CCD, Spokane County, Washington",063,90552,53
3400.0,3341.0,21.0,0.0,0.0,0.0,6.0,0.0,5.0,0.0,19.0,8.0,0.0,0.0,0.0,0.0,0.0,0.0,0.0,0.0,0.0,0.0,0.0,0.0,0.0,0.0,"Amber-Cheney South CCD, Spokane County, Washington",063,90056,53
3491.0,2950.0,235.0,253.0,0.0,8.0,30.0,0.0,15.0,0.0,0.0,0.0,0.0,0.0,0.0,0.0,0.0,0.0,0.0,0.0,0.0,0.0,0.0,0.0,0.0,0.0,"Tonasket CCD, Okanogan County, Washington",047,93454,53
3409.0,3208.0,50.0,32.0,49.0,0.0,19.0,18.0,20.0,0.0,9.0,0.0,0.0,0.0,0.0,0.0,0.0,0.0,4.0,0.0,0.0,0.0,0.0,0.0,0.0,0.0,"Bay View CCD, Skagit County, Washington",057,90144,53
2986.0,2848.0,56.0,23.0,0.0,0.0,0.0,0.0,32.0,16.0,0.0,0.0,0.0,0.0,0.0,0.0,0.0,0.0,0.0,0.0,11.0,0.0,0.0,0.0,0.0,0.0,"Lake Cavanaugh CCD, Skagit County, Washington",057,91560,53
4175.0,3828.0,104.0,55.0,0.0,0.0,0.0,0.0,54.0,72.0,11.0,0.0,0.0,0.0,0.0,0.0,0.0,6.0,0.0,0.0,2.0,0.0,0.0,5.0,23.0,15.0,"Upper Samish River CCD, Skagit County, Washington",057,93544,53
4490.0,4334.0,46.0,0.0,0.0,0.0,3.0,7.0,20.0,0.0,39.0,0.0,0.0,9.0,0.0,0.0,0.0,0.0,5.0,0.0,9.0,0.0,0.0,0.0,18.0,0.0,"East Skagit CCD, Skagit County, Washington",057,90936,53
1388.0,1346.0,0.0,22.0,7.0,0.0,0.0,0.0,0.0,0.0,13.0,0.0,0.0,0.0,0.0,0.0,0.0,0.0,0.0,0.0,0.0,0.0,0.0,0.0,0.0,0.0,"East Ferry CCD, Ferry County, Washington",019,90920,53
5363.0,5273.0,32.0,24.0,0.0,0.0,0.0,0.0,3.0,0.0,5.0,0.0,0.0,0.0,3.0,0.0,0.0,0.0,0.0,5.0,18.0,0.0,0.0,0.0,0.0,0.0,"Manastash Ridge CCD, Kittitas County, Washington",037,91890,53
4515.0,4375.0,66.0,30.0,8.0,0.0,0.0,0.0,1.0,0.0,12.0,0.0,0.0,0.0,19.0,4.0,0.0,0.0,0.0,0.0,0.0,0.0,0.0,0.0,0.0,0.0,"Northeast Kittitas CCD, Kittitas County, Washington",037,92188,53
833.0,623.0,134.0,66.0,0.0,0.0,0.0,0.0,0.0,0.0,10.0,0.0,0.0,0.0,0.0,0.0,0.0,0.0,0.0,0.0,0.0,0.0,0.0,0.0,0.0,0.0,"Horse Heaven Hills Plateau CCD, Klickitat County, Washington",039,91346,53
4361.0,4149.0,11.0,112.0,0.0,0.0,2.0,0.0,29.0,8.0,1.0,18.0,0.0,0.0,0.0,6.0,0.0,0.0,0.0,0.0,12.0,9.0,0.0,0.0,4.0,0.0,"Dallesport-Klickitat CCD, Klickitat County, Washington",039,90836,53
1732.0,1665.0,8.0,20.0,0.0,0.0,0.0,0.0,0.0,0.0,0.0,0.0,18.0,0.0,0.0,0.0,0.0,0.0,0.0,0.0,0.0,4.0,0.0,0.0,17.0,0.0,"Northeast Cowlitz CCD, Cowlitz County, Washington",015,92182,53
8960.0,8446.0,154.0,204.0,0.0,0.0,16.0,0.0,0.0,31.0,0.0,0.0,0.0,0.0,6.0,15.0,0.0,0.0,15.0,0.0,61.0,0.0,7.0,0.0,0.0,5.0,"Long Beach-North Beach Peninsula CCD, Pacific County, Washington",049,91656,53
6855.0,6353.0,249.0,186.0,2.0,0.0,18.0,0.0,0.0,0.0,10.0,0.0,0.0,7.0,8.0,7.0,0.0,0.0,0.0,0.0,0.0,15.0,0.0,0.0,0.0,0.0,"Winlock-Pe Ell CCD, Lewis County, Washington",041,93816,53
978.0,927.0,27.0,24.0,0.0,0.0,0.0,0.0,0.0,0.0,0.0,0.0,0.0,0.0,0.0,0.0,0.0,0.0,0.0,0.0,0.0,0.0,0.0,0.0,0.0,0.0,"LaCrosse CCD, Whitman County, Washington",075,91552,53
5211.0,4988.0,95.0,43.0,13.0,22.0,41.0,0.0,0.0,0.0,0.0,0.0,0.0,0.0,7.0,2.0,0.0,0.0,0.0,0.0,0.0,0.0,0.0,0.0,0.0,0.0,"Napavine CCD, Lewis County, Washington",041,92120,53
2832.0,2402.0,44.0,0.0,0.0,0.0,0.0,0.0,0.0,0.0,0.0,0.0,0.0,0.0,0.0,358.0,6.0,0.0,22.0,0.0,0.0,0.0,0.0,0.0,0.0,0.0,"Newaukum Prairie CCD, Lewis County, Washington",041,92146,53
3729.0,3501.0,114.0,81.0,0.0,0.0,12.0,0.0,0.0,0.0,8.0,7.0,5.0,1.0,0.0,0.0,0.0,0.0,0.0,0.0,0.0,0.0,0.0,0.0,0.0,0.0,"Toledo-Vader CCD, Lewis County, Washington",041,93448,53
15535.0,14748.0,219.0,11.0,47.0,8.0,61.0,40.0,60.0,0.0,67.0,6.0,67.0,22.0,0.0,0.0,0.0,89.0,0.0,17.0,57.0,14.0,0.0,0.0,2.0,0.0,"Discovery Bay-Port Townsend CCD, Jefferson County, Washington",031,90898,53
10372.0,10031.0,111.0,52.0,24.0,0.0,48.0,0.0,9.0,0.0,21.0,9.0,16.0,0.0,0.0,0.0,0.0,0.0,0.0,0.0,23.0,15.0,0.0,0.0,13.0,0.0,"Oak Bay-Port Ludlow CCD, Jefferson County, Washington",031,92274,53
2572.0,2461.0,39.0,21.0,8.0,2.0,9.0,0.0,0.0,0.0,0.0,0.0,0.0,0.0,0.0,0.0,4.0,3.0,20.0,0.0,5.0,0.0,0.0,0.0,0.0,0.0,"Quilcene Bay-Brinnon CCD, Jefferson County, Washington",031,92690,53
0.0,0.0,0.0,0.0,0.0,0.0,0.0,0.0,0.0,0.0,0.0,0.0,0.0,0.0,0.0,0.0,0.0,0.0,0.0,0.0,0.0,0.0,0.0,0.0,0.0,0.0,"Hanford Site CCD, Benton County, Washington",005,91336,53
1850.0,1813.0,10.0,5.0,16.0,1.0,2.0,1.0,0.0,0.0,2.0,0.0,0.0,0.0,0.0,0.0,0.0,0.0,0.0,0.0,0.0,0.0,0.0,0.0,0.0,0.0,"Garfield-Oakesdale CCD, Whitman County, Washington",075,91192,53
1592.0,1563.0,9.0,3.0,0.0,0.0,0.0,0.0,0.0,0.0,4.0,0.0,13.0,0.0,0.0,0.0,0.0,0.0,0.0,0.0,0.0,0.0,0.0,0.0,0.0,0.0,"Hunters-Gifford CCD, Stevens County, Washington",065,91368,53
165249.0,114333.0,12339.0,8246.0,472.0,290.0,539.0,81.0,4172.0,3435.0,1539.0,436.0,2385.0,3223.0,471.0,1050.0,959.0,1068.0,1979.0,1018.0,3102.0,1696.0,317.0,187.0,1538.0,374.0,"Federal Way-Auburn CCD, King County, Washington",033,91140,53
555999.0,383802.0,17890.0,13419.0,3321.0,621.0,2997.0,347.0,7933.0,5020.0,25541.0,7143.0,3839.0,3525.0,16609.0,15310.0,3570.0,4430.0,4099.0,1955.0,19140.0,7736.0,1424.0,485.0,4351.0,1492.0,"Seattle East CCD, King County, Washington",033,92931,53
7562.0,7034.0,302.0,99.0,10.0,5.0,19.0,3.0,11.0,9.0,22.0,0.0,0.0,6.0,1.0,6.0,2.0,0.0,5.0,0.0,20.0,5.0,0.0,0.0,3.0,0.0,"San Juan Island CCD, San Juan County, Washington",055,92914,53
5563.0,5001.0,158.0,132.0,2.0,0.0,0.0,0.0,0.0,0.0,0.0,0.0,0.0,8.0,15.0,7.0,0.0,0.0,4.0,2.0,0.0,0.0,0.0,0.0,233.0,1.0,"Colville Reservation CCD, Okanogan County, Washington",047,90720,53
363.0,363.0,0.0,0.0,0.0,0.0,0.0,0.0,0.0,0.0,0.0,0.0,0.0,0.0,0.0,0.0,0.0,0.0,0.0,0.0,0.0,0.0,0.0,0.0,0.0,0.0,"Early Winters CCD, Okanogan County, Washington",047,90912,53
4984.0,2474.0,1315.0,1190.0,0.0,0.0,0.0,0.0,0.0,0.0,0.0,0.0,0.0,0.0,0.0,0.0,5.0,0.0,0.0,0.0,0.0,0.0,0.0,0.0,0.0,0.0,"Brewster-Wakefield CCD, Okanogan County, Washington",047,90304,53
6712.0,5847.0,335.0,424.0,0.0,0.0,12.0,0.0,0.0,0.0,0.0,66.0,0.0,0.0,0.0,0.0,0.0,0.0,0.0,0.0,0.0,0.0,7.0,0.0,21.0,0.0,"Oroville CCD, Okanogan County, Washington",047,92480,53
2312.0,2117.0,97.0,78.0,14.0,0.0,1.0,0.0,0.0,0.0,3.0,0.0,0.0,1.0,0.0,0.0,0.0,0.0,0.0,1.0,0.0,0.0,0.0,0.0,0.0,0.0,"Conconully-Riverside CCD, Okanogan County, Washington",047,90736,53
4087.0,3056.0,591.0,364.0,10.0,9.0,24.0,0.0,1.0,0.0,0.0,0.0,0.0,0.0,0.0,0.0,0.0,0.0,3.0,5.0,0.0,0.0,0.0,0.0,24.0,0.0,"Okanogan CCD, Okanogan County, Washington",047,92320,53
5472.0,5067.0,329.0,54.0,6.0,0.0,8.0,0.0,0.0,0.0,0.0,0.0,0.0,0.0,0.0,0.0,0.0,0.0,0.0,0.0,0.0,2.0,0.0,0.0,2.0,4.0,"Methow Valley CCD, Okanogan County, Washington",047,91968,53
5727.0,4976.0,238.0,375.0,0.0,0.0,0.0,0.0,0.0,0.0,0.0,0.0,0.0,0.0,0.0,0.0,0.0,0.0,91.0,0.0,35.0,12.0,0.0,0.0,0.0,0.0,"Omak CCD, Okanogan County, Washington",047,92416,53
21168.0,18493.0,1206.0,339.0,61.0,26.0,30.0,0.0,59.0,0.0,84.0,0.0,7.0,41.0,75.0,55.0,0.0,0.0,7.0,0.0,180.0,149.0,156.0,200.0,0.0,0.0,"Ellensburg CCD, Kittitas County, Washington",037,91008,53
6318.0,6044.0,154.0,82.0,26.0,0.0,0.0,0.0,0.0,12.0,0.0,0.0,0.0,0.0,0.0,0.0,0.0,0.0,0.0,0.0,0.0,0.0,0.0,0.0,0.0,0.0,"Cle Elum CCD, Kittitas County, Washington",037,90624,53
4235.0,3651.0,270.0,169.0,0.0,0.0,43.0,0.0,0.0,0.0,62.0,12.0,0.0,0.0,0.0,0.0,0.0,0.0,17.0,0.0,0.0,11.0,0.0,0.0,0.0,0.0,"Kittitas CCD, Kittitas County, Washington",037,91504,53
163327.0,143310.0,4510.0,2594.0,628.0,78.0,1086.0,192.0,490.0,152.0,779.0,306.0,760.0,928.0,542.0,479.0,686.0,1651.0,585.0,545.0,1676.0,771.0,51.0,91.0,360.0,77.0,"Olympia CCD, Thurston County, Washington",067,92352,53
19159.0,18047.0,310.0,106.0,9.0,0.0,174.0,0.0,51.0,9.0,106.0,9.0,0.0,0.0,66.0,8.0,0.0,60.0,30.0,2.0,95.0,52.0,0.0,0.0,14.0,11.0,"Olympia West CCD, Thurston County, Washington",067,92384,53
32750.0,28404.0,1032.0,643.0,94.0,0.0,276.0,21.0,50.0,19.0,343.0,34.0,127.0,185.0,118.0,96.0,42.0,58.0,460.0,222.0,266.0,187.0,0.0,24.0,49.0,0.0,"Olympia East CCD, Thurston County, Washington",067,92368,53
38715.0,35587.0,1188.0,677.0,93.0,7.0,271.0,29.0,4.0,7.0,37.0,43.0,237.0,111.0,32.0,0.0,26.0,47.0,59.0,0.0,170.0,63.0,20.0,0.0,7.0,0.0,"Thurston South CCD, Thurston County, Washington",067,93440,53
5215.0,3858.0,746.0,534.0,0.0,0.0,41.0,0.0,0.0,0.0,0.0,16.0,0.0,0.0,0.0,0.0,0.0,0.0,7.0,0.0,0.0,0.0,4.0,4.0,5.0,0.0,"Benton City CCD, Benton County, Washington",005,90192,53
157155.0,128075.0,12612.0,8052.0,262.0,63.0,580.0,20.0,1225.0,1024.0,727.0,249.0,37.0,34.0,564.0,338.0,220.0,230.0,374.0,99.0,570.0,858.0,146.0,255.0,377.0,164.0,"Richland-Kennewick CCD, Benton County, Washington",005,92768,53
13670.0,8535.0,2654.0,2407.0,0.0,0.0,21.0,0.0,14.0,0.0,13.0,0.0,0.0,0.0,0.0,0.0,0.0,0.0,25.0,0.0,0.0,0.0,0.0,0.0,1.0,0.0,"Northwest Benton CCD, Benton County, Washington",005,92224,53
798.0,481.0,133.0,141.0,0.0,0.0,0.0,0.0,43.0,0.0,0.0,0.0,0.0,0.0,0.0,0.0,0.0,0.0,0.0,0.0,0.0,0.0,0.0,0.0,0.0,0.0,"South Benton CCD, Benton County, Washington",005,93088,53
334.0,334.0,0.0,0.0,0.0,0.0,0.0,0.0,0.0,0.0,0.0,0.0,0.0,0.0,0.0,0.0,0.0,0.0,0.0,0.0,0.0,0.0,0.0,0.0,0.0,0.0,"Starbuck CCD, Columbia County, Washington",013,93264,53
3470.0,3163.0,79.0,79.0,10.0,0.0,22.0,0.0,0.0,0.0,23.0,64.0,0.0,0.0,0.0,0.0,0.0,0.0,0.0,0.0,30.0,0.0,0.0,0.0,0.0,0.0,"Dayton CCD, Columbia County, Washington",013,90864,53
222415.0,184032.0,9579.0,7052.0,568.0,191.0,724.0,85.0,4295.0,3076.0,2198.0,865.0,356.0,528.0,950.0,1024.0,779.0,1097.0,970.0,166.0,1630.0,1318.0,184.0,153.0,449.0,146.0,"Vancouver CCD, Clark County, Washington",011,93600,53
54517.0,49282.0,991.0,352.0,51.0,23.0,220.0,50.0,765.0,615.0,450.0,125.0,58.0,47.0,345.0,228.0,87.0,57.0,209.0,63.0,387.0,74.0,0.0,0.0,38.0,0.0,"Camas CCD, Clark County, Washington",011,90416,53
14376.0,13672.0,135.0,101.0,0.0,0.0,106.0,28.0,98.0,28.0,32.0,9.0,12.0,24.0,14.0,2.0,0.0,0.0,0.0,0.0,75.0,0.0,0.0,0.0,38.0,2.0,"La Center CCD, Clark County, Washington",011,91520,53
56977.0,50593.0,963.0,551.0,69.0,0.0,110.0,5.0,1882.0,1004.0,491.0,244.0,16.0,0.0,135.0,63.0,106.0,15.0,134.0,45.0,197.0,149.0,28.0,4.0,104.0,69.0,"Battle Ground CCD, Clark County, Washington",011,90128,53
9654.0,8399.0,116.0,56.0,51.0,9.0,7.0,19.0,362.0,209.0,95.0,31.0,59.0,97.0,0.0,0.0,0.0,0.0,0.0,29.0,41.0,26.0,47.0,0.0,1.0,0.0,"Ridgefield CCD, Clark County, Washington",011,92784,53
62621.0,50737.0,2527.0,1467.0,53.0,0.0,224.0,56.0,1908.0,1857.0,515.0,278.0,140.0,210.0,256.0,167.0,324.0,262.0,373.0,83.0,613.0,413.0,54.0,25.0,52.0,27.0,"Orchards CCD, Clark County, Washington",011,92448,53
7997.0,7898.0,44.0,17.0,0.0,0.0,12.0,0.0,0.0,0.0,7.0,5.0,0.0,0.0,0.0,0.0,0.0,0.0,0.0,3.0,11.0,0.0,0.0,0.0,0.0,0.0,"Yacolt CCD, Clark County, Washington",011,93888,53
3937.0,3698.0,33.0,0.0,10.0,0.0,63.0,0.0,0.0,0.0,98.0,0.0,0.0,0.0,0.0,0.0,0.0,0.0,0.0,0.0,26.0,0.0,0.0,0.0,0.0,9.0,"Asotin CCD, Asotin County, Washington",003,90096,53
17188.0,16805.0,122.0,41.0,15.0,0.0,60.0,0.0,0.0,0.0,60.0,0.0,0.0,1.0,1.0,0.0,16.0,21.0,18.0,2.0,19.0,7.0,0.0,0.0,0.0,0.0,"Clarkston CCD, Asotin County, Washington",003,90592,53
1556.0,1450.0,55.0,43.0,0.0,0.0,0.0,0.0,0.0,0.0,0.0,0.0,0.0,0.0,0.0,0.0,0.0,0.0,0.0,0.0,6.0,2.0,0.0,0.0,0.0,0.0,"Lind-Washtucna CCD, Adams County, Washington",001,91632,53
13456.0,4300.0,4128.0,4582.0,13.0,0.0,0.0,0.0,29.0,0.0,0.0,0.0,0.0,0.0,0.0,12.0,0.0,0.0,0.0,0.0,0.0,0.0,0.0,0.0,57.0,335.0,"Othello CCD, Adams County, Washington",001,92496,53
2264.0,2044.0,48.0,10.0,15.0,0.0,108.0,0.0,2.0,6.0,4.0,0.0,0.0,0.0,0.0,11.0,0.0,0.0,0.0,0.0,0.0,12.0,4.0,0.0,0.0,0.0,"Ritzville CCD, Adams County, Washington",001,92800,53
416.0,394.0,0.0,0.0,0.0,0.0,0.0,0.0,0.0,0.0,0.0,0.0,0.0,0.0,0.0,0.0,0.0,0.0,0.0,0.0,10.0,12.0,0.0,0.0,0.0,0.0,"Snake River CCD, Garfield County, Washington",023,93040,53
1670.0,1599.0,6.0,6.0,0.0,0.0,0.0,0.0,3.0,0.0,8.0,0.0,0.0,0.0,0.0,0.0,0.0,0.0,38.0,0.0,0.0,0.0,0.0,0.0,10.0,0.0,"Pomeroy CCD, Garfield County, Washington",023,92576,53
3809.0,3684.0,68.0,42.0,0.0,0.0,0.0,0.0,0.0,0.0,0.0,1.0,0.0,0.0,0.0,0.0,2.0,0.0,0.0,0.0,6.0,0.0,0.0,0.0,5.0,1.0,"Kamilche CCD, Mason County, Washington",045,91456,53
18545.0,15929.0,947.0,1190.0,33.0,0.0,75.0,0.0,6.0,0.0,17.0,0.0,36.0,23.0,43.0,54.0,0.0,0.0,78.0,13.0,7.0,43.0,21.0,0.0,0.0,30.0,"Shelton CCD, Mason County, Washington",045,92976,53
822.0,780.0,9.0,0.0,0.0,0.0,0.0,0.0,0.0,0.0,0.0,0.0,0.0,3.0,0.0,0.0,0.0,0.0,4.0,0.0,0.0,0.0,0.0,0.0,26.0,0.0,"Skokomish Reservation CCD, Mason County, Washington",045,93008,53
