1213.0,89.0,38.0,37.0,79.0,38.0,56.0,35.0,56.0,82.0,80.0,173.0,186.0,62.0,50.0,52.0,100.0,"Hemet-San Jacinto CCD, Riverside County, California",065,91280,06
7885.0,778.0,318.0,395.0,355.0,380.0,276.0,228.0,346.0,303.0,588.0,764.0,935.0,750.0,409.0,561.0,499.0,"Riverside CCD, Riverside County, California",065,92640,06
217.0,0.0,0.0,0.0,11.0,0.0,7.0,26.0,0.0,0.0,0.0,77.0,25.0,21.0,0.0,17.0,33.0,"Lake Mathews CCD, Riverside County, California",065,91530,06
1504.0,101.0,59.0,43.0,86.0,62.0,68.0,131.0,66.0,44.0,121.0,227.0,180.0,95.0,98.0,43.0,80.0,"San Gorgonio Pass CCD, Riverside County, California",065,92810,06
4973.0,223.0,128.0,96.0,78.0,90.0,81.0,89.0,172.0,157.0,203.0,546.0,673.0,666.0,461.0,777.0,533.0,"Jurupa CCD, Riverside County, California",065,91450,06
629.0,48.0,22.0,4.0,63.0,39.0,72.0,10.0,28.0,18.0,40.0,62.0,44.0,63.0,21.0,40.0,55.0,"Palm Springs CCD, Riverside County, California",065,92340,06
2101.0,17.0,65.0,67.0,22.0,46.0,55.0,102.0,235.0,17.0,180.0,155.0,314.0,236.0,134.0,265.0,191.0,"Elsinore Valley CCD, Riverside County, California",065,90880,06
244.0,8.0,4.0,0.0,0.0,20.0,0.0,0.0,0.0,0.0,14.0,35.0,17.0,61.0,35.0,28.0,22.0,"Norco CCD, Riverside County, California",065,92130,06
3995.0,124.0,221.0,111.0,244.0,136.0,154.0,178.0,40.0,168.0,253.0,435.0,649.0,521.0,280.0,227.0,254.0,"Perris Valley CCD, Riverside County, California",065,92450,06
12984.0,771.0,616.0,547.0,333.0,550.0,535.0,553.0,494.0,397.0,972.0,1240.0,1761.0,1463.0,832.0,976.0,944.0,"San Bernardino CCD, San Bernardino County, California",071,92770,06
209.0,0.0,9.0,12.0,23.0,9.0,25.0,0.0,0.0,0.0,18.0,9.0,27.0,24.0,0.0,0.0,53.0,"Big Bear CCD, San Bernardino County, California",071,90220,06
453.0,25.0,7.0,0.0,18.0,39.0,0.0,0.0,9.0,14.0,17.0,25.0,122.0,0.0,17.0,106.0,54.0,"Yucaipa CCD, San Bernardino County, California",071,93850,06
24988.0,1362.0,643.0,578.0,792.0,811.0,947.0,686.0,680.0,719.0,1687.0,2300.0,3051.0,3220.0,1933.0,2710.0,2869.0,"Ontario CCD, San Bernardino County, California",071,92260,06
92.0,0.0,0.0,7.0,13.0,0.0,0.0,5.0,0.0,0.0,21.0,0.0,0.0,11.0,11.0,13.0,11.0,"Mount Baldy-Wrightwood CCD, San Bernardino County, California",071,92040,06
66.0,9.0,0.0,3.0,0.0,0.0,0.0,53.0,0.0,0.0,0.0,1.0,0.0,0.0,0.0,0.0,0.0,"Needles CCD, San Bernardino County, California",071,92080,06
197.0,0.0,0.0,0.0,0.0,0.0,0.0,32.0,0.0,0.0,0.0,0.0,18.0,10.0,46.0,30.0,61.0,"Llagas-Uvas CCD, Santa Clara County, California",085,91680,06
207688.0,7634.0,6178.0,4723.0,4000.0,3590.0,3795.0,3288.0,3656.0,3560.0,7164.0,11702.0,19835.0,21559.0,18527.0,30882.0,57595.0,"San Jose CCD, Santa Clara County, California",085,92830,06
720.0,0.0,11.0,0.0,0.0,0.0,0.0,16.0,12.0,0.0,9.0,15.0,25.0,24.0,55.0,92.0,461.0,"West Santa Clara CCD, Santa Clara County, California",085,93660,06
86.0,4.0,0.0,0.0,0.0,0.0,0.0,0.0,5.0,0.0,0.0,0.0,5.0,5.0,8.0,26.0,33.0,"Diablo Range CCD, Santa Clara County, California",085,90680,06
930.0,18.0,8.0,0.0,121.0,6.0,47.0,32.0,29.0,8.0,66.0,30.0,185.0,105.0,60.0,69.0,146.0,"Ross Valley CCD, Marin County, California",041,92670,06
1104.0,24.0,37.0,16.0,30.0,24.0,26.0,29.0,34.0,0.0,87.0,73.0,139.0,100.0,35.0,127.0,323.0,"Southeast Marin CCD, Marin County, California",041,93140,06
27.0,0.0,0.0,0.0,0.0,0.0,0.0,0.0,0.0,0.0,10.0,2.0,0.0,7.0,0.0,0.0,8.0,"Northwest Marin CCD, Marin County, California",041,92200,06
1666.0,55.0,86.0,29.0,62.0,61.0,102.0,62.0,63.0,36.0,14.0,150.0,133.0,156.0,118.0,218.0,321.0,"San Rafael CCD, Marin County, California",041,92880,06
364.0,40.0,11.0,0.0,12.0,18.0,16.0,17.0,16.0,0.0,17.0,26.0,17.0,27.0,45.0,38.0,64.0,"Auburn CCD, Placer County, California",061,90160,06
3204.0,67.0,144.0,103.0,72.0,22.0,41.0,96.0,98.0,67.0,154.0,232.0,351.0,468.0,390.0,380.0,519.0,"Roseville CCD, Placer County, California",061,92660,06
0.0,0.0,0.0,0.0,0.0,0.0,0.0,0.0,0.0,0.0,0.0,0.0,0.0,0.0,0.0,0.0,0.0,"Foresthill-Back Country CCD, Placer County, California",061,91020,06
5.0,0.0,0.0,5.0,0.0,0.0,0.0,0.0,0.0,0.0,0.0,0.0,0.0,0.0,0.0,0.0,0.0,"Lake Tahoe CCD, Placer County, California",061,91550,06
0.0,0.0,0.0,0.0,0.0,0.0,0.0,0.0,0.0,0.0,0.0,0.0,0.0,0.0,0.0,0.0,0.0,"Etna CCD, Siskiyou County, California",093,90920,06
