B19001_001E,B19001_002E,B19001_003E,B19001_004E,B19001_005E,B19001_006E,B19001_007E,B19001_008E,B19001_009E,B19001_010E,B19001_011E,B19001_012E,B19001_013E,B19001_014E,B19001_015E,B19001_016E,B19001_017E,name,county,county subdivision,state
651.0,10.0,37.0,38.0,65.0,39.0,29.0,73.0,18.0,5.0,61.0,96.0,67.0,50.0,15.0,31.0,17.0,"Cunningham CCD, Carlisle County, Kentucky",039,90968,21
890.0,77.0,78.0,48.0,38.0,69.0,20.0,33.0,80.0,42.0,55.0,72.0,103.0,87.0,7.0,62.0,19.0,"Prestonville CCD, Carroll County, Kentucky",041,92840,21
596.0,40.0,46.0,59.0,41.0,77.0,24.0,42.0,15.0,39.0,26.0,73.0,44.0,36.0,0.0,16.0,18.0,"Arlington CCD, Carlisle County, Kentucky",039,90080,21
3072.0,223.0,451.0,161.0,242.0,107.0,118.0,131.0,197.0,187.0,195.0,276.0,289.0,182.0,45.0,204.0,64.0,"Carrollton CCD, Carroll County, Kentucky",041,90608,21
1045.0,69.0,70.0,80.0,62.0,104.0,97.0,50.0,53.0,66.0,65.0,157.0,87.0,40.0,18.0,15.0,12.0,"Kirkmansville CCD, Todd County, Kentucky",219,91928,21
741.0,70.0,68.0,75.0,54.0,76.0,15.0,47.0,40.0,27.0,40.0,50.0,80.0,40.0,50.0,0.0,9.0,"Bardwell CCD, Carlisle County, Kentucky",039,90160,21
539.0,39.0,24.0,26.0,44.0,68.0,29.0,38.0,51.0,54.0,64.0,52.0,25.0,19.0,0.0,0.0,6.0,"Ravenna CCD, Estill County, Kentucky",065,92888,21
2866.0,315.0,325.0,364.0,316.0,224.0,178.0,154.0,128.0,144.0,143.0,125.0,168.0,126.0,68.0,40.0,48.0,"Albany CCD, Clinton County, Kentucky",053,90032,21
1159.0,86.0,77.0,72.0,100.0,49.0,135.0,100.0,59.0,52.0,156.0,85.0,93.0,43.0,0.0,44.0,8.0,"Cumberland City CCD, Clinton County, Kentucky",053,90944,21
2401.0,314.0,336.0,233.0,246.0,123.0,150.0,98.0,81.0,89.0,100.0,276.0,242.0,50.0,24.0,16.0,23.0,"Irvine CCD, Estill County, Kentucky",065,91816,21
3007.0,228.0,133.0,140.0,193.0,161.0,200.0,111.0,162.0,162.0,386.0,269.0,376.0,273.0,124.0,76.0,13.0,"Warsaw CCD, Gallatin County, Kentucky",077,93616,21
1174.0,83.0,25.0,161.0,113.0,46.0,38.0,84.0,34.0,106.0,90.0,177.0,92.0,82.0,33.0,0.0,10.0,"Paint Lick CCD, Garrard County, Kentucky",079,92664,21
3130.0,414.0,195.0,263.0,173.0,166.0,203.0,161.0,154.0,64.0,254.0,380.0,334.0,192.0,88.0,23.0,66.0,"Lancaster CCD, Garrard County, Kentucky",079,91976,21
2621.0,80.0,122.0,93.0,157.0,111.0,127.0,179.0,85.0,152.0,219.0,279.0,455.0,226.0,80.0,174.0,82.0,"Bryantsville CCD, Garrard County, Kentucky",079,90400,21
1622.0,118.0,55.0,51.0,31.0,85.0,44.0,67.0,85.0,71.0,164.0,282.0,274.0,154.0,47.0,74.0,20.0,"Salvisa-McAfee CCD, Mercer County, Kentucky",167,93064,21
2311.0,110.0,49.0,103.0,62.0,99.0,191.0,103.0,29.0,103.0,246.0,388.0,292.0,252.0,139.0,99.0,46.0,"Butler CCD, Pendleton County, Kentucky",191,90472,21
1429.0,90.0,86.0,81.0,68.0,72.0,57.0,75.0,47.0,66.0,121.0,154.0,270.0,86.0,51.0,83.0,22.0,"Burgin CCD, Mercer County, Kentucky",167,90424,21
5594.0,519.0,313.0,462.0,413.0,344.0,487.0,204.0,244.0,300.0,290.0,559.0,595.0,400.0,231.0,132.0,101.0,"Harrodsburg CCD, Mercer County, Kentucky",167,91624,21
1950.0,130.0,163.0,207.0,153.0,141.0,151.0,132.0,99.0,59.0,131.0,154.0,253.0,153.0,0.0,10.0,14.0,"Falmouth CCD, Pendleton County, Kentucky",191,91200,21
938.0,157.0,72.0,58.0,75.0,97.0,50.0,24.0,18.0,19.0,108.0,87.0,62.0,50.0,27.0,11.0,23.0,"Mount Olivet CCD, Robertson County, Kentucky",201,92408,21
685.0,81.0,25.0,39.0,83.0,50.0,22.0,16.0,44.0,68.0,68.0,45.0,68.0,35.0,18.0,23.0,0.0,"Bryan CCD, Russell County, Kentucky",207,90384,21
1387.0,178.0,126.0,35.0,133.0,142.0,57.0,51.0,126.0,72.0,126.0,141.0,45.0,51.0,30.0,63.0,11.0,"Eli CCD, Russell County, Kentucky",207,91120,21
3335.0,210.0,268.0,243.0,193.0,113.0,191.0,233.0,92.0,189.0,310.0,461.0,306.0,288.0,159.0,19.0,60.0,"Springfield CCD, Washington County, Kentucky",229,93328,21
1656.0,270.0,191.0,115.0,115.0,77.0,72.0,74.0,71.0,46.0,163.0,171.0,130.0,45.0,62.0,21.0,33.0,"Jamestown CCD, Russell County, Kentucky",207,91864,21
3476.0,442.0,441.0,296.0,154.0,225.0,268.0,313.0,170.0,150.0,248.0,206.0,271.0,177.0,56.0,27.0,32.0,"Russell Springs CCD, Russell County, Kentucky",207,92984,21
2386.0,133.0,30.0,53.0,192.0,176.0,211.0,53.0,57.0,143.0,208.0,297.0,376.0,221.0,149.0,27.0,60.0,"Taylorsville CCD, Spencer County, Kentucky",215,93448,21
1172.0,92.0,79.0,15.0,140.0,94.0,77.0,32.0,51.0,83.0,85.0,139.0,149.0,16.0,45.0,55.0,20.0,"Willisburg CCD, Washington County, Kentucky",229,93728,21
751.0,141.0,35.0,95.0,68.0,21.0,25.0,12.0,29.0,35.0,71.0,110.0,37.0,41.0,16.0,15.0,0.0,"Sharpsburg CCD, Bath County, Kentucky",011,93144,21
1396.0,198.0,76.0,112.0,148.0,98.0,127.0,90.0,89.0,47.0,111.0,74.0,98.0,72.0,28.0,26.0,2.0,"Salt Lick CCD, Bath County, Kentucky",011,93056,21
2362.0,216.0,150.0,159.0,152.0,94.0,125.0,160.0,176.0,116.0,156.0,310.0,241.0,146.0,33.0,48.0,80.0,"Owingsville CCD, Bath County, Kentucky",011,92640,21
855.0,75.0,42.0,55.0,79.0,40.0,70.0,62.0,115.0,12.0,26.0,76.0,94.0,48.0,25.0,27.0,9.0,"Wickliffe CCD, Ballard County, Kentucky",007,93696,21
569.0,41.0,50.0,56.0,29.0,13.0,27.0,30.0,24.0,39.0,59.0,31.0,18.0,31.0,44.0,53.0,24.0,"Barlow CCD, Ballard County, Kentucky",007,90168,21
1801.0,117.0,121.0,104.0,98.0,113.0,120.0,117.0,95.0,80.0,145.0,171.0,194.0,148.0,106.0,51.0,21.0,"La Center CCD, Ballard County, Kentucky",007,91952,21
1279.0,78.0,116.0,83.0,94.0,104.0,19.0,96.0,70.0,90.0,96.0,154.0,130.0,95.0,31.0,17.0,6.0,"Rocky Hill CCD, Barren County, Kentucky",009,92944,21
8769.0,1050.0,754.0,617.0,632.0,582.0,505.0,827.0,403.0,467.0,758.0,675.0,693.0,496.0,172.0,73.0,65.0,"Glasgow CCD, Barren County, Kentucky",009,91408,21
1419.0,151.0,117.0,45.0,70.0,51.0,34.0,112.0,80.0,56.0,122.0,153.0,247.0,67.0,67.0,39.0,8.0,"Tracy CCD, Barren County, Kentucky",009,93496,21
2796.0,385.0,158.0,103.0,269.0,211.0,148.0,121.0,228.0,221.0,211.0,231.0,229.0,112.0,97.0,44.0,28.0,"Cave City CCD, Barren County, Kentucky",009,90640,21
1398.0,109.0,149.0,46.0,80.0,65.0,54.0,46.0,29.0,45.0,109.0,189.0,183.0,99.0,123.0,32.0,40.0,"Hiseville CCD, Barren County, Kentucky",009,91744,21
1266.0,62.0,60.0,87.0,52.0,83.0,135.0,13.0,117.0,78.0,190.0,118.0,122.0,45.0,55.0,31.0,18.0,"Temple Hill CCD, Barren County, Kentucky",009,93464,21
1884.0,151.0,158.0,220.0,66.0,118.0,116.0,82.0,30.0,129.0,191.0,211.0,157.0,137.0,64.0,25.0,29.0,"Junction City CCD, Boyle County, Kentucky",021,91896,21
7487.0,514.0,488.0,527.0,654.0,586.0,492.0,440.0,321.0,313.0,544.0,396.0,919.0,585.0,276.0,163.0,269.0,"Danville CCD, Boyle County, Kentucky",021,91000,21
1504.0,128.0,37.0,108.0,92.0,44.0,78.0,83.0,73.0,84.0,125.0,201.0,189.0,105.0,86.0,22.0,49.0,"Perryville CCD, Boyle County, Kentucky",021,92744,21
625.0,23.0,77.0,42.0,30.0,41.0,44.0,35.0,41.0,35.0,56.0,47.0,78.0,14.0,45.0,9.0,8.0,"Gresham CCD, Green County, Kentucky",087,91536,21
1766.0,214.0,173.0,114.0,224.0,185.0,61.0,75.0,73.0,93.0,101.0,173.0,166.0,49.0,28.0,23.0,14.0,"Greensburg CCD, Green County, Kentucky",087,91504,21
896.0,87.0,75.0,51.0,65.0,57.0,0.0,69.0,40.0,27.0,135.0,73.0,92.0,41.0,12.0,27.0,45.0,"Donansburg CCD, Green County, Kentucky",087,91064,21
1180.0,186.0,63.0,87.0,144.0,58.0,37.0,62.0,33.0,63.0,78.0,115.0,131.0,24.0,27.0,15.0,57.0,"Summersville CCD, Green County, Kentucky",087,93408,21
985.0,101.0,34.0,43.0,89.0,70.0,68.0,63.0,51.0,53.0,81.0,94.0,133.0,51.0,17.0,35.0,2.0,"Patesville CCD, Hancock County, Kentucky",091,92696,21
1379.0,102.0,115.0,29.0,71.0,59.0,63.0,81.0,65.0,68.0,145.0,122.0,205.0,110.0,87.0,55.0,2.0,"Lewisport CCD, Hancock County, Kentucky",091,92032,21
1011.0,43.0,53.0,28.0,19.0,25.0,88.0,79.0,55.0,104.0,76.0,168.0,151.0,59.0,32.0,29.0,2.0,"Hawesville CCD, Hancock County, Kentucky",091,91640,21
763.0,123.0,114.0,93.0,65.0,45.0,49.0,33.0,86.0,11.0,51.0,22.0,56.0,0.0,7.0,0.0,8.0,"Cawood CCD, Harlan County, Kentucky",095,90648,21
5465.0,1102.0,626.0,560.0,528.0,310.0,312.0,205.0,224.0,283.0,304.0,290.0,341.0,153.0,93.0,66.0,68.0,"Harlan CCD, Harlan County, Kentucky",095,91608,21
440.0,91.0,68.0,63.0,70.0,0.0,7.0,65.0,13.0,37.0,11.0,15.0,0.0,0.0,0.0,0.0,0.0,"Alva CCD, Harlan County, Kentucky",095,90056,21
1067.0,200.0,78.0,126.0,82.0,56.0,12.0,78.0,41.0,33.0,138.0,100.0,36.0,17.0,42.0,15.0,13.0,"Wallins Creek CCD, Harlan County, Kentucky",095,93584,21
467.0,92.0,45.0,41.0,28.0,24.0,31.0,17.0,12.0,18.0,28.0,57.0,51.0,12.0,11.0,0.0,0.0,"Poor Fork CCD, Harlan County, Kentucky",095,92824,21
509.0,155.0,14.0,59.0,54.0,27.0,10.0,44.0,19.0,41.0,10.0,30.0,31.0,15.0,0.0,0.0,0.0,"Pine Mountain CCD, Harlan County, Kentucky",095,92792,21
2037.0,460.0,173.0,188.0,193.0,114.0,113.0,83.0,68.0,82.0,182.0,100.0,96.0,124.0,44.0,14.0,3.0,"Cumberland CCD, Harlan County, Kentucky",095,90936,21
1465.0,168.0,120.0,189.0,216.0,98.0,60.0,113.0,66.0,61.0,80.0,98.0,104.0,26.0,25.0,41.0,0.0,"Warfield CCD, Martin County, Kentucky",159,93600,21
1353.0,68.0,62.0,88.0,172.0,104.0,85.0,88.0,103.0,30.0,87.0,135.0,202.0,39.0,23.0,56.0,11.0,"Sonora CCD, Hardin County, Kentucky",093,93264,21
349.0,22.0,58.0,30.0,9.0,13.0,31.0,31.0,20.0,6.0,25.0,27.0,42.0,20.0,9.0,2.0,4.0,"West Point CCD, Hardin County, Kentucky",093,93664,21
20541.0,1421.0,843.0,1101.0,991.0,1289.0,1217.0,1153.0,995.0,604.0,1432.0,2277.0,2478.0,1892.0,1189.0,1010.0,649.0,"Elizabethtown CCD, Hardin County, Kentucky",093,91128,21
14932.0,1176.0,456.0,1004.0,714.0,783.0,925.0,757.0,887.0,755.0,1410.0,1468.0,2073.0,1146.0,588.0,597.0,193.0,"Radcliff CCD, Hardin County, Kentucky",093,92880,21
1172.0,98.0,64.0,14.0,54.0,17.0,52.0,61.0,164.0,30.0,147.0,190.0,167.0,47.0,10.0,28.0,29.0,"Summit CCD, Hardin County, Kentucky",093,93416,21
1161.0,26.0,30.0,98.0,0.0,45.0,13.0,43.0,97.0,40.0,101.0,118.0,277.0,168.0,11.0,67.0,27.0,"Cecilia CCD, Hardin County, Kentucky",093,90656,21
2110.0,131.0,244.0,119.0,259.0,89.0,210.0,80.0,97.0,136.0,175.0,172.0,162.0,105.0,99.0,18.0,14.0,"Waynesburg CCD, Lincoln County, Kentucky",137,93632,21
1593.0,168.0,131.0,93.0,117.0,150.0,76.0,114.0,161.0,48.0,144.0,82.0,149.0,90.0,25.0,45.0,0.0,"Crab Orchard CCD, Lincoln County, Kentucky",137,90888,21
2414.0,164.0,154.0,160.0,216.0,129.0,111.0,221.0,23.0,166.0,315.0,265.0,331.0,74.0,65.0,6.0,14.0,"Hustonville CCD, Lincoln County, Kentucky",137,91792,21
3669.0,622.0,184.0,350.0,223.0,204.0,236.0,203.0,125.0,127.0,330.0,225.0,454.0,202.0,72.0,37.0,75.0,"Stanford CCD, Lincoln County, Kentucky",137,93344,21
1388.0,122.0,120.0,147.0,47.0,56.0,54.0,39.0,123.0,32.0,88.0,202.0,125.0,93.0,59.0,66.0,15.0,"Calhoun CCD, McLean County, Kentucky",149,90496,21
737.0,37.0,64.0,27.0,66.0,29.0,68.0,47.0,14.0,35.0,43.0,71.0,138.0,76.0,22.0,0.0,0.0,"Sacramento CCD, McLean County, Kentucky",149,93000,21
481.0,14.0,27.0,23.0,24.0,37.0,32.0,50.0,34.0,25.0,38.0,22.0,106.0,36.0,5.0,0.0,8.0,"Island CCD, McLean County, Kentucky",149,91832,21
1220.0,132.0,59.0,95.0,40.0,69.0,75.0,100.0,52.0,75.0,111.0,77.0,158.0,98.0,40.0,32.0,7.0,"Livermore CCD, McLean County, Kentucky",149,92056,21
812.0,76.0,65.0,92.0,46.0,66.0,51.0,26.0,39.0,45.0,80.0,52.0,72.0,28.0,36.0,8.0,30.0,"Fountain Run CCD, Monroe County, Kentucky",171,91312,21
2898.0,419.0,356.0,270.0,166.0,122.0,145.0,163.0,84.0,169.0,208.0,276.0,212.0,89.0,52.0,75.0,92.0,"Tompkinsville CCD, Monroe County, Kentucky",171,93488,21
3025.0,200.0,199.0,295.0,286.0,174.0,143.0,185.0,218.0,99.0,375.0,209.0,344.0,154.0,51.0,41.0,52.0,"Beaver Dam CCD, Ohio County, Kentucky",183,90200,21
1576.0,240.0,104.0,170.0,84.0,99.0,50.0,56.0,128.0,84.0,86.0,147.0,169.0,79.0,19.0,22.0,39.0,"Hartford CCD, Ohio County, Kentucky",183,91632,21
643.0,82.0,38.0,28.0,94.0,55.0,49.0,43.0,38.0,10.0,53.0,53.0,39.0,33.0,9.0,14.0,5.0,"Horse Branch CCD, Ohio County, Kentucky",183,91776,21
1183.0,102.0,103.0,69.0,71.0,91.0,46.0,59.0,86.0,21.0,172.0,87.0,147.0,73.0,15.0,28.0,13.0,"Fordsville CCD, Ohio County, Kentucky",183,91280,21
1346.0,137.0,60.0,59.0,70.0,42.0,68.0,141.0,62.0,41.0,127.0,126.0,213.0,66.0,71.0,15.0,48.0,"Heflin-Beda CCD, Ohio County, Kentucky",183,91688,21
2382.0,457.0,189.0,250.0,140.0,102.0,199.0,89.0,41.0,80.0,62.0,218.0,276.0,176.0,21.0,50.0,32.0,"Clay City CCD, Powell County, Kentucky",197,90728,21
571.0,35.0,43.0,43.0,29.0,38.0,44.0,32.0,55.0,21.0,53.0,74.0,44.0,29.0,15.0,11.0,5.0,"Centertown CCD, Ohio County, Kentucky",183,90672,21
711.0,48.0,61.0,54.0,42.0,38.0,44.0,31.0,27.0,36.0,67.0,86.0,95.0,44.0,21.0,17.0,0.0,"McHenry-Rockport CCD, Ohio County, Kentucky",183,92144,21
2496.0,245.0,189.0,198.0,174.0,93.0,238.0,81.0,119.0,81.0,306.0,347.0,263.0,141.0,7.0,2.0,12.0,"Stanton CCD, Powell County, Kentucky",197,93352,21
2988.0,247.0,167.0,179.0,260.0,188.0,240.0,193.0,185.0,194.0,196.0,165.0,336.0,226.0,103.0,86.0,23.0,"Morganfield CCD, Union County, Kentucky",225,92384,21
1881.0,138.0,124.0,102.0,95.0,137.0,109.0,101.0,73.0,101.0,112.0,199.0,259.0,142.0,105.0,53.0,31.0,"Sturgis CCD, Union County, Kentucky",225,93384,21
658.0,85.0,68.0,25.0,39.0,61.0,39.0,39.0,33.0,17.0,56.0,43.0,49.0,61.0,10.0,12.0,21.0,"Uniontown CCD, Union County, Kentucky",225,93536,21
1594.0,80.0,72.0,91.0,78.0,110.0,282.0,78.0,49.0,72.0,177.0,126.0,130.0,148.0,49.0,21.0,31.0,"Sebree CCD, Webster County, Kentucky",233,93120,21
925.0,75.0,160.0,48.0,36.0,47.0,58.0,64.0,52.0,51.0,87.0,62.0,86.0,73.0,9.0,4.0,13.0,"Clay CCD, Webster County, Kentucky",233,90720,21
1587.0,218.0,215.0,174.0,139.0,68.0,57.0,42.0,97.0,69.0,106.0,49.0,196.0,69.0,44.0,23.0,21.0,"Providence CCD, Webster County, Kentucky",233,92856,21
989.0,42.0,45.0,82.0,23.0,87.0,64.0,48.0,49.0,67.0,115.0,133.0,118.0,68.0,11.0,22.0,15.0,"Dixon CCD, Webster County, Kentucky",233,91056,21
4572.0,528.0,354.0,201.0,290.0,343.0,216.0,207.0,163.0,175.0,481.0,460.0,503.0,318.0,167.0,47.0,119.0,"Princeton CCD, Caldwell County, Kentucky",033,92848,21
737.0,34.0,40.0,56.0,51.0,39.0,41.0,50.0,24.0,9.0,57.0,96.0,102.0,82.0,28.0,25.0,3.0,"Fredonia CCD, Caldwell County, Kentucky",033,91336,21
8804.0,1645.0,989.0,617.0,607.0,248.0,427.0,508.0,396.0,440.0,472.0,755.0,644.0,356.0,306.0,274.0,120.0,"Murray CCD, Calloway County, Kentucky",035,92480,21
1703.0,142.0,150.0,62.0,124.0,96.0,104.0,81.0,63.0,79.0,85.0,205.0,282.0,85.0,81.0,47.0,17.0,"Shiloh CCD, Calloway County, Kentucky",035,93176,21
1592.0,89.0,89.0,34.0,36.0,185.0,47.0,89.0,71.0,119.0,139.0,134.0,231.0,229.0,15.0,32.0,53.0,"Kirksey CCD, Calloway County, Kentucky",035,91936,21
1412.0,106.0,71.0,76.0,94.0,109.0,99.0,101.0,62.0,65.0,149.0,210.0,85.0,68.0,65.0,31.0,21.0,"New Concord CCD, Calloway County, Kentucky",035,92512,21
2704.0,276.0,453.0,154.0,202.0,130.0,175.0,256.0,152.0,167.0,94.0,136.0,235.0,149.0,51.0,59.0,15.0,"Liberty CCD, Casey County, Kentucky",045,92040,21
810.0,54.0,64.0,34.0,54.0,70.0,130.0,32.0,53.0,0.0,92.0,87.0,47.0,70.0,17.0,0.0,6.0,"Clementsville CCD, Casey County, Kentucky",045,90736,21
920.0,137.0,105.0,115.0,37.0,28.0,94.0,42.0,102.0,54.0,63.0,28.0,73.0,19.0,0.0,9.0,14.0,"Dunnville CCD, Casey County, Kentucky",045,91088,21
1380.0,192.0,121.0,184.0,104.0,9.0,92.0,54.0,26.0,42.0,197.0,57.0,103.0,124.0,36.0,34.0,5.0,"Middleburg CCD, Casey County, Kentucky",045,92296,21
4984.0,362.0,163.0,196.0,282.0,288.0,183.0,263.0,157.0,232.0,461.0,614.0,795.0,464.0,260.0,132.0,132.0,"Brandenburg CCD, Meade County, Kentucky",163,90328,21
1136.0,78.0,51.0,22.0,53.0,88.0,112.0,90.0,61.0,48.0,59.0,213.0,90.0,83.0,37.0,8.0,43.0,"Cerulean CCD, Trigg County, Kentucky",221,90687,21
0.0,0.0,0.0,0.0,0.0,0.0,0.0,0.0,0.0,0.0,0.0,0.0,0.0,0.0,0.0,0.0,0.0,"Land Between the Lakes CCD, Trigg County, Kentucky",221,91980,21
666.0,68.0,25.0,31.0,15.0,20.0,130.0,15.0,48.0,20.0,39.0,95.0,102.0,32.0,0.0,10.0,16.0,"Mount Hermon CCD, Monroe County, Kentucky",171,92400,21
975.0,88.0,49.0,66.0,36.0,31.0,73.0,35.0,74.0,98.0,66.0,86.0,111.0,79.0,42.0,27.0,14.0,"Goforth-Locust Grove CCD, Pendleton County, Kentucky",191,91420,21
2121.0,61.0,104.0,158.0,143.0,44.0,203.0,91.0,111.0,96.0,102.0,338.0,324.0,113.0,84.0,83.0,66.0,"Canton CCD, Trigg County, Kentucky",221,90588,21
2866.0,360.0,167.0,180.0,235.0,169.0,167.0,118.0,106.0,118.0,328.0,309.0,320.0,160.0,84.0,45.0,0.0,"Jeffersonville CCD, Montgomery County, Kentucky",173,91872,21
0.0,0.0,0.0,0.0,0.0,0.0,0.0,0.0,0.0,0.0,0.0,0.0,0.0,0.0,0.0,0.0,0.0,"Fort Campbell CCD, Trigg County, Kentucky",221,91290,21
808.0,25.0,30.0,33.0,26.0,54.0,33.0,16.0,62.0,56.0,72.0,82.0,73.0,78.0,86.0,62.0,20.0,"East Simpson CCD, Simpson County, Kentucky",213,91101,21
536.0,62.0,17.0,38.0,66.0,17.0,29.0,26.0,10.0,45.0,123.0,21.0,49.0,23.0,1.0,3.0,6.0,"Mammoth Cave CCD, Edmonson County, Kentucky",061,92212,21
0.0,0.0,0.0,0.0,0.0,0.0,0.0,0.0,0.0,0.0,0.0,0.0,0.0,0.0,0.0,0.0,0.0,"Kentucky Bend CCD, Fulton County, Kentucky",075,91918,21
2038.0,244.0,338.0,115.0,111.0,103.0,125.0,127.0,85.0,105.0,222.0,141.0,195.0,94.0,9.0,0.0,24.0,"Annville CCD, Jackson County, Kentucky",109,90076,21
1158.0,186.0,123.0,38.0,47.0,41.0,77.0,49.0,79.0,100.0,112.0,96.0,187.0,23.0,0.0,0.0,0.0,"Sandgap CCD, Jackson County, Kentucky",109,93080,21
2147.0,80.0,185.0,217.0,96.0,65.0,161.0,40.0,153.0,26.0,204.0,211.0,250.0,211.0,64.0,105.0,79.0,"Hilda-Triplett CCD, Rowan County, Kentucky",205,91725,21
27679.0,2142.0,1345.0,1344.0,1400.0,1395.0,1546.0,1094.0,1260.0,1182.0,2229.0,2704.0,3290.0,2358.0,1673.0,1557.0,1160.0,"Newport-Fort Thomas CCD, Campbell County, Kentucky",037,92545,21
1424.0,44.0,20.0,17.0,78.0,58.0,116.0,63.0,50.0,14.0,72.0,133.0,217.0,125.0,149.0,117.0,151.0,"South Woodford CCD, Woodford County, Kentucky",239,93308,21
2789.0,167.0,36.0,72.0,241.0,257.0,278.0,355.0,325.0,185.0,280.0,323.0,140.0,102.0,13.0,9.0,6.0,"Fort Campbell CCD, Christian County, Kentucky",047,91288,21
15702.0,2105.0,1151.0,1197.0,934.0,858.0,773.0,934.0,1149.0,594.0,997.0,1518.0,1352.0,802.0,520.0,339.0,479.0,"Hopkinsville CCD, Christian County, Kentucky",047,91768,21
2088.0,212.0,119.0,75.0,129.0,141.0,117.0,58.0,198.0,92.0,193.0,222.0,328.0,106.0,56.0,28.0,14.0,"Crofton CCD, Christian County, Kentucky",047,90928,21
963.0,77.0,63.0,17.0,28.0,1.0,34.0,13.0,73.0,133.0,67.0,65.0,150.0,65.0,36.0,86.0,55.0,"LaFayette CCD, Christian County, Kentucky",047,91960,21
19301.0,1987.0,1402.0,1414.0,1375.0,1129.0,1557.0,1051.0,991.0,913.0,1460.0,1712.0,2020.0,874.0,615.0,385.0,416.0,"Owensboro CCD, Daviess County, Kentucky",059,92624,21
1010.0,86.0,62.0,46.0,124.0,88.0,70.0,45.0,80.0,17.0,83.0,55.0,117.0,70.0,32.0,27.0,8.0,"Millerstown CCD, Grayson County, Kentucky",085,92336,21
1361.0,143.0,81.0,115.0,112.0,132.0,48.0,88.0,56.0,41.0,126.0,173.0,113.0,47.0,65.0,6.0,15.0,"Caneyville CCD, Grayson County, Kentucky",085,90560,21
892.0,31.0,26.0,65.0,92.0,70.0,76.0,58.0,43.0,10.0,112.0,98.0,122.0,42.0,10.0,24.0,13.0,"Short Creek CCD, Grayson County, Kentucky",085,93192,21
1169.0,166.0,78.0,95.0,71.0,96.0,52.0,60.0,74.0,42.0,70.0,122.0,122.0,36.0,64.0,15.0,6.0,"Clarkson CCD, Grayson County, Kentucky",085,90704,21
1734.0,79.0,51.0,50.0,98.0,95.0,96.0,71.0,67.0,78.0,170.0,187.0,409.0,144.0,80.0,50.0,9.0,"Hebbardsville-Robards CCD, Henderson County, Kentucky",101,91672,21
5162.0,599.0,408.0,402.0,565.0,368.0,319.0,245.0,303.0,181.0,345.0,456.0,378.0,355.0,80.0,81.0,77.0,"Leitchfield CCD, Grayson County, Kentucky",085,92016,21
9194.0,1206.0,783.0,808.0,705.0,672.0,631.0,440.0,575.0,411.0,789.0,669.0,738.0,373.0,183.0,137.0,74.0,"Henderson CCD, Henderson County, Kentucky",101,91704,21
2931.0,125.0,164.0,267.0,260.0,179.0,145.0,98.0,172.0,170.0,281.0,316.0,351.0,222.0,34.0,117.0,30.0,"Corydon CCD, Henderson County, Kentucky",101,90848,21
4860.0,263.0,256.0,157.0,308.0,50.0,313.0,220.0,201.0,333.0,399.0,278.0,778.0,460.0,281.0,324.0,239.0,"Spottsville CCD, Henderson County, Kentucky",101,93320,21
1143.0,23.0,57.0,52.0,107.0,62.0,75.0,73.0,75.0,52.0,163.0,121.0,162.0,61.0,25.0,11.0,24.0,"Pleasureville CCD, Henry County, Kentucky",103,92816,21
1079.0,125.0,85.0,59.0,34.0,29.0,35.0,52.0,76.0,41.0,193.0,122.0,71.0,61.0,53.0,26.0,17.0,"Campbellsburg CCD, Henry County, Kentucky",103,90520,21
1368.0,117.0,92.0,114.0,76.0,67.0,56.0,43.0,18.0,59.0,164.0,167.0,203.0,76.0,80.0,21.0,15.0,"New Castle CCD, Henry County, Kentucky",103,92504,21
2514.0,257.0,86.0,109.0,77.0,227.0,131.0,59.0,160.0,124.0,292.0,231.0,382.0,149.0,93.0,95.0,42.0,"Eminence CCD, Henry County, Kentucky",103,91152,21
1401.0,123.0,51.0,32.0,119.0,78.0,81.0,38.0,89.0,9.0,79.0,244.0,142.0,140.0,108.0,43.0,25.0,"Nebo CCD, Hopkins County, Kentucky",107,92496,21
402.0,34.0,33.0,0.0,22.0,85.0,10.0,26.0,50.0,10.0,32.0,27.0,54.0,0.0,19.0,0.0,0.0,"St. Charles CCD, Hopkins County, Kentucky",107,93016,21
1564.0,217.0,63.0,97.0,73.0,128.0,45.0,80.0,76.0,73.0,74.0,255.0,236.0,77.0,48.0,18.0,4.0,"Nortonville CCD, Hopkins County, Kentucky",107,92584,21
1209.0,119.0,69.0,49.0,62.0,41.0,52.0,53.0,39.0,13.0,148.0,152.0,129.0,130.0,69.0,48.0,36.0,"Hanson CCD, Hopkins County, Kentucky",107,91576,21
2480.0,305.0,243.0,131.0,165.0,191.0,144.0,91.0,133.0,116.0,246.0,224.0,222.0,202.0,48.0,8.0,11.0,"Dawson Springs CCD, Hopkins County, Kentucky",107,91024,21
11490.0,1081.0,749.0,760.0,851.0,789.0,553.0,550.0,577.0,505.0,971.0,1099.0,1313.0,836.0,395.0,208.0,253.0,"Madisonville CCD, Hopkins County, Kentucky",107,92176,21
2239.0,443.0,173.0,132.0,204.0,205.0,268.0,147.0,25.0,95.0,111.0,167.0,58.0,45.0,77.0,79.0,10.0,"McKee CCD, Jackson County, Kentucky",109,92152,21
3939.0,622.0,455.0,215.0,407.0,283.0,240.0,414.0,194.0,84.0,223.0,323.0,278.0,109.0,59.0,0.0,33.0,"North Corbin CCD, Laurel County, Kentucky",125,92568,21
2524.0,328.0,346.0,113.0,210.0,253.0,138.0,190.0,119.0,104.0,158.0,232.0,159.0,72.0,53.0,20.0,29.0,"East Bernstadt CCD, Laurel County, Kentucky",125,91096,21
1318.0,270.0,123.0,152.0,61.0,75.0,9.0,104.0,58.0,50.0,181.0,104.0,54.0,56.0,9.0,0.0,12.0,"Camp Ground CCD, Laurel County, Kentucky",125,90536,21
3628.0,482.0,186.0,178.0,275.0,195.0,185.0,214.0,162.0,223.0,334.0,351.0,377.0,191.0,114.0,90.0,71.0,"Keavy CCD, Laurel County, Kentucky",125,91904,21
1807.0,126.0,63.0,70.0,88.0,95.0,82.0,139.0,99.0,161.0,90.0,176.0,213.0,100.0,170.0,39.0,96.0,"Bush CCD, Laurel County, Kentucky",125,90464,21
1112.0,98.0,73.0,112.0,50.0,65.0,10.0,24.0,39.0,33.0,85.0,190.0,95.0,138.0,41.0,20.0,39.0,"Greenmount-Langnau CCD, Laurel County, Kentucky",125,91496,21
7100.0,816.0,517.0,631.0,351.0,555.0,337.0,424.0,372.0,256.0,503.0,629.0,829.0,437.0,181.0,150.0,112.0,"London CCD, Laurel County, Kentucky",125,92072,21
1548.0,172.0,156.0,120.0,129.0,50.0,62.0,95.0,85.0,117.0,113.0,166.0,157.0,67.0,15.0,23.0,21.0,"Colony CCD, Laurel County, Kentucky",125,90768,21
4408.0,274.0,208.0,240.0,205.0,279.0,481.0,115.0,152.0,262.0,329.0,516.0,439.0,438.0,232.0,137.0,101.0,"Benton CCD, Marshall County, Kentucky",157,90216,21
5868.0,428.0,245.0,332.0,246.0,378.0,318.0,295.0,305.0,359.0,470.0,514.0,877.0,576.0,206.0,226.0,93.0,"Calvert City CCD, Marshall County, Kentucky",157,90512,21
2841.0,119.0,115.0,140.0,370.0,252.0,149.0,260.0,65.0,85.0,215.0,237.0,386.0,100.0,139.0,106.0,103.0,"Fairdealing CCD, Marshall County, Kentucky",157,91192,21
4584.0,260.0,208.0,237.0,174.0,219.0,163.0,360.0,248.0,323.0,520.0,564.0,591.0,307.0,245.0,139.0,26.0,"Flaherty CCD, Meade County, Kentucky",163,91248,21
1217.0,84.0,50.0,82.0,104.0,27.0,31.0,57.0,85.0,43.0,106.0,127.0,180.0,105.0,92.0,37.0,7.0,"Battletown-Payneville CCD, Meade County, Kentucky",163,90176,21
7538.0,661.0,531.0,365.0,645.0,485.0,437.0,424.0,506.0,243.0,587.0,605.0,1008.0,513.0,187.0,201.0,140.0,"Mount Sterling CCD, Montgomery County, Kentucky",173,92416,21
1904.0,192.0,156.0,111.0,84.0,154.0,174.0,90.0,83.0,68.0,47.0,239.0,199.0,191.0,52.0,24.0,40.0,"Carlisle CCD, Nicholas County, Kentucky",181,90592,21
856.0,74.0,40.0,82.0,71.0,40.0,48.0,86.0,33.0,45.0,71.0,112.0,98.0,8.0,16.0,24.0,8.0,"Headquarters CCD, Nicholas County, Kentucky",181,91664,21
12805.0,211.0,143.0,176.0,273.0,376.0,213.0,296.0,316.0,279.0,695.0,1141.0,1792.0,1756.0,1488.0,1391.0,2259.0,"Pewee Valley CCD, Oldham County, Kentucky",185,92752,21
7660.0,326.0,266.0,340.0,276.0,301.0,384.0,327.0,321.0,237.0,418.0,794.0,1174.0,960.0,682.0,516.0,338.0,"La Grange CCD, Oldham County, Kentucky",185,91968,21
933.0,110.0,42.0,38.0,78.0,30.0,47.0,40.0,24.0,59.0,135.0,75.0,96.0,74.0,31.0,26.0,28.0,"Monterey-New Columbus CCD, Owen County, Kentucky",187,92360,21
1854.0,184.0,151.0,105.0,154.0,143.0,113.0,59.0,133.0,187.0,70.0,202.0,153.0,96.0,65.0,20.0,19.0,"Owenton CCD, Owen County, Kentucky",187,92632,21
1157.0,52.0,130.0,52.0,105.0,8.0,117.0,64.0,31.0,38.0,62.0,90.0,173.0,81.0,53.0,73.0,28.0,"New Liberty CCD, Owen County, Kentucky",187,92528,21
4254.0,442.0,480.0,468.0,310.0,238.0,290.0,127.0,189.0,123.0,324.0,423.0,324.0,254.0,190.0,3.0,69.0,"Mount Vernon CCD, Rockcastle County, Kentucky",203,92424,21
1012.0,147.0,37.0,79.0,85.0,36.0,45.0,164.0,20.0,44.0,168.0,37.0,42.0,52.0,33.0,5.0,18.0,"Livingston CCD, Rockcastle County, Kentucky",203,92064,21
1286.0,126.0,134.0,88.0,118.0,24.0,59.0,47.0,50.0,53.0,138.0,183.0,85.0,67.0,50.0,54.0,10.0,"Conway CCD, Rockcastle County, Kentucky",203,90800,21
1266.0,95.0,32.0,80.0,83.0,94.0,30.0,45.0,55.0,23.0,102.0,92.0,217.0,177.0,46.0,42.0,53.0,"Sadieville CCD, Scott County, Kentucky",209,93008,21
2523.0,118.0,88.0,94.0,51.0,171.0,95.0,158.0,58.0,69.0,150.0,255.0,354.0,282.0,194.0,258.0,128.0,"Stamping Ground CCD, Scott County, Kentucky",209,93336,21
15917.0,534.0,923.0,424.0,583.0,676.0,801.0,725.0,808.0,609.0,1219.0,2006.0,2335.0,1590.0,1102.0,927.0,655.0,"Georgetown CCD, Scott County, Kentucky",209,91392,21
2266.0,110.0,70.0,121.0,98.0,91.0,108.0,207.0,106.0,86.0,221.0,269.0,277.0,247.0,123.0,49.0,83.0,"Smiths Grove CCD, Warren County, Kentucky",227,93248,21
33722.0,3123.0,2412.0,1837.0,2047.0,1793.0,1583.0,1594.0,1939.0,1548.0,2956.0,3263.0,3685.0,2352.0,1232.0,1100.0,1258.0,"Bowling Green CCD, Warren County, Kentucky",227,90312,21
2208.0,14.0,77.0,25.0,59.0,73.0,107.0,97.0,204.0,145.0,284.0,212.0,473.0,196.0,91.0,52.0,99.0,"Woodburn CCD, Warren County, Kentucky",227,93760,21
822.0,0.0,38.0,44.0,55.0,68.0,26.0,111.0,14.0,14.0,131.0,125.0,136.0,11.0,0.0,49.0,0.0,"Greencastle CCD, Warren County, Kentucky",227,91488,21
3719.0,342.0,311.0,325.0,197.0,273.0,268.0,310.0,212.0,150.0,262.0,337.0,460.0,181.0,62.0,11.0,18.0,"Scottsville CCD, Allen County, Kentucky",003,93112,21
