7931.0,558.0,315.0,245.0,171.0,132.0,173.0,82.0,197.0,193.0,420.0,703.0,1087.0,860.0,617.0,1064.0,1114.0,"Alameda CCD, Alameda County, California",001,90020,06
29990.0,1365.0,873.0,813.0,699.0,604.0,985.0,754.0,868.0,986.0,1885.0,2314.0,4012.0,3729.0,3111.0,3469.0,3523.0,"Hayward CCD, Alameda County, California",001,91260,06
17846.0,378.0,190.0,187.0,224.0,156.0,152.0,177.0,213.0,148.0,337.0,746.0,1479.0,2098.0,1962.0,3540.0,5859.0,"Livermore-Pleasanton CCD, Alameda County, California",001,91660,06
9334.0,1623.0,503.0,413.0,358.0,235.0,330.0,344.0,324.0,237.0,540.0,878.0,653.0,567.0,398.0,695.0,1236.0,"Berkeley CCD, Alameda County, California",001,90200,06
55468.0,1117.0,922.0,653.0,862.0,799.0,750.0,782.0,639.0,864.0,1715.0,3296.0,5911.0,7351.0,5595.0,9548.0,14664.0,"Fremont CCD, Alameda County, California",001,91070,06
27565.0,2082.0,3066.0,1718.0,1430.0,1076.0,1208.0,889.0,761.0,648.0,1620.0,1927.0,2744.0,2240.0,1683.0,2063.0,2410.0,"Oakland CCD, Alameda County, California",001,92230,06
3800.0,61.0,69.0,12.0,57.0,89.0,10.0,33.0,82.0,48.0,116.0,136.0,360.0,613.0,295.0,877.0,942.0,"Folsom CCD, Sacramento County, California",067,91010,06
166.0,60.0,0.0,0.0,0.0,0.0,0.0,0.0,0.0,0.0,0.0,0.0,0.0,80.0,0.0,26.0,0.0,"Sloughhouse CCD, Sacramento County, California",067,93030,06
51558.0,3433.0,3352.0,2558.0,2513.0,2303.0,2326.0,2044.0,2202.0,1605.0,3657.0,5004.0,6360.0,4579.0,2977.0,3491.0,3154.0,"Sacramento CCD, Sacramento County, California",067,92690,06
543.0,11.0,33.0,0.0,5.0,0.0,68.0,13.0,35.0,20.0,23.0,8.0,114.0,39.0,38.0,99.0,37.0,"Galt CCD, Sacramento County, California",067,91090,06
8786.0,262.0,344.0,436.0,339.0,338.0,375.0,313.0,316.0,360.0,539.0,897.0,1166.0,865.0,780.0,852.0,604.0,"Elk Grove CCD, Sacramento County, California",067,90870,06
335.0,38.0,15.0,56.0,27.0,0.0,9.0,0.0,0.0,0.0,41.0,56.0,39.0,25.0,0.0,0.0,29.0,"South Lake Tahoe CCD, El Dorado County, California",017,93160,06
1741.0,35.0,36.0,38.0,20.0,0.0,12.0,47.0,5.0,0.0,47.0,118.0,246.0,211.0,78.0,391.0,457.0,"South El Dorado CCD, El Dorado County, California",017,93150,06
111.0,0.0,0.0,0.0,0.0,0.0,12.0,0.0,0.0,0.0,0.0,0.0,0.0,17.0,0.0,0.0,82.0,"Placerville CCD, El Dorado County, California",017,92490,06
119.0,0.0,0.0,0.0,15.0,0.0,0.0,0.0,0.0,0.0,0.0,0.0,23.0,38.0,0.0,7.0,36.0,"North El Dorado CCD, El Dorado County, California",017,92190,06
47.0,0.0,0.0,0.0,0.0,0.0,0.0,0.0,0.0,0.0,14.0,0.0,33.0,0.0,0.0,0.0,0.0,"Calistoga CCD, Napa County, California",055,90340,06
2558.0,60.0,100.0,44.0,104.0,83.0,33.0,70.0,20.0,49.0,83.0,162.0,358.0,292.0,278.0,378.0,444.0,"Napa CCD, Napa County, California",055,92070,06
34.0,0.0,0.0,0.0,7.0,0.0,0.0,19.0,0.0,0.0,0.0,0.0,0.0,8.0,0.0,0.0,0.0,"St. Helena CCD, Napa County, California",055,92710,06
63.0,12.0,0.0,0.0,0.0,0.0,0.0,4.0,0.0,9.0,19.0,0.0,0.0,0.0,19.0,0.0,0.0,"Angwin CCD, Napa County, California",055,90070,06
129.0,22.0,0.0,0.0,7.0,0.0,5.0,0.0,10.0,10.0,12.0,0.0,16.0,7.0,9.0,6.0,25.0,"Pajaro CCD, Monterey County, California",053,92320,06
69.0,4.0,0.0,0.0,0.0,0.0,0.0,0.0,0.0,0.0,10.0,0.0,21.0,0.0,0.0,17.0,17.0,"Gonzales CCD, Monterey County, California",053,91130,06
40.0,0.0,0.0,10.0,0.0,0.0,0.0,0.0,0.0,18.0,0.0,5.0,7.0,0.0,0.0,0.0,0.0,"King City CCD, Monterey County, California",053,91470,06
222.0,8.0,0.0,0.0,5.0,11.0,0.0,0.0,11.0,22.0,13.0,0.0,23.0,37.0,63.0,15.0,14.0,"Castroville CCD, Monterey County, California",053,90400,06
2687.0,150.0,104.0,78.0,46.0,38.0,78.0,135.0,125.0,89.0,314.0,271.0,409.0,307.0,185.0,259.0,99.0,"Salinas CCD, Monterey County, California",053,92730,06
28.0,0.0,0.0,0.0,0.0,0.0,6.0,0.0,0.0,0.0,0.0,0.0,16.0,6.0,0.0,0.0,0.0,"Greenfield CCD, Monterey County, California",053,91150,06
69.0,0.0,0.0,0.0,0.0,0.0,8.0,0.0,0.0,0.0,0.0,21.0,0.0,0.0,23.0,0.0,17.0,"Soledad CCD, Monterey County, California",053,93060,06
24.0,0.0,0.0,0.0,0.0,0.0,0.0,0.0,0.0,0.0,0.0,0.0,0.0,17.0,0.0,7.0,0.0,"Carmel Valley CCD, Monterey County, California",053,90370,06
4198.0,294.0,223.0,97.0,164.0,149.0,67.0,188.0,135.0,159.0,250.0,325.0,707.0,571.0,239.0,358.0,272.0,"Seaside-Monterey CCD, Monterey County, California",053,92970,06
7.0,0.0,0.0,0.0,0.0,0.0,0.0,0.0,0.0,0.0,0.0,3.0,0.0,1.0,0.0,0.0,3.0,"San Ardo CCD, Monterey County, California",053,92750,06
106459.0,7250.0,7027.0,4730.0,4003.0,2894.0,3037.0,2525.0,3208.0,2658.0,5026.0,7629.0,10106.0,10247.0,7751.0,11259.0,17109.0,"San Francisco CCD, San Francisco County, California",075,92790,06
554.0,41.0,0.0,0.0,11.0,19.0,68.0,11.0,21.0,0.0,33.0,103.0,60.0,15.0,15.0,52.0,105.0,"Fallbrook CCD, San Diego County, California",073,90960,06
1.0,1.0,0.0,0.0,0.0,0.0,0.0,0.0,0.0,0.0,0.0,0.0,0.0,0.0,0.0,0.0,0.0,"Laguna-Pine Valley CCD, San Diego County, California",073,91510,06
0.0,0.0,0.0,0.0,0.0,0.0,0.0,0.0,0.0,0.0,0.0,0.0,0.0,0.0,0.0,0.0,0.0,"West Sierra CCD, Sierra County, California",091,93680,06
0.0,0.0,0.0,0.0,0.0,0.0,0.0,0.0,0.0,0.0,0.0,0.0,0.0,0.0,0.0,0.0,0.0,"East Sierra CCD, Sierra County, California",091,90830,06
63.0,0.0,0.0,0.0,8.0,0.0,0.0,0.0,0.0,0.0,0.0,0.0,0.0,0.0,0.0,55.0,0.0,"Pauma Valley CCD, San Diego County, California",073,92430,06
502.0,0.0,0.0,0.0,0.0,16.0,0.0,0.0,0.0,0.0,0.0,34.0,48.0,27.0,71.0,112.0,194.0,"Jamul CCD, San Diego County, California",073,91440,06
31.0,0.0,0.0,0.0,0.0,0.0,0.0,15.0,0.0,0.0,0.0,0.0,0.0,16.0,0.0,0.0,0.0,"Mountain Empire CCD, San Diego County, California",073,92030,06
14287.0,945.0,295.0,291.0,366.0,397.0,219.0,321.0,447.0,417.0,760.0,1304.0,2137.0,1791.0,1381.0,1333.0,1883.0,"Oceanside-Escondido CCD, San Diego County, California",073,92240,06
141.0,0.0,0.0,14.0,0.0,0.0,0.0,7.0,12.0,6.0,0.0,0.0,0.0,56.0,0.0,11.0,35.0,"Ramona CCD, San Diego County, California",073,92550,06
318.0,10.0,0.0,0.0,0.0,4.0,18.0,0.0,35.0,0.0,20.0,19.0,16.0,85.0,13.0,15.0,83.0,"Valley Center CCD, San Diego County, California",073,93540,06
45.0,5.0,0.0,6.0,5.0,0.0,0.0,0.0,5.0,9.0,0.0,5.0,0.0,0.0,0.0,10.0,0.0,"Palomar-Julian CCD, San Diego County, California",073,92350,06
76.0,4.0,0.0,0.0,0.0,0.0,0.0,0.0,0.0,0.0,0.0,0.0,39.0,21.0,0.0,12.0,0.0,"Alpine CCD, San Diego County, California",073,90030,06
99574.0,5262.0,2778.0,2655.0,2524.0,2852.0,3101.0,2762.0,3499.0,2469.0,6025.0,8981.0,12672.0,12543.0,8181.0,11434.0,11836.0,"San Diego CCD, San Diego County, California",073,92780,06
66.0,0.0,55.0,0.0,3.0,0.0,0.0,0.0,0.0,0.0,2.0,0.0,6.0,0.0,0.0,0.0,0.0,"Springville-Johnsondale CCD, Tulare County, California",107,93220,06
0.0,0.0,0.0,0.0,0.0,0.0,0.0,0.0,0.0,0.0,0.0,0.0,0.0,0.0,0.0,0.0,0.0,"Terra Bella CCD, Tulare County, California",107,93330,06
180.0,0.0,35.0,5.0,0.0,3.0,1.0,39.0,0.0,24.0,2.0,20.0,0.0,23.0,1.0,17.0,10.0,"Earlimart CCD, Tulare County, California",107,90760,06
46.0,0.0,13.0,0.0,0.0,0.0,0.0,6.0,0.0,0.0,0.0,2.0,5.0,0.0,0.0,7.0,13.0,"Exeter CCD, Tulare County, California",107,90940,06
913.0,56.0,17.0,13.0,69.0,30.0,29.0,56.0,44.0,49.0,72.0,134.0,116.0,37.0,46.0,93.0,52.0,"Porterville CCD, Tulare County, California",107,92520,06
27.0,0.0,13.0,0.0,4.0,0.0,0.0,0.0,0.0,0.0,10.0,0.0,0.0,0.0,0.0,0.0,0.0,"Woodlake-Three Rivers CCD, Tulare County, California",107,93780,06
14.0,0.0,0.0,14.0,0.0,0.0,0.0,0.0,0.0,0.0,0.0,0.0,0.0,0.0,0.0,0.0,0.0,"Strathmore CCD, Tulare County, California",107,93260,06
2278.0,43.0,245.0,309.0,75.0,193.0,67.0,136.0,75.0,41.0,136.0,113.0,144.0,185.0,78.0,82.0,356.0,"Visalia CCD, Tulare County, California",107,93560,06
348.0,0.0,16.0,32.0,16.0,6.0,4.0,12.0,0.0,18.0,66.0,32.0,62.0,66.0,0.0,0.0,18.0,"Tulare CCD, Tulare County, California",107,93430,06
100.0,74.0,0.0,0.0,0.0,0.0,26.0,0.0,0.0,0.0,0.0,0.0,0.0,0.0,0.0,0.0,0.0,"Ivanhoe CCD, Tulare County, California",107,91420,06
68.0,0.0,0.0,9.0,3.0,0.0,31.0,0.0,0.0,0.0,0.0,0.0,6.0,0.0,0.0,8.0,11.0,"Lindsay CCD, Tulare County, California",107,91640,06
247.0,19.0,14.0,0.0,6.0,42.0,0.0,4.0,8.0,10.0,0.0,10.0,58.0,3.0,50.0,23.0,0.0,"Orosi-Cutler CCD, Tulare County, California",107,92290,06
12.0,0.0,0.0,0.0,0.0,0.0,0.0,0.0,0.0,0.0,0.0,0.0,0.0,0.0,0.0,0.0,12.0,"Pixley CCD, Tulare County, California",107,92480,06
0.0,0.0,0.0,0.0,0.0,0.0,0.0,0.0,0.0,0.0,0.0,0.0,0.0,0.0,0.0,0.0,0.0,"Tipton CCD, Tulare County, California",107,93360,06
168.0,0.0,0.0,0.0,0.0,7.0,0.0,19.0,0.0,0.0,44.0,30.0,34.0,15.0,0.0,11.0,8.0,"Dinuba CCD, Tulare County, California",107,90690,06
38.0,0.0,12.0,10.0,9.0,0.0,0.0,0.0,0.0,0.0,7.0,0.0,0.0,0.0,0.0,0.0,0.0,"Clarksburg CCD, Yolo County, California",113,90500,06
5437.0,1432.0,274.0,363.0,206.0,221.0,177.0,170.0,201.0,139.0,266.0,372.0,271.0,242.0,220.0,373.0,510.0,"Davis CCD, Yolo County, California",113,90640,06
14.0,0.0,0.0,0.0,0.0,0.0,0.0,0.0,0.0,0.0,0.0,14.0,0.0,0.0,0.0,0.0,0.0,"Knights Landing CCD, Yolo County, California",113,91500,06
44.0,19.0,0.0,0.0,0.0,0.0,0.0,0.0,0.0,13.0,12.0,0.0,0.0,0.0,0.0,0.0,0.0,"Winters CCD, Yolo County, California",113,93770,06
83.0,0.0,0.0,0.0,0.0,30.0,0.0,11.0,0.0,0.0,0.0,42.0,0.0,0.0,0.0,0.0,0.0,"Esparto CCD, Yolo County, California",113,90910,06
5.0,0.0,0.0,0.0,0.0,0.0,0.0,0.0,0.0,0.0,5.0,0.0,0.0,0.0,0.0,0.0,0.0,"Chuckwalla Valley CCD, Riverside County, California",065,90492,06
77.0,0.0,0.0,0.0,13.0,0.0,6.0,8.0,0.0,0.0,8.0,22.0,13.0,0.0,0.0,0.0,7.0,"Yuba City Southwest CCD, Sutter County, California",101,93825,06
519.0,46.0,90.0,23.0,36.0,53.0,67.0,25.0,37.0,0.0,6.0,9.0,66.0,24.0,31.0,0.0,6.0,"Twentynine Palms-Yucca Valley CCD, San Bernardino County, California",071,93482,06
347.0,32.0,0.0,28.0,63.0,0.0,0.0,5.0,7.0,19.0,13.0,19.0,97.0,19.0,0.0,40.0,5.0,"Barstow CCD, San Bernardino County, California",071,90188,06
1883.0,186.0,54.0,23.0,30.0,44.0,47.0,42.0,47.0,46.0,110.0,71.0,142.0,232.0,103.0,241.0,465.0,"Rocklin CCD, Placer County, California",061,92645,06
16.0,0.0,0.0,10.0,0.0,6.0,0.0,0.0,0.0,0.0,0.0,0.0,0.0,0.0,0.0,0.0,0.0,"Arnold-West Point CCD, Calaveras County, California",009,90105,06
91.0,11.0,0.0,0.0,10.0,0.0,0.0,0.0,0.0,13.0,0.0,21.0,10.0,11.0,0.0,9.0,6.0,"Russian River-Sonoma Coast CCD, Sonoma County, California",097,92682,06
2894.0,122.0,63.0,70.0,68.0,119.0,57.0,65.0,98.0,47.0,13.0,138.0,222.0,244.0,327.0,392.0,849.0,"South Santa Clara Valley CCD, Santa Clara County, California",085,93175,06
35.0,0.0,0.0,0.0,0.0,0.0,0.0,0.0,0.0,0.0,0.0,0.0,0.0,0.0,0.0,0.0,35.0,"Lexington Hills CCD, Santa Clara County, California",085,91602,06
1621.0,56.0,57.0,51.0,20.0,6.0,72.0,0.0,47.0,30.0,134.0,145.0,200.0,169.0,57.0,190.0,387.0,"Novato CCD, Marin County, California",041,92205,06
15.0,0.0,0.0,0.0,0.0,0.0,0.0,5.0,0.0,0.0,0.0,0.0,5.0,5.0,0.0,0.0,0.0,"Bolinas CCD, Marin County, California",041,90256,06
99.0,0.0,0.0,15.0,0.0,0.0,0.0,12.0,0.0,0.0,0.0,16.0,11.0,7.0,21.0,17.0,0.0,"Blythe CCD, Riverside County, California",065,90253,06
59.0,0.0,29.0,0.0,30.0,0.0,0.0,0.0,0.0,0.0,0.0,0.0,0.0,0.0,0.0,0.0,0.0,"Northwest Trinity CCD, Trinity County, California",105,92202,06
113.0,10.0,0.0,0.0,0.0,0.0,0.0,0.0,0.0,7.0,9.0,32.0,0.0,25.0,0.0,26.0,4.0,"Fillmore CCD, Ventura County, California",111,90988,06
178.0,0.0,15.0,23.0,0.0,0.0,0.0,0.0,0.0,0.0,30.0,64.0,12.0,16.0,9.0,0.0,9.0,"Ojai-Mira Monte CCD, Ventura County, California",111,92245,06
38.0,5.0,0.0,0.0,0.0,0.0,0.0,0.0,0.0,0.0,0.0,0.0,0.0,0.0,0.0,0.0,33.0,"Triunfo Pass-Point Mugu CCD, Ventura County, California",111,93422,06
15.0,15.0,0.0,0.0,0.0,0.0,0.0,0.0,0.0,0.0,0.0,0.0,0.0,0.0,0.0,0.0,0.0,"Clearlake CCD, Lake County, California",033,90503,06
0.0,0.0,0.0,0.0,0.0,0.0,0.0,0.0,0.0,0.0,0.0,0.0,0.0,0.0,0.0,0.0,0.0,"Lower Lake CCD, Lake County, California",033,91775,06
50.0,0.0,0.0,0.0,0.0,0.0,0.0,0.0,37.0,0.0,0.0,13.0,0.0,0.0,0.0,0.0,0.0,"Middletown CCD, Lake County, California",033,91975,06
0.0,0.0,0.0,0.0,0.0,0.0,0.0,0.0,0.0,0.0,0.0,0.0,0.0,0.0,0.0,0.0,0.0,"Cobb CCD, Lake County, California",033,90545,06
0.0,0.0,0.0,0.0,0.0,0.0,0.0,0.0,0.0,0.0,0.0,0.0,0.0,0.0,0.0,0.0,0.0,"Clearlake Riviera CCD, Lake County, California",033,90505,06
0.0,0.0,0.0,0.0,0.0,0.0,0.0,0.0,0.0,0.0,0.0,0.0,0.0,0.0,0.0,0.0,0.0,"Upper Lake-Nice CCD, Lake County, California",033,93505,06
29.0,0.0,0.0,0.0,0.0,0.0,0.0,0.0,8.0,0.0,0.0,0.0,0.0,0.0,0.0,21.0,0.0,"Kelseyville CCD, Lake County, California",033,91455,06
72.0,62.0,0.0,10.0,0.0,0.0,0.0,0.0,0.0,0.0,0.0,0.0,0.0,0.0,0.0,0.0,0.0,"Lucerne-Clearlake Oaks CCD, Lake County, California",033,91795,06
0.0,0.0,0.0,0.0,0.0,0.0,0.0,0.0,0.0,0.0,0.0,0.0,0.0,0.0,0.0,0.0,0.0,"Newell CCD, Modoc County, California",049,92105,06
0.0,0.0,0.0,0.0,0.0,0.0,0.0,0.0,0.0,0.0,0.0,0.0,0.0,0.0,0.0,0.0,0.0,"Lake Berryessa CCD, Napa County, California",055,91515,06
437.0,20.0,0.0,0.0,57.0,0.0,11.0,14.0,0.0,0.0,14.0,0.0,98.0,67.0,19.0,72.0,65.0,"Half Moon Bay CCD, San Mateo County, California",081,91215,06
171.0,0.0,0.0,0.0,0.0,0.0,0.0,0.0,0.0,0.0,49.0,54.0,20.0,6.0,42.0,0.0,0.0,"Lake Arrowhead CCD, San Bernardino County, California",071,91513,06
3600.0,318.0,125.0,181.0,131.0,105.0,257.0,94.0,232.0,128.0,318.0,313.0,425.0,461.0,108.0,215.0,189.0,"Victorville-Hesperia CCD, San Bernardino County, California",071,93555,06
246.0,0.0,0.0,31.0,16.0,15.0,17.0,13.0,27.0,0.0,44.0,66.0,11.0,0.0,0.0,6.0,0.0,"Newberry Springs-Baker CCD, San Bernardino County, California",071,92102,06
5.0,0.0,0.0,0.0,0.0,0.0,0.0,0.0,0.0,0.0,0.0,0.0,0.0,0.0,0.0,0.0,5.0,"Searles Valley CCD, San Bernardino County, California",071,92955,06
45.0,0.0,2.0,6.0,0.0,0.0,0.0,0.0,0.0,7.0,0.0,6.0,0.0,0.0,0.0,11.0,13.0,"West Santa Cruz CCD, Santa Cruz County, California",087,93665,06
1617.0,77.0,20.0,9.0,30.0,26.0,36.0,18.0,18.0,19.0,5.0,233.0,95.0,235.0,55.0,365.0,376.0,"Agoura Hills-Malibu CCD, Los Angeles County, California",037,90015,06
66136.0,3033.0,2290.0,1844.0,2079.0,1557.0,2090.0,1965.0,2014.0,2106.0,4213.0,6212.0,9214.0,8200.0,5420.0,6719.0,7180.0,"San Fernando Valley CCD, Los Angeles County, California",037,92785,06
1596.0,121.0,136.0,144.0,109.0,70.0,77.0,59.0,51.0,43.0,78.0,196.0,159.0,176.0,77.0,61.0,39.0,"South Gate-East Los Angeles CCD, Los Angeles County, California",037,93155,06
1718.0,102.0,74.0,78.0,178.0,105.0,37.0,70.0,21.0,49.0,116.0,244.0,287.0,119.0,77.0,138.0,23.0,"Delano-McFarland CCD, Kern County, California",029,90655,06
221.0,44.0,0.0,5.0,23.0,5.0,0.0,4.0,0.0,9.0,0.0,69.0,16.0,31.0,0.0,15.0,0.0,"West Kern CCD, Kern County, California",029,93635,06
89.0,0.0,0.0,0.0,0.0,0.0,0.0,0.0,25.0,0.0,0.0,0.0,5.0,42.0,0.0,17.0,0.0,"Mendocino CCD, Mendocino County, California",045,91938,06
42.0,0.0,0.0,0.0,0.0,4.0,0.0,0.0,0.0,0.0,0.0,0.0,0.0,7.0,0.0,18.0,13.0,"Yosemite Lakes CCD, Madera County, California",039,93802,06
27.0,0.0,13.0,0.0,0.0,0.0,0.0,0.0,10.0,0.0,0.0,0.0,0.0,0.0,0.0,4.0,0.0,"Redwood Valley-Potter Valley CCD, Mendocino County, California",045,92592,06
81.0,7.0,0.0,28.0,9.0,0.0,0.0,15.0,0.0,0.0,1.0,8.0,0.0,1.0,12.0,0.0,0.0,"Isleton CCD, Sacramento County, California",067,91416,06
4748.0,184.0,134.0,213.0,173.0,166.0,190.0,208.0,158.0,195.0,235.0,426.0,779.0,603.0,255.0,478.0,351.0,"Rancho Cordova CCD, Sacramento County, California",067,92555,06
77.0,5.0,0.0,0.0,7.0,15.0,14.0,4.0,0.0,0.0,7.0,20.0,5.0,0.0,0.0,0.0,0.0,"East Yuba-Beale AFB CCD, Yuba County, California",115,90855,06
27.0,0.0,0.0,0.0,0.0,27.0,0.0,0.0,0.0,0.0,0.0,0.0,0.0,0.0,0.0,0.0,0.0,"Marysville Northeast CCD, Yuba County, California",115,91908,06
30920.0,1674.0,778.0,493.0,496.0,445.0,772.0,530.0,606.0,794.0,1235.0,2319.0,4204.0,3537.0,2763.0,4546.0,5728.0,"Irvine-Lake Forest CCD, Orange County, California",059,91413,06
7527.0,189.0,134.0,53.0,168.0,101.0,237.0,64.0,171.0,173.0,218.0,550.0,819.0,958.0,660.0,1293.0,1739.0,"Mission Viejo CCD, Orange County, California",059,91977,06
38.0,0.0,0.0,0.0,0.0,0.0,0.0,0.0,0.0,0.0,0.0,0.0,0.0,0.0,6.0,17.0,15.0,"Silverado CCD, Orange County, California",059,93015,06
31.0,0.0,0.0,0.0,0.0,0.0,0.0,0.0,0.0,4.0,0.0,0.0,0.0,0.0,0.0,14.0,13.0,"Summit Road CCD, Santa Cruz County, California",087,93265,06
19.0,0.0,0.0,0.0,0.0,0.0,0.0,0.0,0.0,0.0,0.0,0.0,0.0,0.0,19.0,0.0,0.0,"Willow Creek-Hoopa Valley CCD, Humboldt County, California",023,93745,06
244.0,16.0,50.0,6.0,0.0,0.0,0.0,0.0,9.0,24.0,7.0,6.0,15.0,0.0,29.0,42.0,40.0,"Carpinteria CCD, Santa Barbara County, California",083,90378,06
495.0,47.0,7.0,11.0,14.0,0.0,43.0,10.0,20.0,0.0,23.0,56.0,87.0,11.0,36.0,58.0,72.0,"Lompoc CCD, Santa Barbara County, California",083,91708,06
2012.0,45.0,76.0,94.0,27.0,71.0,81.0,45.0,114.0,77.0,154.0,211.0,233.0,280.0,153.0,190.0,161.0,"Santa Maria CCD, Santa Barbara County, California",083,92908,06
200.0,0.0,16.0,0.0,0.0,0.0,48.0,0.0,0.0,0.0,16.0,7.0,73.0,0.0,0.0,25.0,15.0,"Solvang-Santa Ynez CCD, Santa Barbara County, California",083,93065,06
2.0,0.0,0.0,0.0,2.0,0.0,0.0,0.0,0.0,0.0,0.0,0.0,0.0,0.0,0.0,0.0,0.0,"North Mono CCD, Mono County, California",051,92195,06
16.0,0.0,0.0,0.0,0.0,0.0,0.0,2.0,0.0,0.0,0.0,0.0,0.0,0.0,11.0,3.0,0.0,"Mammoth Lakes CCD, Mono County, California",051,91865,06
0.0,0.0,0.0,0.0,0.0,0.0,0.0,0.0,0.0,0.0,0.0,0.0,0.0,0.0,0.0,0.0,0.0,"Borrego Springs CCD, San Diego County, California",073,90258,06
0.0,0.0,0.0,0.0,0.0,0.0,0.0,0.0,0.0,0.0,0.0,0.0,0.0,0.0,0.0,0.0,0.0,"Feather River Canyon CCD, Plumas County, California",063,90975,06
0.0,0.0,0.0,0.0,0.0,0.0,0.0,0.0,0.0,0.0,0.0,0.0,0.0,0.0,0.0,0.0,0.0,"Yosemite Valley CCD, Mariposa County, California",043,93804,06
8.0,0.0,0.0,0.0,0.0,0.0,0.0,0.0,0.0,0.0,0.0,6.0,0.0,0.0,0.0,0.0,2.0,"Big Sur CCD, Monterey County, California",053,90235,06
236.0,24.0,0.0,0.0,0.0,0.0,0.0,0.0,0.0,0.0,46.0,23.0,49.0,33.0,12.0,22.0,27.0,"Carmel-by-the-Sea CCD, Monterey County, California",053,90362,06
162.0,0.0,0.0,0.0,0.0,0.0,0.0,0.0,0.0,52.0,0.0,58.0,0.0,0.0,0.0,52.0,0.0,"Camp Pendleton CCD, San Diego County, California",073,90355,06
1411.0,201.0,27.0,111.0,88.0,28.0,63.0,30.0,16.0,24.0,95.0,106.0,284.0,189.0,26.0,64.0,59.0,"Redding CCD, Shasta County, California",089,92568,06
236.0,9.0,0.0,0.0,0.0,0.0,0.0,15.0,0.0,0.0,0.0,32.0,16.0,9.0,45.0,39.0,71.0,"Toro Park CCD, Monterey County, California",053,93372,06
2121.0,40.0,80.0,20.0,48.0,50.0,78.0,57.0,14.0,25.0,52.0,213.0,244.0,183.0,249.0,408.0,360.0,"Lincoln CCD, Placer County, California",061,91605,06
1549.0,69.0,43.0,87.0,37.0,50.0,16.0,129.0,31.0,91.0,59.0,180.0,248.0,103.0,165.0,183.0,58.0,"East Yolo CCD, Yolo County, California",113,90850,06
1580.0,64.0,16.0,38.0,80.0,58.0,88.0,38.0,91.0,24.0,44.0,114.0,300.0,79.0,218.0,202.0,126.0,"Woodland CCD, Yolo County, California",113,93790,06
654.0,12.0,52.0,28.0,123.0,19.0,30.0,13.0,41.0,41.0,71.0,114.0,11.0,20.0,7.0,40.0,32.0,"Eureka CCD, Humboldt County, California",023,90930,06
34.0,0.0,0.0,0.0,0.0,0.0,0.0,0.0,7.0,22.0,0.0,5.0,0.0,0.0,0.0,0.0,0.0,"Garberville CCD, Humboldt County, California",023,91100,06
14.0,0.0,0.0,0.0,0.0,0.0,0.0,0.0,8.0,0.0,0.0,1.0,4.0,0.0,0.0,0.0,1.0,"Fortuna CCD, Humboldt County, California",023,91050,06
148.0,9.0,16.0,0.0,0.0,0.0,0.0,11.0,2.0,10.0,49.0,0.0,23.0,11.0,2.0,0.0,15.0,"North Coastal CCD, Humboldt County, California",023,92170,06
197.0,36.0,20.0,55.0,0.0,10.0,0.0,0.0,0.0,32.0,15.0,0.0,2.0,3.0,1.0,0.0,23.0,"Arcata CCD, Humboldt County, California",023,90100,06
12.0,0.0,0.0,0.0,0.0,0.0,0.0,0.0,0.0,0.0,6.0,4.0,0.0,0.0,0.0,0.0,2.0,"Ferndale CCD, Humboldt County, California",023,90980,06
243.0,4.0,0.0,0.0,0.0,0.0,15.0,0.0,0.0,0.0,9.0,27.0,53.0,36.0,0.0,61.0,38.0,"Grass Valley CCD, Nevada County, California",057,91140,06
119.0,0.0,0.0,0.0,0.0,0.0,0.0,0.0,24.0,0.0,0.0,43.0,23.0,9.0,0.0,0.0,20.0,"Donner CCD, Nevada County, California",057,90710,06
61.0,0.0,0.0,0.0,13.0,0.0,0.0,12.0,0.0,16.0,0.0,11.0,0.0,0.0,0.0,9.0,0.0,"Nevada City CCD, Nevada County, California",057,92090,06
3.0,1.0,0.0,0.0,0.0,0.0,0.0,0.0,0.0,0.0,0.0,2.0,0.0,0.0,0.0,0.0,0.0,"Markleeville CCD, Alpine County, California",003,91890,06
100.0,0.0,0.0,0.0,0.0,0.0,19.0,28.0,7.0,0.0,0.0,0.0,5.0,3.0,0.0,18.0,20.0,"Chowchilla CCD, Madera County, California",039,90480,06
0.0,0.0,0.0,0.0,0.0,0.0,0.0,0.0,0.0,0.0,0.0,0.0,0.0,0.0,0.0,0.0,0.0,"Madera West CCD, Madera County, California",039,91850,06
54.0,0.0,0.0,1.0,0.0,0.0,0.0,0.0,0.0,0.0,53.0,0.0,0.0,0.0,0.0,0.0,0.0,"Oakhurst-North Fork CCD, Madera County, California",039,92220,06
586.0,9.0,8.0,22.0,30.0,48.0,33.0,48.0,9.0,35.0,115.0,22.0,106.0,28.0,15.0,34.0,24.0,"Madera CCD, Madera County, California",039,91830,06
41.0,0.0,0.0,0.0,0.0,0.0,0.0,0.0,0.0,0.0,0.0,0.0,0.0,0.0,20.0,9.0,12.0,"Madera Southeast CCD, Madera County, California",039,91840,06
13.0,0.0,0.0,0.0,0.0,0.0,6.0,0.0,0.0,0.0,0.0,0.0,0.0,0.0,7.0,0.0,0.0,"Point Arena CCD, Mendocino County, California",045,92510,06
44.0,7.0,0.0,0.0,8.0,0.0,4.0,0.0,4.0,0.0,0.0,9.0,12.0,0.0,0.0,0.0,0.0,"Fort Bragg CCD, Mendocino County, California",045,91030,06
5.0,0.0,0.0,0.0,0.0,0.0,0.0,0.0,0.0,0.0,0.0,0.0,5.0,0.0,0.0,0.0,0.0,"Laytonville-Leggett CCD, Mendocino County, California",045,91580,06
22.0,12.0,0.0,0.0,0.0,0.0,0.0,8.0,0.0,0.0,0.0,0.0,2.0,0.0,0.0,0.0,0.0,"Hopland CCD, Mendocino County, California",045,91330,06
176.0,0.0,13.0,17.0,17.0,0.0,15.0,0.0,12.0,8.0,0.0,36.0,0.0,11.0,40.0,0.0,7.0,"Ukiah CCD, Mendocino County, California",045,93490,06
56.0,14.0,0.0,0.0,0.0,0.0,0.0,0.0,0.0,0.0,0.0,24.0,18.0,0.0,0.0,0.0,0.0,"Willits CCD, Mendocino County, California",045,93740,06
2.0,0.0,0.0,0.0,0.0,0.0,0.0,0.0,0.0,0.0,0.0,0.0,0.0,0.0,0.0,2.0,0.0,"Covelo CCD, Mendocino County, California",045,90610,06
2416.0,397.0,79.0,118.0,73.0,31.0,87.0,111.0,30.0,83.0,124.0,135.0,289.0,226.0,108.0,198.0,327.0,"Santa Cruz CCD, Santa Cruz County, California",087,92900,06
882.0,14.0,72.0,9.0,0.0,35.0,9.0,89.0,52.0,11.0,88.0,130.0,63.0,71.0,43.0,96.0,100.0,"Watsonville CCD, Santa Cruz County, California",087,93590,06
236.0,28.0,0.0,0.0,0.0,0.0,43.0,23.0,14.0,33.0,27.0,0.0,0.0,16.0,0.0,12.0,40.0,"San Lorenzo Valley CCD, Santa Cruz County, California",087,92850,06
18.0,0.0,18.0,0.0,0.0,0.0,0.0,0.0,0.0,0.0,0.0,0.0,0.0,0.0,0.0,0.0,0.0,"Hayfork CCD, Trinity County, California",105,91250,06
0.0,0.0,0.0,0.0,0.0,0.0,0.0,0.0,0.0,0.0,0.0,0.0,0.0,0.0,0.0,0.0,0.0,"Weaverville CCD, Trinity County, California",105,93595,06
7202.0,267.0,191.0,156.0,138.0,127.0,263.0,85.0,141.0,162.0,458.0,443.0,726.0,811.0,499.0,834.0,1901.0,"Palos Verdes CCD, Los Angeles County, California",037,92360,06
25.0,0.0,0.0,0.0,0.0,0.0,0.0,0.0,0.0,0.0,0.0,0.0,11.0,7.0,7.0,0.0,0.0,"Colfax-Monumental Ridge CCD, Placer County, California",061,90548,06
5.0,0.0,0.0,0.0,0.0,0.0,0.0,0.0,0.0,0.0,0.0,0.0,5.0,0.0,0.0,0.0,0.0,"Mad River CCD, Trinity County, California",105,91860,06
8750.0,285.0,238.0,108.0,195.0,111.0,93.0,154.0,211.0,169.0,386.0,608.0,1269.0,1077.0,1147.0,1253.0,1446.0,"Newhall CCD, Los Angeles County, California",037,92110,06
21339.0,629.0,823.0,611.0,723.0,528.0,632.0,582.0,631.0,822.0,1305.0,2063.0,2977.0,2332.0,1636.0,2641.0,2404.0,"Downey-Norwalk CCD, Los Angeles County, California",037,90730,06
7026.0,344.0,300.0,335.0,316.0,233.0,237.0,153.0,270.0,143.0,275.0,726.0,890.0,721.0,594.0,720.0,769.0,"Whittier CCD, Los Angeles County, California",037,93730,06
5700.0,94.0,84.0,39.0,92.0,66.0,156.0,147.0,174.0,168.0,186.0,411.0,566.0,640.0,464.0,810.0,1603.0,"South Bay Cities CCD, Los Angeles County, California",037,93100,06
2201.0,166.0,65.0,56.0,107.0,123.0,98.0,86.0,45.0,102.0,172.0,314.0,281.0,203.0,111.0,153.0,119.0,"North Antelope Valley CCD, Los Angeles County, California",037,92140,06
18271.0,755.0,662.0,493.0,569.0,509.0,490.0,637.0,403.0,632.0,786.0,1545.0,2327.0,2174.0,1630.0,2322.0,2337.0,"Torrance CCD, Los Angeles County, California",037,93380,06
51087.0,3731.0,2992.0,3491.0,2616.0,2290.0,2087.0,1913.0,2597.0,2050.0,3702.0,4685.0,5558.0,4387.0,2819.0,3098.0,3071.0,"Southwest San Gabriel Valley CCD, Los Angeles County, California",037,93200,06
34094.0,2044.0,1522.0,1449.0,1225.0,943.0,1452.0,987.0,1218.0,1144.0,2089.0,3060.0,4163.0,3603.0,2383.0,3228.0,3584.0,"Upper San Gabriel Valley CCD, Los Angeles County, California",037,93510,06
25332.0,1471.0,1395.0,1141.0,1109.0,796.0,846.0,839.0,1006.0,953.0,1988.0,2203.0,3502.0,2567.0,1665.0,2186.0,1665.0,"Long Beach-Lakewood CCD, Los Angeles County, California",037,91730,06
127432.0,12583.0,9854.0,6203.0,6153.0,5192.0,5728.0,5101.0,4884.0,3829.0,8646.0,11201.0,12582.0,10229.0,6717.0,8859.0,9671.0,"Los Angeles CCD, Los Angeles County, California",037,91750,06
20257.0,1500.0,855.0,491.0,443.0,232.0,561.0,349.0,476.0,386.0,970.0,1607.0,2261.0,1985.0,1669.0,2165.0,4307.0,"Pasadena CCD, Los Angeles County, California",037,92400,06
9297.0,336.0,257.0,200.0,281.0,224.0,234.0,310.0,339.0,159.0,639.0,888.0,1567.0,1060.0,944.0,1110.0,749.0,"Compton CCD, Los Angeles County, California",037,90560,06
62726.0,3427.0,1975.0,2002.0,2555.0,2182.0,2279.0,2300.0,2321.0,1789.0,4028.0,5898.0,8249.0,6491.0,5252.0,5995.0,5983.0,"East San Gabriel Valley CCD, Los Angeles County, California",037,90810,06
4313.0,299.0,144.0,189.0,34.0,108.0,43.0,150.0,82.0,64.0,143.0,356.0,599.0,421.0,187.0,480.0,1014.0,"Santa Monica CCD, Los Angeles County, California",037,92920,06
2529.0,34.0,83.0,92.0,54.0,145.0,170.0,41.0,62.0,40.0,150.0,205.0,406.0,206.0,270.0,357.0,214.0,"South Antelope Valley CCD, Los Angeles County, California",037,93090,06
10739.0,775.0,575.0,423.0,600.0,563.0,622.0,474.0,632.0,391.0,988.0,828.0,1046.0,933.0,609.0,867.0,413.0,"Inglewood CCD, Los Angeles County, California",037,91400,06
6226.0,316.0,257.0,86.0,40.0,187.0,218.0,229.0,227.0,92.0,429.0,547.0,1041.0,821.0,580.0,531.0,625.0,"Corona CCD, Riverside County, California",065,90590,06
1042.0,26.0,53.0,28.0,17.0,70.0,68.0,95.0,18.0,39.0,103.0,52.0,127.0,154.0,37.0,99.0,56.0,"Coachella Valley CCD, Riverside County, California",065,90520,06
75.0,0.0,18.0,0.0,0.0,0.0,0.0,0.0,0.0,0.0,0.0,0.0,33.0,24.0,0.0,0.0,0.0,"Idyllwild CCD, Riverside County, California",065,91370,06
7669.0,295.0,141.0,138.0,138.0,294.0,259.0,240.0,351.0,143.0,456.0,861.0,1124.0,1084.0,756.0,681.0,708.0,"Murrieta CCD, Riverside County, California",065,92060,06
2105.0,248.0,67.0,52.0,171.0,72.0,48.0,88.0,89.0,101.0,110.0,139.0,158.0,137.0,103.0,212.0,310.0,"Cathedral City-Palm Desert CCD, Riverside County, California",065,90410,06
286.0,8.0,9.0,24.0,25.0,0.0,32.0,47.0,0.0,19.0,7.0,0.0,49.0,38.0,0.0,28.0,0.0,"Desert Hot Springs CCD, Riverside County, California",065,90670,06
