B07003_001E,B07003_002E,B07003_003E,B07003_004E,B07003_005E,B07003_006E,B07003_007E,B07003_008E,B07003_009E,B07003_010E,B07003_011E,B07003_012E,B07003_013E,B07003_014E,B07003_015E,B07003_016E,B07003_017E,B07003_018E,name,county,county subdivision,state
16306.0,7712.0,8594.0,12753.0,5962.0,6791.0,2048.0,1030.0,1018.0,1061.0,507.0,554.0,389.0,179.0,210.0,55.0,34.0,21.0,"Gainesville CCD, Cooke County, Texas",097,91435,48
13504.0,7843.0,5661.0,11442.0,6399.0,5043.0,713.0,385.0,328.0,993.0,753.0,240.0,128.0,86.0,42.0,228.0,220.0,8.0,"Raymondville CCD, Willacy County, Texas",489,93205,48
4778.0,2334.0,2444.0,4188.0,2037.0,2151.0,303.0,170.0,133.0,227.0,100.0,127.0,60.0,27.0,33.0,0.0,0.0,0.0,"Valley View CCD, Cooke County, Texas",097,93995,48
6932.0,3553.0,3379.0,6047.0,3078.0,2969.0,350.0,196.0,154.0,436.0,263.0,173.0,99.0,16.0,83.0,0.0,0.0,0.0,"Gainesville Southeast CCD, Cooke County, Texas",097,91440,48
5830.0,3164.0,2666.0,5051.0,2737.0,2314.0,426.0,226.0,200.0,225.0,152.0,73.0,122.0,43.0,79.0,6.0,6.0,0.0,"Callisburg CCD, Cooke County, Texas",097,90580,48
4858.0,2431.0,2427.0,4187.0,2128.0,2059.0,214.0,110.0,104.0,386.0,168.0,218.0,69.0,23.0,46.0,2.0,2.0,0.0,"Muenster CCD, Cooke County, Texas",097,92680,48
2021.0,998.0,1023.0,1777.0,866.0,911.0,136.0,60.0,76.0,93.0,68.0,25.0,11.0,4.0,7.0,4.0,0.0,4.0,"Crosbyton CCD, Crosby County, Texas",107,90905,48
2198.0,1056.0,1142.0,1712.0,842.0,870.0,280.0,130.0,150.0,206.0,84.0,122.0,0.0,0.0,0.0,0.0,0.0,0.0,"Ralls CCD, Crosby County, Texas",107,93185,48
1554.0,810.0,744.0,1318.0,700.0,618.0,75.0,32.0,43.0,161.0,78.0,83.0,0.0,0.0,0.0,0.0,0.0,0.0,"Lorenzo CCD, Crosby County, Texas",107,92290,48
304.0,179.0,125.0,274.0,154.0,120.0,0.0,0.0,0.0,5.0,5.0,0.0,0.0,0.0,0.0,25.0,20.0,5.0,"Lamesa Southwest CCD, Dawson County, Texas",115,92125,48
347.0,167.0,180.0,279.0,142.0,137.0,20.0,13.0,7.0,39.0,12.0,27.0,0.0,0.0,0.0,9.0,0.0,9.0,"Lamesa Northwest CCD, Dawson County, Texas",115,92115,48
11574.0,6484.0,5090.0,8934.0,4975.0,3959.0,1329.0,599.0,730.0,1017.0,847.0,170.0,294.0,63.0,231.0,0.0,0.0,0.0,"Lamesa CCD, Dawson County, Texas",115,92105,48
347.0,166.0,181.0,268.0,139.0,129.0,75.0,25.0,50.0,4.0,2.0,2.0,0.0,0.0,0.0,0.0,0.0,0.0,"Lamesa Southeast CCD, Dawson County, Texas",115,92120,48
421.0,228.0,193.0,344.0,181.0,163.0,26.0,16.0,10.0,20.0,12.0,8.0,0.0,0.0,0.0,31.0,19.0,12.0,"Lamesa Northeast CCD, Dawson County, Texas",115,92110,48
1829.0,922.0,907.0,1624.0,818.0,806.0,95.0,40.0,55.0,107.0,61.0,46.0,1.0,1.0,0.0,2.0,2.0,0.0,"Roby CCD, Fisher County, Texas",151,93275,48
1725.0,751.0,974.0,1541.0,669.0,872.0,104.0,42.0,62.0,52.0,27.0,25.0,25.0,10.0,15.0,3.0,3.0,0.0,"Rotan CCD, Fisher County, Texas",151,93340,48
249.0,162.0,87.0,249.0,162.0,87.0,0.0,0.0,0.0,0.0,0.0,0.0,0.0,0.0,0.0,0.0,0.0,0.0,"McCaulley CCD, Fisher County, Texas",151,92350,48
1164.0,708.0,456.0,1061.0,640.0,421.0,93.0,68.0,25.0,10.0,0.0,10.0,0.0,0.0,0.0,0.0,0.0,0.0,"Realitos-Concepcion CCD, Duval County, Texas",131,93215,48
2521.0,1401.0,1120.0,2327.0,1270.0,1057.0,162.0,108.0,54.0,32.0,23.0,9.0,0.0,0.0,0.0,0.0,0.0,0.0,"Benavides CCD, Duval County, Texas",131,90260,48
4729.0,2298.0,2431.0,3540.0,1611.0,1929.0,582.0,206.0,376.0,607.0,481.0,126.0,0.0,0.0,0.0,0.0,0.0,0.0,"San Diego CCD, Duval County, Texas",131,93420,48
2959.0,1433.0,1526.0,2400.0,1115.0,1285.0,425.0,246.0,179.0,134.0,72.0,62.0,0.0,0.0,0.0,0.0,0.0,0.0,"Freer CCD, Duval County, Texas",131,91405,48
2981.0,1532.0,1449.0,2645.0,1372.0,1273.0,0.0,0.0,0.0,285.0,137.0,148.0,27.0,13.0,14.0,24.0,10.0,14.0,"Old River CCD, Burleson County, Texas",051,92890,48
4444.0,2066.0,2378.0,3979.0,1874.0,2105.0,182.0,90.0,92.0,278.0,97.0,181.0,5.0,5.0,0.0,0.0,0.0,0.0,"Somerville CCD, Burleson County, Texas",051,93610,48
8588.0,4394.0,4194.0,7601.0,3954.0,3647.0,400.0,153.0,247.0,574.0,274.0,300.0,13.0,13.0,0.0,0.0,0.0,0.0,"Caldwell CCD, Burleson County, Texas",051,90570,48
1388.0,708.0,680.0,1048.0,501.0,547.0,96.0,66.0,30.0,169.0,103.0,66.0,75.0,38.0,37.0,0.0,0.0,0.0,"Cooks Point CCD, Burleson County, Texas",051,90825,48
5781.0,2826.0,2955.0,5052.0,2478.0,2574.0,271.0,121.0,150.0,279.0,88.0,191.0,111.0,79.0,32.0,68.0,60.0,8.0,"Blanco CCD, Blanco County, Texas",031,90330,48
5158.0,2621.0,2537.0,4533.0,2209.0,2324.0,246.0,139.0,107.0,182.0,106.0,76.0,197.0,167.0,30.0,0.0,0.0,0.0,"Johnson City CCD, Blanco County, Texas",031,91950,48
10552.0,5447.0,5105.0,9527.0,4987.0,4540.0,522.0,312.0,210.0,379.0,65.0,314.0,124.0,83.0,41.0,0.0,0.0,0.0,"Buna CCD, Jasper County, Texas",241,90520,48
17563.0,8434.0,9129.0,15191.0,7254.0,7937.0,1459.0,679.0,780.0,687.0,455.0,232.0,211.0,46.0,165.0,15.0,0.0,15.0,"Jasper CCD, Jasper County, Texas",241,91920,48
7110.0,3459.0,3651.0,5884.0,2885.0,2999.0,401.0,168.0,233.0,795.0,393.0,402.0,30.0,13.0,17.0,0.0,0.0,0.0,"Kirbyville CCD, Jasper County, Texas",241,92040,48
9996.0,5075.0,4921.0,9345.0,4768.0,4577.0,304.0,114.0,190.0,284.0,163.0,121.0,63.0,30.0,33.0,0.0,0.0,0.0,"Nome-China CCD, Jefferson County, Texas",245,92770,48
115420.0,55898.0,59522.0,98951.0,47406.0,51545.0,9952.0,4922.0,5030.0,4348.0,2204.0,2144.0,1639.0,1019.0,620.0,530.0,347.0,183.0,"Beaumont CCD, Jefferson County, Texas",245,90230,48
2133.0,1102.0,1031.0,2034.0,1049.0,985.0,46.0,35.0,11.0,47.0,12.0,35.0,4.0,4.0,0.0,2.0,2.0,0.0,"Sabine Pass CCD, Jefferson County, Texas",245,93385,48
3631.0,2234.0,1397.0,2915.0,1708.0,1207.0,166.0,79.0,87.0,232.0,171.0,61.0,161.0,119.0,42.0,157.0,157.0,0.0,"Brackettville CCD, Kinney County, Texas",271,90400,48
583.0,318.0,265.0,566.0,303.0,263.0,17.0,15.0,2.0,0.0,0.0,0.0,0.0,0.0,0.0,0.0,0.0,0.0,"Hereford West CCD, Deaf Smith County, Texas",117,91790,48
17970.0,8876.0,9094.0,15956.0,7877.0,8079.0,1062.0,471.0,591.0,578.0,305.0,273.0,330.0,191.0,139.0,44.0,32.0,12.0,"Hereford East CCD, Deaf Smith County, Texas",117,91785,48
50363.0,25409.0,24954.0,37550.0,19018.0,18532.0,6666.0,3198.0,3468.0,4275.0,2257.0,2018.0,1382.0,781.0,601.0,490.0,155.0,335.0,"Galveston CCD, Galveston County, Texas",167,91445,48
19067.0,9427.0,9640.0,16777.0,8330.0,8447.0,1186.0,483.0,703.0,811.0,452.0,359.0,293.0,162.0,131.0,0.0,0.0,0.0,"Borger CCD, Hutchinson County, Texas",233,90385,48
2324.0,1222.0,1102.0,2126.0,1094.0,1032.0,99.0,40.0,59.0,55.0,48.0,7.0,40.0,36.0,4.0,4.0,4.0,0.0,"Stinnett CCD, Hutchinson County, Texas",233,93750,48
5333.0,3311.0,2022.0,4520.0,2715.0,1805.0,81.0,43.0,38.0,465.0,447.0,18.0,0.0,0.0,0.0,267.0,106.0,161.0,"Dilley CCD, Frio County, Texas",163,91055,48
3237.0,1701.0,1536.0,2906.0,1515.0,1391.0,147.0,70.0,77.0,158.0,99.0,59.0,26.0,17.0,9.0,0.0,0.0,0.0,"Crane South CCD, Crane County, Texas",103,90885,48
1478.0,759.0,719.0,1309.0,655.0,654.0,108.0,74.0,34.0,61.0,30.0,31.0,0.0,0.0,0.0,0.0,0.0,0.0,"Crane North CCD, Crane County, Texas",103,90880,48
777.0,350.0,427.0,692.0,295.0,397.0,51.0,29.0,22.0,0.0,0.0,0.0,34.0,26.0,8.0,0.0,0.0,0.0,"Adamsville CCD, Lampasas County, Texas",281,90015,48
1524.0,766.0,758.0,1351.0,673.0,678.0,69.0,31.0,38.0,59.0,35.0,24.0,45.0,27.0,18.0,0.0,0.0,0.0,"Lometa CCD, Lampasas County, Texas",281,92255,48
18047.0,8937.0,9110.0,16061.0,7963.0,8098.0,848.0,382.0,466.0,716.0,354.0,362.0,344.0,190.0,154.0,78.0,48.0,30.0,"Lampasas CCD, Lampasas County, Texas",281,92130,48
691.0,380.0,311.0,580.0,318.0,262.0,23.0,17.0,6.0,87.0,45.0,42.0,1.0,0.0,1.0,0.0,0.0,0.0,"Rochelle CCD, McCulloch County, Texas",307,93280,48
663.0,354.0,309.0,633.0,338.0,295.0,12.0,6.0,6.0,18.0,10.0,8.0,0.0,0.0,0.0,0.0,0.0,0.0,"Melvin CCD, McCulloch County, Texas",307,92505,48
6786.0,3432.0,3354.0,5464.0,2799.0,2665.0,982.0,420.0,562.0,298.0,195.0,103.0,42.0,18.0,24.0,0.0,0.0,0.0,"Brady CCD, McCulloch County, Texas",307,90405,48
1059.0,607.0,452.0,868.0,459.0,409.0,103.0,68.0,35.0,88.0,80.0,8.0,0.0,0.0,0.0,0.0,0.0,0.0,"Mason West CCD, Mason County, Texas",319,92450,48
2110.0,954.0,1156.0,1773.0,821.0,952.0,143.0,43.0,100.0,165.0,90.0,75.0,29.0,0.0,29.0,0.0,0.0,0.0,"Bolivar Peninsula CCD, Galveston County, Texas",167,90370,48
241094.0,118587.0,122507.0,206922.0,101681.0,105241.0,17285.0,8361.0,8924.0,11851.0,6215.0,5636.0,4159.0,1855.0,2304.0,877.0,475.0,402.0,"Texas City-League City CCD, Galveston County, Texas",167,93880,48
23502.0,11709.0,11793.0,19582.0,9854.0,9728.0,2518.0,1057.0,1461.0,1169.0,632.0,537.0,184.0,130.0,54.0,49.0,36.0,13.0,"La Marque-Hitchcock CCD, Galveston County, Texas",167,92100,48
13410.0,8804.0,4606.0,7027.0,4555.0,2472.0,1097.0,701.0,396.0,588.0,498.0,90.0,2966.0,1845.0,1121.0,1732.0,1205.0,527.0,"El Paso North Central CCD, El Paso County, Texas",141,91225,48
537180.0,260609.0,276571.0,457166.0,219754.0,237412.0,56792.0,28462.0,28330.0,5083.0,2773.0,2310.0,11753.0,6123.0,5630.0,6386.0,3497.0,2889.0,"El Paso CCD, El Paso County, Texas",141,91215,48
180421.0,88435.0,91986.0,163632.0,79357.0,84275.0,11160.0,5620.0,5540.0,1514.0,961.0,553.0,2534.0,1455.0,1079.0,1581.0,1042.0,539.0,"El Paso East CCD, El Paso County, Texas",141,91220,48
90780.0,44723.0,46057.0,75695.0,36938.0,38757.0,8707.0,4290.0,4417.0,774.0,376.0,398.0,4567.0,2381.0,2186.0,1037.0,738.0,299.0,"El Paso Northwest CCD, El Paso County, Texas",141,91230,48
5957.0,3553.0,2404.0,5131.0,3030.0,2101.0,383.0,133.0,250.0,400.0,366.0,34.0,43.0,24.0,19.0,0.0,0.0,0.0,"Cotulla CCD, La Salle County, Texas",283,90870,48
1322.0,655.0,667.0,839.0,386.0,453.0,118.0,65.0,53.0,71.0,64.0,7.0,135.0,47.0,88.0,159.0,93.0,66.0,"Encinal CCD, La Salle County, Texas",283,91240,48
885.0,400.0,485.0,744.0,340.0,404.0,25.0,18.0,7.0,116.0,42.0,74.0,0.0,0.0,0.0,0.0,0.0,0.0,"Miami CCD, Roberts County, Texas",393,92555,48
626.0,300.0,326.0,597.0,284.0,313.0,17.0,4.0,13.0,12.0,12.0,0.0,0.0,0.0,0.0,0.0,0.0,0.0,"West Terrell CCD, Terrell County, Texas",443,94175,48
93.0,55.0,38.0,88.0,50.0,38.0,0.0,0.0,0.0,0.0,0.0,0.0,0.0,0.0,0.0,5.0,5.0,0.0,"East Terrell CCD, Terrell County, Texas",443,91140,48
2932.0,1404.0,1528.0,2657.0,1250.0,1407.0,183.0,101.0,82.0,37.0,19.0,18.0,55.0,34.0,21.0,0.0,0.0,0.0,"Colmesneil-Chester CCD, Tyler County, Texas",457,90785,48
2702.0,1305.0,1397.0,2316.0,1183.0,1133.0,65.0,18.0,47.0,313.0,104.0,209.0,8.0,0.0,8.0,0.0,0.0,0.0,"Warren CCD, Tyler County, Texas",457,94075,48
10531.0,6393.0,4138.0,8884.0,5482.0,3402.0,696.0,320.0,376.0,852.0,555.0,297.0,88.0,36.0,52.0,11.0,0.0,11.0,"Woodville CCD, Tyler County, Texas",457,94285,48
5134.0,2500.0,2634.0,4533.0,2294.0,2239.0,148.0,49.0,99.0,307.0,105.0,202.0,146.0,52.0,94.0,0.0,0.0,0.0,"Spurger CCD, Tyler County, Texas",457,93710,48
3134.0,1584.0,1550.0,2899.0,1499.0,1400.0,116.0,21.0,95.0,20.0,0.0,20.0,99.0,64.0,35.0,0.0,0.0,0.0,"Sabinal CCD, Uvalde County, Texas",463,93375,48
23372.0,11266.0,12106.0,20323.0,9798.0,10525.0,1494.0,696.0,798.0,745.0,294.0,451.0,720.0,423.0,297.0,90.0,55.0,35.0,"Uvalde CCD, Uvalde County, Texas",463,93980,48
2602.0,1386.0,1216.0,2182.0,1118.0,1064.0,219.0,132.0,87.0,68.0,54.0,14.0,133.0,82.0,51.0,0.0,0.0,0.0,"Shamrock CCD, Wheeler County, Texas",483,93545,48
2938.0,1446.0,1492.0,2630.0,1296.0,1334.0,118.0,33.0,85.0,162.0,99.0,63.0,28.0,18.0,10.0,0.0,0.0,0.0,"Wheeler CCD, Wheeler County, Texas",483,94190,48
2307.0,1165.0,1142.0,2068.0,1059.0,1009.0,157.0,80.0,77.0,16.0,10.0,6.0,66.0,16.0,50.0,0.0,0.0,0.0,"Dalby Springs-Simms CCD, Bowie County, Texas",037,90950,48
5089.0,2183.0,2906.0,4718.0,1988.0,2730.0,268.0,136.0,132.0,70.0,49.0,21.0,8.0,8.0,0.0,25.0,2.0,23.0,"De Kalb CCD, Bowie County, Texas",037,90980,48
5379.0,2606.0,2773.0,4895.0,2354.0,2541.0,370.0,188.0,182.0,23.0,10.0,13.0,91.0,54.0,37.0,0.0,0.0,0.0,"Hooks CCD, Bowie County, Texas",037,91830,48
10368.0,6329.0,4039.0,9313.0,5584.0,3729.0,422.0,146.0,276.0,570.0,538.0,32.0,63.0,61.0,2.0,0.0,0.0,0.0,"New Boston CCD, Bowie County, Texas",037,92725,48
59449.0,29534.0,29915.0,51786.0,25692.0,26094.0,3746.0,1836.0,1910.0,1170.0,617.0,553.0,2655.0,1318.0,1337.0,92.0,71.0,21.0,"Texarkana CCD, Bowie County, Texas",037,93875,48
3357.0,1626.0,1731.0,2948.0,1428.0,1520.0,274.0,137.0,137.0,117.0,50.0,67.0,18.0,11.0,7.0,0.0,0.0,0.0,"Archer City CCD, Archer County, Texas",009,90130,48
5341.0,2663.0,2678.0,4939.0,2475.0,2464.0,117.0,56.0,61.0,265.0,123.0,142.0,20.0,9.0,11.0,0.0,0.0,0.0,"Holliday CCD, Archer County, Texas",009,91815,48
552.0,291.0,261.0,496.0,253.0,243.0,9.0,9.0,0.0,29.0,15.0,14.0,18.0,14.0,4.0,0.0,0.0,0.0,"Marathon CCD, Brewster County, Texas",043,92390,48
8630.0,4168.0,4462.0,6864.0,3282.0,3582.0,663.0,312.0,351.0,922.0,468.0,454.0,156.0,81.0,75.0,25.0,25.0,0.0,"Alpine CCD, Brewster County, Texas",043,90040,48
495.0,204.0,291.0,423.0,170.0,253.0,31.0,17.0,14.0,40.0,17.0,23.0,1.0,0.0,1.0,0.0,0.0,0.0,"Jayton South CCD, Kent County, Texas",263,91930,48
145.0,79.0,66.0,119.0,74.0,45.0,15.0,3.0,12.0,11.0,2.0,9.0,0.0,0.0,0.0,0.0,0.0,0.0,"Jayton North CCD, Kent County, Texas",263,91925,48
166603.0,80173.0,86430.0,151608.0,73208.0,78400.0,11212.0,5204.0,6008.0,1571.0,584.0,987.0,1545.0,772.0,773.0,667.0,405.0,262.0,"Mission CCD, Hidalgo County, Texas",215,92600,48
1095.0,453.0,642.0,919.0,398.0,521.0,165.0,49.0,116.0,0.0,0.0,0.0,11.0,6.0,5.0,0.0,0.0,0.0,"Puerto Rico-San Manuel CCD, Hidalgo County, Texas",215,93155,48
130309.0,64671.0,65638.0,117711.0,58554.0,59157.0,10035.0,4815.0,5220.0,1287.0,675.0,612.0,905.0,449.0,456.0,371.0,178.0,193.0,"Southeast Hidalgo CCD, Hidalgo County, Texas",215,93650,48
34664.0,16618.0,18046.0,31629.0,14959.0,16670.0,1900.0,820.0,1080.0,408.0,249.0,159.0,225.0,162.0,63.0,502.0,428.0,74.0,"Edcouch-Elsa CCD, Hidalgo County, Texas",215,91155,48
281489.0,137890.0,143599.0,253163.0,122834.0,130329.0,20772.0,11065.0,9707.0,3097.0,1780.0,1317.0,2064.0,963.0,1101.0,2393.0,1248.0,1145.0,"McAllen-Pharr CCD, Hidalgo County, Texas",215,92340,48
35572.0,16709.0,18863.0,32708.0,15393.0,17315.0,2256.0,1046.0,1210.0,275.0,139.0,136.0,288.0,110.0,178.0,45.0,21.0,24.0,"Sullivan City CCD, Hidalgo County, Texas",215,93785,48
174855.0,86500.0,88355.0,155826.0,75372.0,80454.0,12788.0,6689.0,6099.0,4261.0,3327.0,934.0,1153.0,660.0,493.0,827.0,452.0,375.0,"Edinburg CCD, Hidalgo County, Texas",215,91170,48
1335.0,604.0,731.0,1291.0,591.0,700.0,44.0,13.0,31.0,0.0,0.0,0.0,0.0,0.0,0.0,0.0,0.0,0.0,"Hargill CCD, Hidalgo County, Texas",215,91710,48
32243.0,15576.0,16667.0,28283.0,13733.0,14550.0,2293.0,1193.0,1100.0,1211.0,441.0,770.0,452.0,205.0,247.0,4.0,4.0,0.0,"Bullard CCD, Smith County, Texas",423,90515,48
100940.0,48333.0,52607.0,85388.0,40301.0,45087.0,9581.0,4929.0,4652.0,3871.0,2008.0,1863.0,1675.0,849.0,826.0,425.0,246.0,179.0,"Tyler CCD, Smith County, Texas",423,93970,48
29349.0,14108.0,15241.0,22424.0,11335.0,11089.0,3453.0,1442.0,2011.0,2942.0,1113.0,1829.0,462.0,197.0,265.0,68.0,21.0,47.0,"Stephenville CCD, Erath County, Texas",143,93735,48
5844.0,2945.0,2899.0,5468.0,2734.0,2734.0,190.0,111.0,79.0,185.0,99.0,86.0,1.0,1.0,0.0,0.0,0.0,0.0,"Dublin CCD, Erath County, Texas",143,91085,48
3306.0,1752.0,1554.0,2929.0,1551.0,1378.0,137.0,77.0,60.0,208.0,114.0,94.0,32.0,10.0,22.0,0.0,0.0,0.0,"Morgan Mill-Bluff Dale CCD, Erath County, Texas",143,92645,48
200841.0,97967.0,102874.0,180701.0,88762.0,91939.0,7006.0,3238.0,3768.0,8357.0,3703.0,4654.0,3992.0,1844.0,2148.0,785.0,420.0,365.0,"Alvin-Pearland CCD, Brazoria County, Texas",039,90055,48
31907.0,16805.0,15102.0,28842.0,15307.0,13535.0,2135.0,880.0,1255.0,718.0,510.0,208.0,183.0,79.0,104.0,29.0,29.0,0.0,"Brazoria-West Columbia CCD, Brazoria County, Texas",039,90410,48
28182.0,13380.0,14802.0,23711.0,11401.0,12310.0,2388.0,1141.0,1247.0,1198.0,538.0,660.0,749.0,212.0,537.0,136.0,88.0,48.0,"Whitehouse CCD, Smith County, Texas",423,94205,48
9787.0,4674.0,5113.0,8498.0,4037.0,4461.0,1000.0,470.0,530.0,200.0,95.0,105.0,89.0,72.0,17.0,0.0,0.0,0.0,"Troup-Arp CCD, Smith County, Texas",423,93950,48
5275.0,2567.0,2708.0,4760.0,2272.0,2488.0,310.0,216.0,94.0,191.0,76.0,115.0,0.0,0.0,0.0,14.0,3.0,11.0,"Winona CCD, Smith County, Texas",423,94260,48
20126.0,9555.0,10571.0,16554.0,7963.0,8591.0,1805.0,795.0,1010.0,1192.0,547.0,645.0,456.0,215.0,241.0,119.0,35.0,84.0,"Tyler East CCD, Smith County, Texas",423,93975,48
22770.0,11703.0,11067.0,19270.0,9867.0,9403.0,1264.0,613.0,651.0,1672.0,884.0,788.0,539.0,339.0,200.0,25.0,0.0,25.0,"Lindale CCD, Smith County, Texas",423,92210,48
8578.0,4135.0,4443.0,7575.0,3788.0,3787.0,510.0,118.0,392.0,450.0,206.0,244.0,43.0,23.0,20.0,0.0,0.0,0.0,"Glen Rose CCD, Somervell County, Texas",425,91535,48
3653.0,1852.0,1801.0,3042.0,1492.0,1550.0,435.0,245.0,190.0,172.0,115.0,57.0,4.0,0.0,4.0,0.0,0.0,0.0,"East Crockett CCD, Crockett County, Texas",105,91120,48
128.0,51.0,77.0,128.0,51.0,77.0,0.0,0.0,0.0,0.0,0.0,0.0,0.0,0.0,0.0,0.0,0.0,0.0,"West Crockett CCD, Crockett County, Texas",105,94160,48
5736.0,2712.0,3024.0,5089.0,2420.0,2669.0,279.0,126.0,153.0,168.0,85.0,83.0,195.0,76.0,119.0,5.0,5.0,0.0,"Sour Lake CCD, Hardin County, Texas",199,93625,48
15888.0,7513.0,8375.0,14398.0,6830.0,7568.0,1006.0,508.0,498.0,430.0,175.0,255.0,48.0,0.0,48.0,6.0,0.0,6.0,"Silsbee CCD, Hardin County, Texas",199,93570,48
3388.0,1494.0,1894.0,2937.0,1342.0,1595.0,278.0,110.0,168.0,173.0,42.0,131.0,0.0,0.0,0.0,0.0,0.0,0.0,"Saratoga-Batson CCD, Hardin County, Texas",199,93460,48
806.0,402.0,404.0,641.0,331.0,310.0,54.0,30.0,24.0,57.0,24.0,33.0,54.0,17.0,37.0,0.0,0.0,0.0,"Rule CCD, Haskell County, Texas",207,93360,48
13813.0,6960.0,6853.0,12209.0,6303.0,5906.0,502.0,190.0,312.0,956.0,390.0,566.0,70.0,1.0,69.0,76.0,76.0,0.0,"Kountze CCD, Hardin County, Texas",199,92055,48
600.0,301.0,299.0,511.0,247.0,264.0,0.0,0.0,0.0,77.0,47.0,30.0,11.0,6.0,5.0,1.0,1.0,0.0,"Rochester CCD, Haskell County, Texas",207,93285,48
287.0,162.0,125.0,268.0,152.0,116.0,8.0,2.0,6.0,11.0,8.0,3.0,0.0,0.0,0.0,0.0,0.0,0.0,"Sagerton CCD, Haskell County, Texas",207,93390,48
31908.0,18142.0,13766.0,26637.0,14695.0,11942.0,2243.0,1327.0,916.0,1822.0,1119.0,703.0,733.0,554.0,179.0,473.0,447.0,26.0,"Big Spring CCD, Howard County, Texas",227,90300,48
318.0,194.0,124.0,314.0,192.0,122.0,0.0,0.0,0.0,2.0,0.0,2.0,2.0,2.0,0.0,0.0,0.0,0.0,"Weinert CCD, Haskell County, Texas",207,94125,48
3723.0,2154.0,1569.0,2623.0,1274.0,1349.0,74.0,17.0,57.0,776.0,676.0,100.0,100.0,89.0,11.0,150.0,98.0,52.0,"Haskell CCD, Haskell County, Texas",207,91735,48
2201.0,1264.0,937.0,1832.0,1038.0,794.0,220.0,136.0,84.0,125.0,80.0,45.0,24.0,10.0,14.0,0.0,0.0,0.0,"Big Spring North CCD, Howard County, Texas",227,90305,48
1914.0,936.0,978.0,1702.0,813.0,889.0,200.0,116.0,84.0,0.0,0.0,0.0,12.0,7.0,5.0,0.0,0.0,0.0,"Coahoma CCD, Howard County, Texas",227,90770,48
5442.0,2758.0,2684.0,4894.0,2403.0,2491.0,246.0,167.0,79.0,253.0,152.0,101.0,49.0,36.0,13.0,0.0,0.0,0.0,"Centerville CCD, Leon County, Texas",289,90680,48
2671.0,1355.0,1316.0,2350.0,1232.0,1118.0,80.0,9.0,71.0,171.0,49.0,122.0,56.0,51.0,5.0,14.0,14.0,0.0,"Normangee CCD, Leon County, Texas",289,92775,48
5430.0,2604.0,2826.0,4171.0,2001.0,2170.0,804.0,394.0,410.0,432.0,200.0,232.0,23.0,9.0,14.0,0.0,0.0,0.0,"Buffalo CCD, Leon County, Texas",289,90510,48
1211.0,536.0,675.0,1165.0,523.0,642.0,3.0,3.0,0.0,43.0,10.0,33.0,0.0,0.0,0.0,0.0,0.0,0.0,"Oakwood CCD, Leon County, Texas",289,92870,48
1755.0,867.0,888.0,1598.0,786.0,812.0,12.0,8.0,4.0,131.0,59.0,72.0,14.0,14.0,0.0,0.0,0.0,0.0,"Mullin-Priddy CCD, Mills County, Texas",333,92690,48
3096.0,1378.0,1718.0,2919.0,1304.0,1615.0,37.0,13.0,24.0,82.0,38.0,44.0,26.0,23.0,3.0,32.0,0.0,32.0,"Goldthwaite CCD, Mills County, Texas",333,91550,48
4536.0,2264.0,2272.0,3891.0,1981.0,1910.0,430.0,176.0,254.0,180.0,88.0,92.0,26.0,14.0,12.0,9.0,5.0,4.0,"Nocona CCD, Montague County, Texas",337,92765,48
1975.0,1052.0,923.0,1773.0,930.0,843.0,114.0,68.0,46.0,81.0,47.0,34.0,7.0,7.0,0.0,0.0,0.0,0.0,"Montague-Forestburg CCD, Montague County, Texas",337,92610,48
10058.0,4815.0,5243.0,8321.0,3836.0,4485.0,600.0,371.0,229.0,969.0,523.0,446.0,127.0,85.0,42.0,41.0,0.0,41.0,"Bowie CCD, Montague County, Texas",337,90390,48
2564.0,1281.0,1283.0,2147.0,1069.0,1078.0,215.0,116.0,99.0,113.0,55.0,58.0,89.0,41.0,48.0,0.0,0.0,0.0,"St. Jo CCD, Montague County, Texas",337,93395,48
61285.0,30499.0,30786.0,49848.0,24557.0,25291.0,7706.0,3928.0,3778.0,2241.0,1366.0,875.0,1400.0,636.0,764.0,90.0,12.0,78.0,"Brazosport CCD, Brazoria County, Texas",039,90415,48
522.0,252.0,270.0,487.0,231.0,256.0,22.0,14.0,8.0,4.0,2.0,2.0,9.0,5.0,4.0,0.0,0.0,0.0,"Hedley CCD, Donley County, Texas",129,91760,48
2886.0,1448.0,1438.0,2343.0,1192.0,1151.0,178.0,90.0,88.0,235.0,94.0,141.0,130.0,72.0,58.0,0.0,0.0,0.0,"Clarendon CCD, Donley County, Texas",129,90730,48
5926.0,3081.0,2845.0,4998.0,2539.0,2459.0,789.0,414.0,375.0,139.0,128.0,11.0,0.0,0.0,0.0,0.0,0.0,0.0,"Jourdanton CCD, Atascosa County, Texas",013,91955,48
367.0,187.0,180.0,315.0,161.0,154.0,0.0,0.0,0.0,0.0,0.0,0.0,52.0,26.0,26.0,0.0,0.0,0.0,"Campbellton CCD, Atascosa County, Texas",013,90595,48
17637.0,8693.0,8944.0,14039.0,6755.0,7284.0,1823.0,847.0,976.0,1418.0,836.0,582.0,288.0,234.0,54.0,69.0,21.0,48.0,"Pleasanton CCD, Atascosa County, Texas",013,93070,48
20848.0,10353.0,10495.0,18389.0,9021.0,9368.0,1086.0,525.0,561.0,842.0,508.0,334.0,531.0,299.0,232.0,0.0,0.0,0.0,"Poteet CCD, Atascosa County, Texas",013,93120,48
2670.0,1307.0,1363.0,2412.0,1176.0,1236.0,98.0,61.0,37.0,139.0,64.0,75.0,0.0,0.0,0.0,21.0,6.0,15.0,"Charlotte CCD, Atascosa County, Texas",013,90695,48
738.0,413.0,325.0,730.0,406.0,324.0,3.0,2.0,1.0,5.0,5.0,0.0,0.0,0.0,0.0,0.0,0.0,0.0,"Talpa CCD, Coleman County, Texas",083,93830,48
547.0,299.0,248.0,473.0,269.0,204.0,0.0,0.0,0.0,47.0,22.0,25.0,27.0,8.0,19.0,0.0,0.0,0.0,"Novice CCD, Coleman County, Texas",083,92865,48
1881.0,958.0,923.0,1804.0,913.0,891.0,32.0,19.0,13.0,38.0,22.0,16.0,0.0,0.0,0.0,7.0,4.0,3.0,"Santa Anna CCD, Coleman County, Texas",083,93450,48
5212.0,2575.0,2637.0,4907.0,2432.0,2475.0,121.0,59.0,62.0,158.0,59.0,99.0,26.0,25.0,1.0,0.0,0.0,0.0,"Coleman CCD, Coleman County, Texas",083,90780,48
12141.0,6075.0,6066.0,9704.0,4931.0,4773.0,1022.0,426.0,596.0,1082.0,491.0,591.0,228.0,122.0,106.0,105.0,105.0,0.0,"Sweetwater CCD, Nolan County, Texas",353,93810,48
504.0,246.0,258.0,474.0,237.0,237.0,17.0,4.0,13.0,9.0,5.0,4.0,4.0,0.0,4.0,0.0,0.0,0.0,"Blackwell-Nolan CCD, Nolan County, Texas",353,90325,48
2202.0,1226.0,976.0,2075.0,1135.0,940.0,56.0,52.0,4.0,27.0,21.0,6.0,44.0,18.0,26.0,0.0,0.0,0.0,"Roscoe CCD, Nolan County, Texas",353,93325,48
1745.0,740.0,1005.0,1648.0,675.0,973.0,11.0,6.0,5.0,36.0,36.0,0.0,0.0,0.0,0.0,50.0,23.0,27.0,"Fort Hancock CCD, Hudspeth County, Texas",229,91360,48
1202.0,724.0,478.0,557.0,234.0,323.0,84.0,53.0,31.0,137.0,85.0,52.0,58.0,40.0,18.0,366.0,312.0,54.0,"Sierra Blanca CCD, Hudspeth County, Texas",229,93565,48
673.0,295.0,378.0,641.0,275.0,366.0,26.0,17.0,9.0,6.0,3.0,3.0,0.0,0.0,0.0,0.0,0.0,0.0,"Dell City CCD, Hudspeth County, Texas",229,90990,48
1650.0,831.0,819.0,1571.0,805.0,766.0,41.0,11.0,30.0,9.0,0.0,9.0,29.0,15.0,14.0,0.0,0.0,0.0,"D'Hanis CCD, Medina County, Texas",325,91040,48
16743.0,8540.0,8203.0,15007.0,7826.0,7181.0,504.0,220.0,284.0,1177.0,482.0,695.0,55.0,12.0,43.0,0.0,0.0,0.0,"Castroville-LaCoste CCD, Medina County, Texas",325,90645,48
13549.0,7710.0,5839.0,10975.0,5883.0,5092.0,911.0,413.0,498.0,1619.0,1385.0,234.0,44.0,29.0,15.0,0.0,0.0,0.0,"Hondo CCD, Medina County, Texas",325,91820,48
16098.0,7895.0,8203.0,14291.0,6838.0,7453.0,1209.0,644.0,565.0,446.0,278.0,168.0,152.0,135.0,17.0,0.0,0.0,0.0,"Devine-Natalia CCD, Medina County, Texas",325,91030,48
530.0,260.0,270.0,514.0,253.0,261.0,12.0,7.0,5.0,4.0,0.0,4.0,0.0,0.0,0.0,0.0,0.0,0.0,"Grandfalls CCD, Ward County, Texas",475,91615,48
818.0,434.0,384.0,763.0,393.0,370.0,33.0,29.0,4.0,21.0,11.0,10.0,1.0,1.0,0.0,0.0,0.0,0.0,"Barstow-Pyote CCD, Ward County, Texas",475,90205,48
9986.0,4961.0,5025.0,8258.0,4055.0,4203.0,999.0,523.0,476.0,522.0,262.0,260.0,207.0,121.0,86.0,0.0,0.0,0.0,"Monahans CCD, Ward County, Texas",475,92605,48
23935.0,11659.0,12276.0,20322.0,9599.0,10723.0,2080.0,1184.0,896.0,1159.0,587.0,572.0,350.0,268.0,82.0,24.0,21.0,3.0,"Athens CCD, Henderson County, Texas",213,90155,48
35740.0,17276.0,18464.0,30372.0,14591.0,15781.0,2990.0,1490.0,1500.0,1541.0,743.0,798.0,778.0,421.0,357.0,59.0,31.0,28.0,"Cedar Creek Lake CCD, Henderson County, Texas",213,90652,48
2572.0,1292.0,1280.0,2572.0,1292.0,1280.0,0.0,0.0,0.0,0.0,0.0,0.0,0.0,0.0,0.0,0.0,0.0,0.0,"Call CCD, Newton County, Texas",351,90575,48
2068.0,1189.0,879.0,1963.0,1139.0,824.0,0.0,0.0,0.0,91.0,44.0,47.0,8.0,0.0,8.0,6.0,6.0,0.0,"Burkeville CCD, Newton County, Texas",351,90530,48
3486.0,1820.0,1666.0,3129.0,1611.0,1518.0,111.0,96.0,15.0,220.0,87.0,133.0,26.0,26.0,0.0,0.0,0.0,0.0,"Deweyville CCD, Newton County, Texas",351,91035,48
5951.0,3129.0,2822.0,5517.0,2839.0,2678.0,343.0,264.0,79.0,68.0,9.0,59.0,23.0,17.0,6.0,0.0,0.0,0.0,"Newton CCD, Newton County, Texas",351,92750,48
11178.0,5296.0,5882.0,9508.0,4545.0,4963.0,959.0,348.0,611.0,635.0,348.0,287.0,65.0,52.0,13.0,11.0,3.0,8.0,"Carthage CCD, Panola County, Texas",365,90640,48
3404.0,1728.0,1676.0,3052.0,1586.0,1466.0,117.0,56.0,61.0,220.0,78.0,142.0,15.0,8.0,7.0,0.0,0.0,0.0,"Beckville CCD, Panola County, Texas",365,90235,48
2430.0,1164.0,1266.0,2225.0,1057.0,1168.0,80.0,30.0,50.0,125.0,77.0,48.0,0.0,0.0,0.0,0.0,0.0,0.0,"Gary City CCD, Panola County, Texas",365,91475,48
2408.0,1256.0,1152.0,2306.0,1217.0,1089.0,36.0,30.0,6.0,58.0,5.0,53.0,8.0,4.0,4.0,0.0,0.0,0.0,"Long Branch-Dotson CCD, Panola County, Texas",365,92265,48
3964.0,2084.0,1880.0,3701.0,1950.0,1751.0,12.0,0.0,12.0,213.0,96.0,117.0,38.0,38.0,0.0,0.0,0.0,0.0,"De Berry-Deadwood CCD, Panola County, Texas",365,90970,48
13590.0,8359.0,5231.0,11385.0,6577.0,4808.0,416.0,283.0,133.0,1000.0,759.0,241.0,369.0,326.0,43.0,420.0,414.0,6.0,"Pecos CCD, Reeves County, Texas",389,92990,48
1068.0,513.0,555.0,938.0,434.0,504.0,30.0,16.0,14.0,46.0,37.0,9.0,54.0,26.0,28.0,0.0,0.0,0.0,"Balmorhea CCD, Reeves County, Texas",389,90190,48
2507.0,1254.0,1253.0,2230.0,1157.0,1073.0,106.0,28.0,78.0,111.0,18.0,93.0,60.0,51.0,9.0,0.0,0.0,0.0,"Milam CCD, Sabine County, Texas",403,92580,48
3483.0,1728.0,1755.0,3059.0,1559.0,1500.0,285.0,98.0,187.0,114.0,69.0,45.0,25.0,2.0,23.0,0.0,0.0,0.0,"Pineland CCD, Sabine County, Texas",403,93045,48
