4300.0,2171.0,2129.0,3941.0,1991.0,1950.0,146.0,84.0,62.0,62.0,19.0,43.0,151.0,77.0,74.0,0.0,0.0,0.0,"Hemphill CCD, Sabine County, Texas",403,91765,48
792.0,404.0,388.0,655.0,351.0,304.0,56.0,20.0,36.0,68.0,26.0,42.0,13.0,7.0,6.0,0.0,0.0,0.0,"Happy CCD, Swisher County, Texas",437,91700,48
1243.0,672.0,571.0,1069.0,586.0,483.0,73.0,37.0,36.0,83.0,43.0,40.0,13.0,3.0,10.0,5.0,3.0,2.0,"Kress CCD, Swisher County, Texas",437,92060,48
5456.0,2865.0,2591.0,4637.0,2227.0,2410.0,239.0,135.0,104.0,539.0,469.0,70.0,41.0,34.0,7.0,0.0,0.0,0.0,"Tulia CCD, Swisher County, Texas",437,93955,48
3954.0,2003.0,1951.0,3417.0,1726.0,1691.0,361.0,199.0,162.0,87.0,34.0,53.0,15.0,9.0,6.0,74.0,35.0,39.0,"Celeste CCD, Hunt County, Texas",231,90660,48
9243.0,4542.0,4701.0,8399.0,4165.0,4234.0,188.0,122.0,66.0,531.0,171.0,360.0,86.0,76.0,10.0,39.0,8.0,31.0,"Caddo Mills CCD, Hunt County, Texas",231,90565,48
5284.0,2616.0,2668.0,4877.0,2380.0,2497.0,244.0,151.0,93.0,114.0,57.0,57.0,46.0,25.0,21.0,3.0,3.0,0.0,"Lone Oak CCD, Hunt County, Texas",231,92260,48
2622.0,1314.0,1308.0,2272.0,1133.0,1139.0,312.0,154.0,158.0,12.0,12.0,0.0,26.0,15.0,11.0,0.0,0.0,0.0,"Wolfe City CCD, Hunt County, Texas",231,94270,48
36059.0,17822.0,18237.0,28655.0,14029.0,14626.0,4246.0,2077.0,2169.0,2452.0,1301.0,1151.0,552.0,353.0,199.0,154.0,62.0,92.0,"Greenville CCD, Hunt County, Texas",231,91640,48
10953.0,5225.0,5728.0,7750.0,3813.0,3937.0,1003.0,486.0,517.0,1661.0,665.0,996.0,203.0,39.0,164.0,336.0,222.0,114.0,"Commerce CCD, Hunt County, Texas",231,90820,48
21196.0,10398.0,10798.0,18226.0,8924.0,9302.0,1519.0,752.0,767.0,1056.0,535.0,521.0,361.0,187.0,174.0,34.0,0.0,34.0,"Quinlan CCD, Hunt County, Texas",231,93170,48
11007.0,5294.0,5713.0,9865.0,4727.0,5138.0,509.0,245.0,264.0,447.0,205.0,242.0,178.0,109.0,69.0,8.0,8.0,0.0,"Pittsburg CCD, Camp County, Texas",063,93050,48
1427.0,804.0,623.0,1401.0,778.0,623.0,0.0,0.0,0.0,11.0,11.0,0.0,15.0,15.0,0.0,0.0,0.0,0.0,"Leesburg-Newsome CCD, Camp County, Texas",063,92170,48
3678.0,1790.0,1888.0,3123.0,1492.0,1631.0,340.0,186.0,154.0,104.0,67.0,37.0,111.0,45.0,66.0,0.0,0.0,0.0,"Spearman CCD, Hansford County, Texas",195,93695,48
1810.0,970.0,840.0,1641.0,881.0,760.0,99.0,33.0,66.0,70.0,56.0,14.0,0.0,0.0,0.0,0.0,0.0,0.0,"Gruver CCD, Hansford County, Texas",195,91660,48
82773.0,40219.0,42554.0,71235.0,34439.0,36796.0,2504.0,1228.0,1276.0,5177.0,2753.0,2424.0,3345.0,1547.0,1798.0,512.0,252.0,260.0,"Schertz-Cibolo CCD, Guadalupe County, Texas",187,93470,48
23473.0,11160.0,12313.0,20874.0,9839.0,11035.0,1437.0,636.0,801.0,767.0,423.0,344.0,335.0,233.0,102.0,60.0,29.0,31.0,"Marshall CCD, Harrison County, Texas",203,92430,48
14215.0,7211.0,7004.0,13225.0,6693.0,6532.0,374.0,177.0,197.0,326.0,224.0,102.0,285.0,112.0,173.0,5.0,5.0,0.0,"Waskom CCD, Harrison County, Texas",203,94085,48
21596.0,10468.0,11128.0,19749.0,9662.0,10087.0,1062.0,422.0,640.0,633.0,303.0,330.0,99.0,53.0,46.0,53.0,28.0,25.0,"Hallsville CCD, Harrison County, Texas",203,91685,48
6620.0,3344.0,3276.0,6192.0,3135.0,3057.0,84.0,38.0,46.0,343.0,171.0,172.0,1.0,0.0,1.0,0.0,0.0,0.0,"Harleton CCD, Harrison County, Texas",203,91715,48
1893.0,1046.0,847.0,1578.0,861.0,717.0,165.0,87.0,78.0,87.0,56.0,31.0,63.0,42.0,21.0,0.0,0.0,0.0,"Menard West CCD, Menard County, Texas",327,92520,48
219.0,108.0,111.0,198.0,98.0,100.0,0.0,0.0,0.0,21.0,10.0,11.0,0.0,0.0,0.0,0.0,0.0,0.0,"Menard East CCD, Menard County, Texas",327,92515,48
548.0,286.0,262.0,531.0,269.0,262.0,0.0,0.0,0.0,8.0,8.0,0.0,9.0,9.0,0.0,0.0,0.0,0.0,"Howland CCD, Lamar County, Texas",277,91840,48
4450.0,2271.0,2179.0,4174.0,2125.0,2049.0,138.0,81.0,57.0,83.0,22.0,61.0,55.0,43.0,12.0,0.0,0.0,0.0,"Powderly CCD, Lamar County, Texas",277,93130,48
1501.0,739.0,762.0,1451.0,689.0,762.0,10.0,10.0,0.0,40.0,40.0,0.0,0.0,0.0,0.0,0.0,0.0,0.0,"Biardstown CCD, Lamar County, Texas",277,90285,48
5004.0,2638.0,2366.0,4246.0,2130.0,2116.0,456.0,309.0,147.0,154.0,108.0,46.0,114.0,81.0,33.0,34.0,10.0,24.0,"Sumner CCD, Lamar County, Texas",277,93795,48
3738.0,1927.0,1811.0,3475.0,1784.0,1691.0,190.0,114.0,76.0,55.0,26.0,29.0,18.0,3.0,15.0,0.0,0.0,0.0,"Blossom CCD, Lamar County, Texas",277,90345,48
3042.0,1582.0,1460.0,2468.0,1366.0,1102.0,377.0,140.0,237.0,106.0,48.0,58.0,91.0,28.0,63.0,0.0,0.0,0.0,"Mason East CCD, Mason County, Texas",319,92445,48
774.0,391.0,383.0,647.0,310.0,337.0,81.0,52.0,29.0,31.0,22.0,9.0,14.0,6.0,8.0,1.0,1.0,0.0,"Dickens CCD, Dickens County, Texas",125,91050,48
1445.0,795.0,650.0,1213.0,620.0,593.0,107.0,92.0,15.0,108.0,74.0,34.0,10.0,2.0,8.0,7.0,7.0,0.0,"Spur CCD, Dickens County, Texas",125,93705,48
8729.0,4348.0,4381.0,7635.0,3714.0,3921.0,434.0,246.0,188.0,577.0,325.0,252.0,58.0,38.0,20.0,25.0,25.0,0.0,"Giddings CCD, Lee County, Texas",287,91505,48
2987.0,1561.0,1426.0,2631.0,1384.0,1247.0,106.0,56.0,50.0,219.0,96.0,123.0,25.0,25.0,0.0,6.0,0.0,6.0,"Lincoln-Dime Box CCD, Lee County, Texas",287,92205,48
4951.0,2443.0,2508.0,4100.0,2027.0,2073.0,232.0,113.0,119.0,597.0,297.0,300.0,22.0,6.0,16.0,0.0,0.0,0.0,"Lexington CCD, Lee County, Texas",287,92190,48
523179.0,255722.0,267457.0,437071.0,214112.0,222959.0,50790.0,24544.0,26246.0,18623.0,8806.0,9817.0,12386.0,6032.0,6354.0,4309.0,2228.0,2081.0,"Arlington CCD, Tarrant County, Texas",439,90135,48
855126.0,418959.0,436167.0,709351.0,349045.0,360306.0,100343.0,47650.0,52693.0,24549.0,12063.0,12486.0,15214.0,7617.0,7597.0,5669.0,2584.0,3085.0,"Fort Worth CCD, Tarrant County, Texas",439,91380,48
576791.0,281425.0,295366.0,471724.0,231567.0,240157.0,63206.0,30096.0,33110.0,20853.0,9918.0,10935.0,15869.0,7687.0,8182.0,5139.0,2157.0,2982.0,"Northeast Tarrant CCD, Tarrant County, Texas",439,92805,48
6922.0,3408.0,3514.0,6546.0,3231.0,3315.0,279.0,130.0,149.0,62.0,25.0,37.0,22.0,22.0,0.0,13.0,0.0,13.0,"Elkhart CCD, Anderson County, Texas",001,91205,48
885.0,466.0,419.0,683.0,330.0,353.0,60.0,43.0,17.0,135.0,86.0,49.0,0.0,0.0,0.0,7.0,7.0,0.0,"Cayuga CCD, Anderson County, Texas",001,90650,48
1401.0,776.0,625.0,1281.0,717.0,564.0,53.0,30.0,23.0,58.0,23.0,35.0,6.0,6.0,0.0,3.0,0.0,3.0,"Roxton CCD, Lamar County, Texas",277,93355,48
29882.0,13765.0,16117.0,24303.0,11022.0,13281.0,3984.0,1826.0,2158.0,1123.0,657.0,466.0,440.0,230.0,210.0,32.0,30.0,2.0,"Paris CCD, Lamar County, Texas",277,92970,48
2316.0,1212.0,1104.0,2133.0,1088.0,1045.0,98.0,44.0,54.0,85.0,80.0,5.0,0.0,0.0,0.0,0.0,0.0,0.0,"Deport CCD, Lamar County, Texas",277,91020,48
2065.0,979.0,1086.0,1978.0,937.0,1041.0,38.0,22.0,16.0,49.0,20.0,29.0,0.0,0.0,0.0,0.0,0.0,0.0,"Round Top CCD, Fayette County, Texas",149,93345,48
4334.0,2244.0,2090.0,4110.0,2144.0,1966.0,85.0,32.0,53.0,121.0,50.0,71.0,18.0,18.0,0.0,0.0,0.0,0.0,"La Grange West CCD, Fayette County, Texas",149,92085,48
5105.0,2275.0,2830.0,4754.0,2149.0,2605.0,53.0,4.0,49.0,132.0,47.0,85.0,166.0,75.0,91.0,0.0,0.0,0.0,"Schulenburg CCD, Fayette County, Texas",149,93475,48
2005.0,1024.0,981.0,1954.0,996.0,958.0,12.0,8.0,4.0,39.0,20.0,19.0,0.0,0.0,0.0,0.0,0.0,0.0,"Fayetteville CCD, Fayette County, Texas",149,91305,48
7203.0,3553.0,3650.0,6736.0,3302.0,3434.0,325.0,162.0,163.0,120.0,89.0,31.0,22.0,0.0,22.0,0.0,0.0,0.0,"La Grange CCD, Fayette County, Texas",149,92080,48
4058.0,2000.0,2058.0,3758.0,1846.0,1912.0,119.0,56.0,63.0,180.0,97.0,83.0,1.0,1.0,0.0,0.0,0.0,0.0,"Flatonia CCD, Fayette County, Texas",149,91320,48
67247.0,32468.0,34779.0,54920.0,26716.0,28204.0,5605.0,2763.0,2842.0,3981.0,1783.0,2198.0,2078.0,995.0,1083.0,663.0,211.0,452.0,"Taylor CCD, Williamson County, Texas",491,93845,48
8718.0,4350.0,4368.0,7574.0,3860.0,3714.0,706.0,326.0,380.0,255.0,77.0,178.0,183.0,87.0,96.0,0.0,0.0,0.0,"Jarrell CCD, Williamson County, Texas",491,91915,48
3994.0,2512.0,1482.0,3325.0,1962.0,1363.0,137.0,77.0,60.0,508.0,449.0,59.0,24.0,24.0,0.0,0.0,0.0,0.0,"Granger CCD, Williamson County, Texas",491,91630,48
16462.0,7942.0,8520.0,14483.0,6947.0,7536.0,719.0,360.0,359.0,815.0,387.0,428.0,381.0,219.0,162.0,64.0,29.0,35.0,"Florence CCD, Williamson County, Texas",491,91325,48
1092.0,568.0,524.0,926.0,479.0,447.0,60.0,45.0,15.0,94.0,42.0,52.0,12.0,2.0,10.0,0.0,0.0,0.0,"Junction Northwest CCD, Kimble County, Texas",267,91960,48
3263.0,1501.0,1762.0,2713.0,1244.0,1469.0,240.0,119.0,121.0,199.0,67.0,132.0,87.0,47.0,40.0,24.0,24.0,0.0,"Junction Southeast CCD, Kimble County, Texas",267,91965,48
5708.0,2956.0,2752.0,5349.0,2738.0,2611.0,185.0,103.0,82.0,174.0,115.0,59.0,0.0,0.0,0.0,0.0,0.0,0.0,"Corrigan CCD, Polk County, Texas",373,90860,48
973.0,481.0,492.0,856.0,422.0,434.0,0.0,0.0,0.0,115.0,57.0,58.0,2.0,2.0,0.0,0.0,0.0,0.0,"Austwell-Tivoli CCD, Refugio County, Texas",391,90170,48
2553.0,1365.0,1188.0,2278.0,1209.0,1069.0,50.0,39.0,11.0,216.0,111.0,105.0,7.0,4.0,3.0,2.0,2.0,0.0,"Woodsboro CCD, Refugio County, Texas",391,94275,48
3707.0,1723.0,1984.0,3304.0,1579.0,1725.0,190.0,56.0,134.0,210.0,88.0,122.0,3.0,0.0,3.0,0.0,0.0,0.0,"Refugio CCD, Refugio County, Texas",391,93220,48
43962.0,21554.0,22408.0,38233.0,18624.0,19609.0,2766.0,1321.0,1445.0,2394.0,1254.0,1140.0,552.0,338.0,214.0,17.0,17.0,0.0,"Seguin CCD, Guadalupe County, Texas",187,93500,48
1759.0,854.0,905.0,1658.0,813.0,845.0,39.0,9.0,30.0,46.0,19.0,27.0,12.0,9.0,3.0,4.0,4.0,0.0,"Bellevue-Joy CCD, Clay County, Texas",077,90245,48
6336.0,3220.0,3116.0,5248.0,2574.0,2674.0,354.0,226.0,128.0,647.0,368.0,279.0,64.0,33.0,31.0,23.0,19.0,4.0,"Henrietta CCD, Clay County, Texas",077,91780,48
2162.0,1043.0,1119.0,1966.0,931.0,1035.0,72.0,40.0,32.0,107.0,70.0,37.0,2.0,2.0,0.0,15.0,0.0,15.0,"Byers-Petrolia CCD, Clay County, Texas",077,90560,48
614.0,272.0,342.0,506.0,217.0,289.0,77.0,45.0,32.0,24.0,5.0,19.0,0.0,0.0,0.0,7.0,5.0,2.0,"Channing CCD, Hartley County, Texas",205,90690,48
3246.0,1542.0,1704.0,2755.0,1332.0,1423.0,216.0,90.0,126.0,159.0,78.0,81.0,112.0,38.0,74.0,4.0,4.0,0.0,"Hubbard-Mount Calm CCD, Hill County, Texas",217,91845,48
3518.0,1636.0,1882.0,3154.0,1457.0,1697.0,47.0,25.0,22.0,274.0,132.0,142.0,43.0,22.0,21.0,0.0,0.0,0.0,"Itasca CCD, Hill County, Texas",217,91900,48
4639.0,2247.0,2392.0,4117.0,1988.0,2129.0,248.0,141.0,107.0,187.0,84.0,103.0,87.0,34.0,53.0,0.0,0.0,0.0,"Blum CCD, Hill County, Texas",217,90355,48
9338.0,4748.0,4590.0,7830.0,3976.0,3854.0,1003.0,523.0,480.0,388.0,178.0,210.0,115.0,71.0,44.0,2.0,0.0,2.0,"Whitney CCD, Hill County, Texas",217,94210,48
12861.0,6474.0,6387.0,10671.0,5246.0,5425.0,920.0,613.0,307.0,970.0,461.0,509.0,240.0,126.0,114.0,60.0,28.0,32.0,"Hillsboro CCD, Hill County, Texas",217,91810,48
1098.0,483.0,615.0,996.0,442.0,554.0,23.0,4.0,19.0,68.0,33.0,35.0,4.0,0.0,4.0,7.0,4.0,3.0,"Malone-Penelope CCD, Hill County, Texas",217,92380,48
5685.0,2994.0,2691.0,4934.0,2435.0,2499.0,419.0,305.0,114.0,302.0,235.0,67.0,3.0,3.0,0.0,27.0,16.0,11.0,"Groesbeck CCD, Limestone County, Texas",293,91650,48
945.0,446.0,499.0,860.0,391.0,469.0,28.0,22.0,6.0,55.0,31.0,24.0,2.0,2.0,0.0,0.0,0.0,0.0,"Kosse CCD, Limestone County, Texas",293,92050,48
2373.0,1171.0,1202.0,2055.0,1010.0,1045.0,205.0,91.0,114.0,113.0,70.0,43.0,0.0,0.0,0.0,0.0,0.0,0.0,"Thornton CCD, Limestone County, Texas",293,93900,48
995.0,510.0,485.0,869.0,449.0,420.0,25.0,6.0,19.0,69.0,32.0,37.0,32.0,23.0,9.0,0.0,0.0,0.0,"Prairie Hill CCD, Limestone County, Texas",293,93135,48
1167.0,598.0,569.0,1005.0,504.0,501.0,84.0,48.0,36.0,78.0,46.0,32.0,0.0,0.0,0.0,0.0,0.0,0.0,"Coolidge CCD, Limestone County, Texas",293,90835,48
1809.0,742.0,1067.0,1566.0,626.0,940.0,18.0,5.0,13.0,225.0,111.0,114.0,0.0,0.0,0.0,0.0,0.0,0.0,"Personville CCD, Limestone County, Texas",293,93015,48
10210.0,5443.0,4767.0,8853.0,4674.0,4179.0,937.0,478.0,459.0,389.0,277.0,112.0,31.0,14.0,17.0,0.0,0.0,0.0,"Mexia CCD, Limestone County, Texas",293,92550,48
2802.0,1315.0,1487.0,2354.0,1109.0,1245.0,321.0,162.0,159.0,125.0,42.0,83.0,2.0,2.0,0.0,0.0,0.0,0.0,"Garrison CCD, Nacogdoches County, Texas",347,91465,48
51818.0,24404.0,27414.0,38896.0,18797.0,20099.0,7030.0,3193.0,3837.0,5074.0,1973.0,3101.0,697.0,404.0,293.0,121.0,37.0,84.0,"Nacogdoches CCD, Nacogdoches County, Texas",347,92700,48
4856.0,2512.0,2344.0,4546.0,2338.0,2208.0,212.0,126.0,86.0,73.0,36.0,37.0,17.0,12.0,5.0,8.0,0.0,8.0,"Cushing-Douglass CCD, Nacogdoches County, Texas",347,90935,48
5230.0,2716.0,2514.0,4936.0,2545.0,2391.0,127.0,81.0,46.0,136.0,75.0,61.0,30.0,14.0,16.0,1.0,1.0,0.0,"Chireno-Martinsville CCD, Nacogdoches County, Texas",347,90720,48
5146.0,2541.0,2605.0,4313.0,2147.0,2166.0,477.0,234.0,243.0,178.0,71.0,107.0,149.0,67.0,82.0,29.0,22.0,7.0,"Farwell-Bovina CCD, Parmer County, Texas",369,91300,48
4550.0,2442.0,2108.0,4007.0,2078.0,1929.0,150.0,108.0,42.0,294.0,171.0,123.0,18.0,18.0,0.0,81.0,67.0,14.0,"Friona CCD, Parmer County, Texas",369,91410,48
12352.0,6561.0,5791.0,10323.0,5332.0,4991.0,1078.0,602.0,476.0,751.0,520.0,231.0,156.0,74.0,82.0,44.0,33.0,11.0,"Weatherford Northwest CCD, Parker County, Texas",367,94100,48
40102.0,19200.0,20902.0,33800.0,16368.0,17432.0,2865.0,1435.0,1430.0,2484.0,975.0,1509.0,876.0,393.0,483.0,77.0,29.0,48.0,"Weatherford CCD, Parker County, Texas",367,94095,48
31781.0,15749.0,16032.0,28049.0,13879.0,14170.0,1354.0,700.0,654.0,1729.0,854.0,875.0,570.0,263.0,307.0,79.0,53.0,26.0,"Weatherford Southeast CCD, Parker County, Texas",367,94105,48
7460.0,3739.0,3721.0,6945.0,3494.0,3451.0,87.0,61.0,26.0,365.0,159.0,206.0,63.0,25.0,38.0,0.0,0.0,0.0,"Ben Wheeler-Edom CCD, Van Zandt County, Texas",467,90270,48
10856.0,5331.0,5525.0,9343.0,4532.0,4811.0,824.0,397.0,427.0,522.0,267.0,255.0,167.0,135.0,32.0,0.0,0.0,0.0,"Canton CCD, Van Zandt County, Texas",467,90620,48
8621.0,4047.0,4574.0,7559.0,3525.0,4034.0,369.0,189.0,180.0,584.0,268.0,316.0,100.0,65.0,35.0,9.0,0.0,9.0,"Wills Point CCD, Van Zandt County, Texas",467,94225,48
6271.0,3031.0,3240.0,5605.0,2610.0,2995.0,384.0,223.0,161.0,210.0,159.0,51.0,72.0,39.0,33.0,0.0,0.0,0.0,"Van CCD, Van Zandt County, Texas",467,94000,48
4934.0,2342.0,2592.0,4434.0,2168.0,2266.0,263.0,79.0,184.0,217.0,84.0,133.0,20.0,11.0,9.0,0.0,0.0,0.0,"Edgewood CCD, Van Zandt County, Texas",467,91165,48
6456.0,3411.0,3045.0,5632.0,3005.0,2627.0,149.0,62.0,87.0,586.0,306.0,280.0,89.0,38.0,51.0,0.0,0.0,0.0,"Cedar Creek Lake CCD, Van Zandt County, Texas",467,90654,48
8281.0,4031.0,4250.0,7083.0,3531.0,3552.0,635.0,246.0,389.0,423.0,185.0,238.0,125.0,54.0,71.0,15.0,15.0,0.0,"Grand Saline CCD, Van Zandt County, Texas",467,91620,48
7902.0,4121.0,3781.0,5572.0,2674.0,2898.0,159.0,108.0,51.0,1877.0,1109.0,768.0,288.0,224.0,64.0,6.0,6.0,0.0,"Martindale CCD, Caldwell County, Texas",055,92440,48
7963.0,4022.0,3941.0,7242.0,3631.0,3611.0,132.0,74.0,58.0,514.0,257.0,257.0,75.0,60.0,15.0,0.0,0.0,0.0,"Luling CCD, Caldwell County, Texas",055,92330,48
24094.0,12187.0,11907.0,21061.0,10763.0,10298.0,976.0,432.0,544.0,1769.0,853.0,916.0,228.0,133.0,95.0,60.0,6.0,54.0,"Lockhart CCD, Caldwell County, Texas",055,92245,48
642.0,368.0,274.0,517.0,290.0,227.0,68.0,35.0,33.0,49.0,35.0,14.0,8.0,8.0,0.0,0.0,0.0,0.0,"Lockett CCD, Wilbarger County, Texas",487,92240,48
11088.0,5406.0,5682.0,8340.0,3954.0,4386.0,1808.0,877.0,931.0,634.0,368.0,266.0,265.0,182.0,83.0,41.0,25.0,16.0,"Vernon CCD, Wilbarger County, Texas",487,94030,48
659.0,346.0,313.0,646.0,339.0,307.0,2.0,2.0,0.0,11.0,5.0,6.0,0.0,0.0,0.0,0.0,0.0,0.0,"Fargo-Odell CCD, Wilbarger County, Texas",487,91290,48
475.0,259.0,216.0,390.0,210.0,180.0,70.0,43.0,27.0,11.0,6.0,5.0,4.0,0.0,4.0,0.0,0.0,0.0,"Harrold-Oklaunion CCD, Wilbarger County, Texas",487,91730,48
3806.0,1936.0,1870.0,3512.0,1786.0,1726.0,104.0,53.0,51.0,156.0,84.0,72.0,34.0,13.0,21.0,0.0,0.0,0.0,"Stanton CCD, Martin County, Texas",317,93725,48
1726.0,905.0,821.0,1486.0,775.0,711.0,166.0,75.0,91.0,74.0,55.0,19.0,0.0,0.0,0.0,0.0,0.0,0.0,"Tarzan-Lenorah CCD, Martin County, Texas",317,93835,48
3363.0,1771.0,1592.0,2862.0,1466.0,1396.0,309.0,189.0,120.0,58.0,55.0,3.0,134.0,61.0,73.0,0.0,0.0,0.0,"Aiken-Neuville CCD, Shelby County, Texas",419,90020,48
548.0,280.0,268.0,473.0,248.0,225.0,66.0,32.0,34.0,7.0,0.0,7.0,2.0,0.0,2.0,0.0,0.0,0.0,"Manchester CCD, Red River County, Texas",387,92385,48
2364.0,1146.0,1218.0,2164.0,1030.0,1134.0,89.0,65.0,24.0,88.0,30.0,58.0,19.0,19.0,0.0,4.0,2.0,2.0,"Annona-Avery CCD, Red River County, Texas",387,90105,48
4751.0,2187.0,2564.0,3916.0,1871.0,2045.0,635.0,243.0,392.0,170.0,57.0,113.0,30.0,16.0,14.0,0.0,0.0,0.0,"Clarksville CCD, Red River County, Texas",387,90735,48
2272.0,1100.0,1172.0,1773.0,807.0,966.0,232.0,129.0,103.0,149.0,88.0,61.0,48.0,38.0,10.0,70.0,38.0,32.0,"Marfa CCD, Presidio County, Texas",377,92400,48
4778.0,2334.0,2444.0,4182.0,2089.0,2093.0,378.0,141.0,237.0,60.0,50.0,10.0,113.0,39.0,74.0,45.0,15.0,30.0,"Presidio CCD, Presidio County, Texas",377,93145,48
47503.0,24186.0,23317.0,40423.0,20162.0,20261.0,4051.0,2118.0,1933.0,1033.0,579.0,454.0,1176.0,772.0,404.0,820.0,555.0,265.0,"Del Rio CCD, Val Verde County, Texas",465,90995,48
112.0,68.0,44.0,95.0,51.0,44.0,0.0,0.0,0.0,17.0,17.0,0.0,0.0,0.0,0.0,0.0,0.0,0.0,"Del Rio Northeast CCD, Val Verde County, Texas",465,91000,48
465.0,223.0,242.0,457.0,220.0,237.0,6.0,3.0,3.0,2.0,0.0,2.0,0.0,0.0,0.0,0.0,0.0,0.0,"Del Rio Northwest CCD, Val Verde County, Texas",465,91005,48
101.0,84.0,17.0,82.0,65.0,17.0,0.0,0.0,0.0,19.0,19.0,0.0,0.0,0.0,0.0,0.0,0.0,0.0,"Van Horn Rural CCD, Culberson County, Texas",109,94015,48
2115.0,1056.0,1059.0,1872.0,953.0,919.0,139.0,45.0,94.0,89.0,52.0,37.0,14.0,5.0,9.0,1.0,1.0,0.0,"Van Horn CCD, Culberson County, Texas",109,94010,48
124268.0,62674.0,61594.0,99484.0,49363.0,50121.0,14784.0,7608.0,7176.0,6035.0,3231.0,2804.0,2598.0,1543.0,1055.0,1367.0,929.0,438.0,"Odessa CCD, Ector County, Texas",135,92875,48
590.0,302.0,288.0,533.0,282.0,251.0,21.0,10.0,11.0,28.0,10.0,18.0,8.0,0.0,8.0,0.0,0.0,0.0,"Garden City North CCD, Glasscock County, Texas",173,91455,48
797.0,457.0,340.0,678.0,360.0,318.0,5.0,5.0,0.0,60.0,38.0,22.0,0.0,0.0,0.0,54.0,54.0,0.0,"Garden City South CCD, Glasscock County, Texas",173,91460,48
8320.0,4190.0,4130.0,7438.0,3815.0,3623.0,404.0,143.0,261.0,462.0,217.0,245.0,16.0,15.0,1.0,0.0,0.0,0.0,"Anderson-Bedias CCD, Grimes County, Texas",185,90080,48
18919.0,10840.0,8079.0,16103.0,8963.0,7140.0,1109.0,612.0,497.0,1540.0,1171.0,369.0,145.0,72.0,73.0,22.0,22.0,0.0,"Navasota CCD, Grimes County, Texas",185,92710,48
862389.0,438535.0,423854.0,681049.0,346504.0,334545.0,108288.0,55192.0,53096.0,37007.0,18622.0,18385.0,26277.0,13436.0,12841.0,9768.0,4781.0,4987.0,"Austin CCD, Travis County, Texas",453,90165,48
9847.0,5004.0,4843.0,8832.0,4553.0,4279.0,413.0,174.0,239.0,379.0,174.0,205.0,200.0,80.0,120.0,23.0,23.0,0.0,"Nevada CCD, Collin County, Texas",085,92720,48
24061.0,10840.0,13221.0,20381.0,9440.0,10941.0,2610.0,895.0,1715.0,648.0,313.0,335.0,318.0,159.0,159.0,104.0,33.0,71.0,"Anna CCD, Collin County, Texas",085,90100,48
549277.0,269986.0,279291.0,473232.0,232630.0,240602.0,30581.0,14960.0,15621.0,25641.0,12742.0,12899.0,12631.0,6072.0,6559.0,7192.0,3582.0,3610.0,"Plano CCD, Collin County, Texas",085,93065,48
9052.0,4778.0,4274.0,7881.0,4131.0,3750.0,673.0,345.0,328.0,313.0,187.0,126.0,141.0,93.0,48.0,44.0,22.0,22.0,"Farmersville CCD, Collin County, Texas",085,91295,48
251993.0,122915.0,129078.0,210881.0,102630.0,108251.0,19821.0,9810.0,10011.0,9844.0,4908.0,4936.0,9463.0,4469.0,4994.0,1984.0,1098.0,886.0,"McKinney CCD, Collin County, Texas",085,92360,48
33735.0,17197.0,16538.0,28040.0,14217.0,13823.0,2273.0,1090.0,1183.0,1843.0,1052.0,791.0,1544.0,838.0,706.0,35.0,0.0,35.0,"Celina CCD, Collin County, Texas",085,90665,48
6486.0,3188.0,3298.0,5881.0,2911.0,2970.0,241.0,115.0,126.0,343.0,149.0,194.0,21.0,13.0,8.0,0.0,0.0,0.0,"Blue Ridge CCD, Collin County, Texas",085,90350,48
18557.0,9222.0,9335.0,16183.0,8032.0,8151.0,1095.0,566.0,529.0,767.0,368.0,399.0,474.0,236.0,238.0,38.0,20.0,18.0,"Princeton CCD, Collin County, Texas",085,93150,48
9245.0,4839.0,4406.0,7686.0,3955.0,3731.0,901.0,406.0,495.0,594.0,429.0,165.0,64.0,49.0,15.0,0.0,0.0,0.0,"Diboll CCD, Angelina County, Texas",005,91045,48
11340.0,5509.0,5831.0,9995.0,4840.0,5155.0,1009.0,542.0,467.0,102.0,102.0,0.0,212.0,25.0,187.0,22.0,0.0,22.0,"Huntington CCD, Angelina County, Texas",005,91855,48
52587.0,25144.0,27443.0,42332.0,20227.0,22105.0,6205.0,3008.0,3197.0,2935.0,1449.0,1486.0,971.0,408.0,563.0,144.0,52.0,92.0,"Lufkin CCD, Angelina County, Texas",005,92325,48
10982.0,5442.0,5540.0,9083.0,4352.0,4731.0,1150.0,545.0,605.0,522.0,411.0,111.0,227.0,134.0,93.0,0.0,0.0,0.0,"Pollok CCD, Angelina County, Texas",005,93090,48
1737.0,833.0,904.0,1605.0,772.0,833.0,55.0,15.0,40.0,69.0,38.0,31.0,0.0,0.0,0.0,8.0,8.0,0.0,"Detroit CCD, Red River County, Texas",387,91025,48
2877.0,1325.0,1552.0,2512.0,1104.0,1408.0,223.0,127.0,96.0,123.0,80.0,43.0,19.0,14.0,5.0,0.0,0.0,0.0,"Bogata CCD, Red River County, Texas",387,90365,48
598.0,273.0,325.0,549.0,247.0,302.0,4.0,0.0,4.0,45.0,26.0,19.0,0.0,0.0,0.0,0.0,0.0,0.0,"Rowena CCD, Runnels County, Texas",399,93350,48
1275.0,642.0,633.0,1273.0,642.0,631.0,0.0,0.0,0.0,2.0,0.0,2.0,0.0,0.0,0.0,0.0,0.0,0.0,"Miles CCD, Runnels County, Texas",399,92585,48
3801.0,1870.0,1931.0,3681.0,1818.0,1863.0,65.0,32.0,33.0,37.0,16.0,21.0,14.0,4.0,10.0,4.0,0.0,4.0,"Winters CCD, Runnels County, Texas",399,94265,48
4570.0,2251.0,2319.0,4207.0,2032.0,2175.0,169.0,90.0,79.0,136.0,95.0,41.0,37.0,13.0,24.0,21.0,21.0,0.0,"Ballinger CCD, Runnels County, Texas",399,90185,48
17291.0,8277.0,9014.0,14920.0,7078.0,7842.0,903.0,556.0,347.0,1227.0,621.0,606.0,241.0,22.0,219.0,0.0,0.0,0.0,"Shepherd-Evergreen CCD, San Jacinto County, Texas",407,93555,48
5405.0,2737.0,2668.0,4919.0,2508.0,2411.0,96.0,60.0,36.0,381.0,160.0,221.0,3.0,3.0,0.0,6.0,6.0,0.0,"Coldspring CCD, San Jacinto County, Texas",407,90775,48
4470.0,2397.0,2073.0,3938.0,2126.0,1812.0,86.0,74.0,12.0,286.0,108.0,178.0,108.0,89.0,19.0,52.0,0.0,52.0,"Point Blank CCD, San Jacinto County, Texas",407,93080,48
54.0,30.0,24.0,54.0,30.0,24.0,0.0,0.0,0.0,0.0,0.0,0.0,0.0,0.0,0.0,0.0,0.0,0.0,"Sonora Rural CCD, Sutton County, Texas",435,93620,48
3810.0,2076.0,1734.0,3244.0,1776.0,1468.0,135.0,56.0,79.0,312.0,185.0,127.0,93.0,47.0,46.0,26.0,12.0,14.0,"Sonora CCD, Sutton County, Texas",435,93615,48
4943.0,2517.0,2426.0,4373.0,2213.0,2160.0,308.0,154.0,154.0,206.0,118.0,88.0,24.0,19.0,5.0,32.0,13.0,19.0,"East Tom Green CCD, Tom Green County, Texas",451,91145,48
26971.0,13222.0,13749.0,22706.0,11178.0,11528.0,2380.0,1142.0,1238.0,1152.0,524.0,628.0,634.0,352.0,282.0,99.0,26.0,73.0,"West Tom Green CCD, Tom Green County, Texas",451,94180,48
3682.0,1958.0,1724.0,3124.0,1718.0,1406.0,280.0,122.0,158.0,85.0,31.0,54.0,86.0,44.0,42.0,107.0,43.0,64.0,"Big Lake CCD, Reagan County, Texas",383,90290,48
1895.0,991.0,904.0,1555.0,753.0,802.0,132.0,94.0,38.0,174.0,114.0,60.0,0.0,0.0,0.0,34.0,30.0,4.0,"Plains CCD, Yoakum County, Texas",501,93055,48
6400.0,3212.0,3188.0,6048.0,2973.0,3075.0,310.0,206.0,104.0,15.0,15.0,0.0,19.0,10.0,9.0,8.0,8.0,0.0,"Denver City CCD, Yoakum County, Texas",501,91015,48
2979.0,1441.0,1538.0,2624.0,1245.0,1379.0,220.0,132.0,88.0,135.0,64.0,71.0,0.0,0.0,0.0,0.0,0.0,0.0,"Hale Center CCD, Hale County, Texas",189,91675,48
26732.0,14002.0,12730.0,21391.0,10624.0,10767.0,2324.0,1214.0,1110.0,2642.0,1922.0,720.0,284.0,172.0,112.0,91.0,70.0,21.0,"Plainview CCD, Hale County, Texas",189,93060,48
1409.0,661.0,748.0,1303.0,617.0,686.0,58.0,19.0,39.0,48.0,25.0,23.0,0.0,0.0,0.0,0.0,0.0,0.0,"Petersburg CCD, Hale County, Texas",189,93020,48
2883.0,1542.0,1341.0,2413.0,1329.0,1084.0,191.0,87.0,104.0,258.0,120.0,138.0,21.0,6.0,15.0,0.0,0.0,0.0,"Abernathy CCD, Hale County, Texas",189,90005,48
3715.0,1877.0,1838.0,3224.0,1558.0,1666.0,269.0,161.0,108.0,211.0,158.0,53.0,11.0,0.0,11.0,0.0,0.0,0.0,"Timpson CCD, Shelby County, Texas",419,93925,48
3079.0,1428.0,1651.0,2589.0,1272.0,1317.0,41.0,20.0,21.0,340.0,106.0,234.0,102.0,23.0,79.0,7.0,7.0,0.0,"Shelbyville CCD, Shelby County, Texas",419,93550,48
5061.0,2585.0,2476.0,4460.0,2322.0,2138.0,366.0,163.0,203.0,139.0,26.0,113.0,96.0,74.0,22.0,0.0,0.0,0.0,"Tenaha-Joaquin CCD, Shelby County, Texas",419,93860,48
10093.0,4906.0,5187.0,8161.0,3958.0,4203.0,1545.0,716.0,829.0,268.0,190.0,78.0,119.0,42.0,77.0,0.0,0.0,0.0,"Center CCD, Shelby County, Texas",419,90670,48
12050.0,5966.0,6084.0,10302.0,5193.0,5109.0,845.0,352.0,493.0,600.0,326.0,274.0,303.0,95.0,208.0,0.0,0.0,0.0,"Gilmer CCD, Upshur County, Texas",459,91515,48
83659.0,41533.0,42126.0,65888.0,32498.0,33390.0,9112.0,4427.0,4685.0,3786.0,2003.0,1783.0,4556.0,2491.0,2065.0,317.0,114.0,203.0,"San Angelo CCD, Tom Green County, Texas",451,93405,48
9924.0,4826.0,5098.0,8681.0,4145.0,4536.0,377.0,209.0,168.0,675.0,383.0,292.0,191.0,89.0,102.0,0.0,0.0,0.0,"Gladewater CCD, Upshur County, Texas",459,91525,48
4116.0,2065.0,2051.0,3645.0,1899.0,1746.0,286.0,87.0,199.0,79.0,53.0,26.0,106.0,26.0,80.0,0.0,0.0,0.0,"Bettie CCD, Upshur County, Texas",459,90280,48
8247.0,4273.0,3974.0,7127.0,3679.0,3448.0,465.0,182.0,283.0,584.0,371.0,213.0,41.0,41.0,0.0,30.0,0.0,30.0,"Ore City CCD, Upshur County, Texas",459,92920,48
5640.0,2691.0,2949.0,4952.0,2362.0,2590.0,289.0,147.0,142.0,366.0,160.0,206.0,33.0,22.0,11.0,0.0,0.0,0.0,"Big Sandy CCD, Upshur County, Texas",459,90295,48
5774.0,2914.0,2860.0,5037.0,2504.0,2533.0,556.0,303.0,253.0,148.0,79.0,69.0,33.0,28.0,5.0,0.0,0.0,0.0,"Victoria South CCD, Victoria County, Texas",469,94040,48
10437.0,5492.0,4945.0,9918.0,5216.0,4702.0,267.0,180.0,87.0,189.0,96.0,93.0,63.0,0.0,63.0,0.0,0.0,0.0,"Victoria West CCD, Victoria County, Texas",469,94045,48
74246.0,35726.0,38520.0,60352.0,29219.0,31133.0,9648.0,4454.0,5194.0,3052.0,1617.0,1435.0,935.0,354.0,581.0,259.0,82.0,177.0,"Victoria CCD, Victoria County, Texas",469,94035,48
14752.0,7370.0,7382.0,12610.0,6262.0,6348.0,1004.0,502.0,502.0,1017.0,517.0,500.0,111.0,89.0,22.0,10.0,0.0,10.0,"Brookshire CCD, Waller County, Texas",473,90465,48
9736.0,5478.0,4258.0,8288.0,4482.0,3806.0,1125.0,755.0,370.0,268.0,236.0,32.0,55.0,5.0,50.0,0.0,0.0,0.0,"Hempstead CCD, Waller County, Texas",473,91770,48
16691.0,8115.0,8576.0,14977.0,7297.0,7680.0,1310.0,604.0,706.0,326.0,160.0,166.0,67.0,49.0,18.0,11.0,5.0,6.0,"El Campo CCD, Wharton County, Texas",481,91180,48
