81947.0,"Ontario CCD, San Bernardino County, California",071,92260,06
63578.0,"Mount Baldy-Wrightwood CCD, San Bernardino County, California",071,92040,06
31533.0,"Needles CCD, San Bernardino County, California",071,92080,06
134519.0,"Llagas-Uvas CCD, Santa Clara County, California",085,91680,06
117554.0,"San Jose CCD, Santa Clara County, California",085,92830,06
197083.0,"West Santa Clara CCD, Santa Clara County, California",085,93660,06
91875.0,"Diablo Range CCD, Santa Clara County, California",085,90680,06
123635.0,"Ross Valley CCD, Marin County, California",041,92670,06
142180.0,"Southeast Marin CCD, Marin County, California",041,93140,06
86053.0,"Northwest Marin CCD, Marin County, California",041,92200,06
107169.0,"San Rafael CCD, Marin County, California",041,92880,06
68700.0,"Auburn CCD, Placer County, California",061,90160,06
81557.0,"Roseville CCD, Placer County, California",061,92660,06
79474.0,"Foresthill-Back Country CCD, Placer County, California",061,91020,06
57042.0,"Lake Tahoe CCD, Placer County, California",061,91550,06
46518.0,"Etna CCD, Siskiyou County, California",093,90920,06
