17212.0,8921.0,8291.0,12873.0,6773.0,6100.0,2015.0,834.0,1181.0,1648.0,898.0,750.0,546.0,326.0,220.0,130.0,90.0,40.0,"Sterling CCD, Logan County, Colorado",075,93515,08
3774.0,1889.0,1885.0,3246.0,1627.0,1619.0,273.0,126.0,147.0,83.0,42.0,41.0,172.0,94.0,78.0,0.0,0.0,0.0,"Mancos CCD, Montezuma County, Colorado",083,92394,08
1528.0,582.0,946.0,1430.0,556.0,874.0,46.0,5.0,41.0,38.0,21.0,17.0,14.0,0.0,14.0,0.0,0.0,0.0,"Ute Mountain CCD, Montezuma County, Colorado",083,93705,08
16714.0,8177.0,8537.0,13523.0,6642.0,6881.0,1974.0,933.0,1041.0,212.0,119.0,93.0,994.0,472.0,522.0,11.0,11.0,0.0,"Cortez CCD, Montezuma County, Colorado",083,90817,08
3074.0,1612.0,1462.0,2813.0,1447.0,1366.0,86.0,45.0,41.0,77.0,65.0,12.0,98.0,55.0,43.0,0.0,0.0,0.0,"Dolores CCD, Montezuma County, Colorado",083,91045,08
480.0,278.0,202.0,431.0,250.0,181.0,0.0,0.0,0.0,0.0,0.0,0.0,49.0,28.0,21.0,0.0,0.0,0.0,"Pleasant View CCD, Montezuma County, Colorado",083,92945,08
1708.0,846.0,862.0,1483.0,746.0,737.0,20.0,3.0,17.0,91.0,51.0,40.0,114.0,46.0,68.0,0.0,0.0,0.0,"Norwood CCD, San Miguel County, Colorado",113,92679,08
5844.0,3172.0,2672.0,4664.0,2577.0,2087.0,479.0,231.0,248.0,151.0,79.0,72.0,505.0,267.0,238.0,45.0,18.0,27.0,"Telluride CCD, San Miguel County, Colorado",113,93591,08
3050.0,1640.0,1410.0,2603.0,1417.0,1186.0,206.0,106.0,100.0,167.0,99.0,68.0,74.0,18.0,56.0,0.0,0.0,0.0,"Cripple Creek CCD, Teller County, Colorado",119,90912,08
20536.0,10197.0,10339.0,16958.0,8587.0,8371.0,1046.0,528.0,518.0,1666.0,657.0,1009.0,861.0,420.0,441.0,5.0,5.0,0.0,"Divide CCD, Teller County, Colorado",119,91026,08
867.0,463.0,404.0,734.0,376.0,358.0,67.0,43.0,24.0,23.0,12.0,11.0,43.0,32.0,11.0,0.0,0.0,0.0,"Upper St. Vrain CCD, Boulder County, Colorado",013,93686,08
123180.0,63661.0,59519.0,83210.0,41675.0,41535.0,19635.0,11069.0,8566.0,7738.0,4049.0,3689.0,10391.0,5589.0,4802.0,2206.0,1279.0,927.0,"Boulder CCD, Boulder County, Colorado",013,90342,08
105428.0,51270.0,54158.0,87885.0,42426.0,45459.0,8797.0,4377.0,4420.0,4058.0,2057.0,2001.0,4232.0,2263.0,1969.0,456.0,147.0,309.0,"Longmont CCD, Boulder County, Colorado",013,92318,08
72347.0,35485.0,36862.0,60609.0,29685.0,30924.0,4921.0,2433.0,2488.0,2826.0,1423.0,1403.0,3501.0,1739.0,1762.0,490.0,205.0,285.0,"Lafayette-Louisville CCD, Boulder County, Colorado",013,92052,08
11993.0,6594.0,5399.0,9842.0,5364.0,4478.0,1063.0,618.0,445.0,312.0,200.0,112.0,666.0,356.0,310.0,110.0,56.0,54.0,"Bald Mountain CCD, Boulder County, Colorado",013,90228,08
11694.0,5936.0,5758.0,10245.0,5135.0,5110.0,474.0,223.0,251.0,346.0,191.0,155.0,583.0,361.0,222.0,46.0,26.0,20.0,"Pagosa Springs CCD, Archuleta County, Colorado",007,92812,08
788.0,437.0,351.0,712.0,390.0,322.0,3.0,3.0,0.0,51.0,27.0,24.0,12.0,7.0,5.0,10.0,10.0,0.0,"Arboles CCD, Archuleta County, Colorado",007,90114,08
2968.0,1543.0,1425.0,2600.0,1324.0,1276.0,106.0,53.0,53.0,172.0,102.0,70.0,86.0,60.0,26.0,4.0,4.0,0.0,"Holyoke CCD, Phillips County, Colorado",095,91767,08
1309.0,686.0,623.0,1163.0,602.0,561.0,39.0,23.0,16.0,93.0,51.0,42.0,14.0,10.0,4.0,0.0,0.0,0.0,"Haxtun CCD, Phillips County, Colorado",095,91710,08
669390.0,334352.0,335038.0,528575.0,262900.0,265675.0,62854.0,31576.0,31278.0,43684.0,23226.0,20458.0,29887.0,14818.0,15069.0,4390.0,1832.0,2558.0,"Denver CCD, Denver County, Colorado",031,91007,08
94.0,45.0,49.0,94.0,45.0,49.0,0.0,0.0,0.0,0.0,0.0,0.0,0.0,0.0,0.0,0.0,0.0,0.0,"Haswell CCD, Kiowa County, Colorado",061,91691,08
324.0,168.0,156.0,291.0,152.0,139.0,5.0,3.0,2.0,16.0,2.0,14.0,12.0,11.0,1.0,0.0,0.0,0.0,"Sheridan Lake CCD, Kiowa County, Colorado",061,93268,08
926.0,467.0,459.0,891.0,452.0,439.0,14.0,4.0,10.0,13.0,6.0,7.0,8.0,5.0,3.0,0.0,0.0,0.0,"Eads CCD, Kiowa County, Colorado",061,91121,08
1416.0,646.0,770.0,1198.0,536.0,662.0,46.0,18.0,28.0,80.0,44.0,36.0,88.0,48.0,40.0,4.0,0.0,4.0,"La Veta CCD, Huerfano County, Colorado",055,92204,08
422.0,210.0,212.0,414.0,210.0,204.0,0.0,0.0,0.0,0.0,0.0,0.0,8.0,0.0,8.0,0.0,0.0,0.0,"Gardner CCD, Huerfano County, Colorado",055,91444,08
4651.0,2365.0,2286.0,4063.0,2071.0,1992.0,272.0,138.0,134.0,151.0,70.0,81.0,165.0,86.0,79.0,0.0,0.0,0.0,"Walsenburg CCD, Huerfano County, Colorado",055,93743,08
243.0,135.0,108.0,179.0,108.0,71.0,54.0,20.0,34.0,7.0,6.0,1.0,3.0,1.0,2.0,0.0,0.0,0.0,"Campo CCD, Baca County, Colorado",009,90475,08
1973.0,947.0,1026.0,1656.0,806.0,850.0,216.0,81.0,135.0,66.0,49.0,17.0,35.0,11.0,24.0,0.0,0.0,0.0,"Springfield CCD, Baca County, Colorado",009,93477,08
1077.0,533.0,544.0,930.0,472.0,458.0,63.0,31.0,32.0,23.0,7.0,16.0,47.0,19.0,28.0,14.0,4.0,10.0,"Walsh CCD, Baca County, Colorado",009,93762,08
247.0,110.0,137.0,229.0,105.0,124.0,0.0,0.0,0.0,15.0,3.0,12.0,3.0,2.0,1.0,0.0,0.0,0.0,"Pritchett CCD, Baca County, Colorado",009,92964,08
10039.0,5141.0,4898.0,8724.0,4407.0,4317.0,537.0,298.0,239.0,468.0,244.0,224.0,146.0,92.0,54.0,164.0,100.0,64.0,"Salida CCD, Chaffee County, Colorado",015,93173,08
8632.0,4838.0,3794.0,7503.0,4157.0,3346.0,640.0,356.0,284.0,160.0,106.0,54.0,329.0,219.0,110.0,0.0,0.0,0.0,"Buena Vista CCD, Chaffee County, Colorado",015,90437,08
5717.0,3069.0,2648.0,4685.0,2465.0,2220.0,283.0,204.0,79.0,480.0,279.0,201.0,269.0,121.0,148.0,0.0,0.0,0.0,"Central City CCD, Gilpin County, Colorado",047,90570,08
989.0,505.0,484.0,864.0,457.0,407.0,47.0,21.0,26.0,55.0,20.0,35.0,23.0,7.0,16.0,0.0,0.0,0.0,"Flagler CCD, Kit Carson County, Colorado",063,91273,08
1356.0,702.0,654.0,1137.0,611.0,526.0,82.0,30.0,52.0,54.0,29.0,25.0,83.0,32.0,51.0,0.0,0.0,0.0,"Stratton CCD, Kit Carson County, Colorado",063,93534,08
5340.0,3087.0,2253.0,4646.0,2632.0,2014.0,481.0,335.0,146.0,142.0,83.0,59.0,61.0,27.0,34.0,10.0,10.0,0.0,"Burlington CCD, Kit Carson County, Colorado",063,90456,08
25352.0,12739.0,12613.0,21607.0,10774.0,10833.0,1346.0,735.0,611.0,1142.0,513.0,629.0,1162.0,659.0,503.0,95.0,58.0,37.0,"Glenwood Springs CCD, Garfield County, Colorado",045,91520,08
13250.0,6977.0,6273.0,10993.0,5886.0,5107.0,1156.0,613.0,543.0,406.0,160.0,246.0,640.0,272.0,368.0,55.0,46.0,9.0,"Rifle CCD, Garfield County, Colorado",045,93097,08
11913.0,5873.0,6040.0,10466.0,5219.0,5247.0,993.0,427.0,566.0,196.0,104.0,92.0,127.0,82.0,45.0,131.0,41.0,90.0,"New Castle CCD, Garfield County, Colorado",045,92603,08
292.0,184.0,108.0,249.0,150.0,99.0,15.0,15.0,0.0,2.0,2.0,0.0,26.0,17.0,9.0,0.0,0.0,0.0,"Sapinero CCD, Gunnison County, Colorado",051,93211,08
575.0,321.0,254.0,466.0,252.0,214.0,73.0,47.0,26.0,22.0,17.0,5.0,7.0,5.0,2.0,7.0,0.0,7.0,"Somerset CCD, Gunnison County, Colorado",051,93363,08
10398.0,5601.0,4797.0,8168.0,4408.0,3760.0,907.0,441.0,466.0,890.0,516.0,374.0,398.0,214.0,184.0,35.0,22.0,13.0,"Gunnison CCD, Gunnison County, Colorado",051,91672,08
4740.0,2633.0,2107.0,3655.0,2116.0,1539.0,644.0,345.0,299.0,181.0,109.0,72.0,260.0,63.0,197.0,0.0,0.0,0.0,"Crested Butte CCD, Gunnison County, Colorado",051,90893,08
37030.0,20180.0,16850.0,29874.0,15597.0,14277.0,2765.0,1704.0,1061.0,2132.0,1400.0,732.0,1760.0,1127.0,633.0,499.0,352.0,147.0,"Golden CCD, Jefferson County, Colorado",059,91539,08
470946.0,232454.0,238492.0,397549.0,195228.0,202321.0,32731.0,16477.0,16254.0,24845.0,12420.0,12425.0,14258.0,7631.0,6627.0,1563.0,698.0,865.0,"Northeast Jefferson CCD, Jefferson County, Colorado",059,92641,08
25383.0,12712.0,12671.0,23338.0,11747.0,11591.0,1079.0,548.0,531.0,428.0,170.0,258.0,472.0,226.0,246.0,66.0,21.0,45.0,"South Jefferson CCD, Jefferson County, Colorado",059,93439,08
24929.0,12427.0,12502.0,21393.0,10677.0,10716.0,1239.0,603.0,636.0,1295.0,623.0,672.0,854.0,475.0,379.0,148.0,49.0,99.0,"Central Jefferson CCD, Jefferson County, Colorado",059,90589,08
821.0,423.0,398.0,731.0,382.0,349.0,8.0,3.0,5.0,39.0,23.0,16.0,38.0,10.0,28.0,5.0,5.0,0.0,"Creede CCD, Mineral County, Colorado",079,90874,08
