C16001_001E,C16001_002E,C16001_004E,C16001_005E,C16001_007E,C16001_008E,C16001_010E,C16001_011E,C16001_013E,C16001_014E,C16001_016E,C16001_017E,C16001_019E,C16001_020E,C16001_022E,C16001_023E,C16001_025E,C16001_026E,C16001_028E,C16001_029E,C16001_031E,C16001_032E,C16001_034E,C16001_035E,C16001_037E,C16001_038E,name,county,county subdivision,state
5819.0,5002.0,195.0,234.0,17.0,0.0,6.0,0.0,0.0,0.0,0.0,0.0,0.0,0.0,0.0,0.0,0.0,17.0,0.0,0.0,10.0,2.0,0.0,0.0,18.0,318.0,"Bow CCD, Skagit County, Washington",057,90272,53
2837.0,2755.0,11.0,5.0,6.0,0.0,13.0,0.0,0.0,2.0,16.0,0.0,0.0,0.0,0.0,0.0,0.0,5.0,0.0,0.0,0.0,0.0,0.0,0.0,21.0,3.0,"Swinomish Reservation CCD, Skagit County, Washington",057,93360,53
33990.0,23040.0,4898.0,4400.0,68.0,0.0,49.0,9.0,74.0,400.0,103.0,50.0,0.0,48.0,58.0,56.0,11.0,0.0,245.0,171.0,192.0,16.0,11.0,0.0,19.0,72.0,"Mount Vernon CCD, Skagit County, Washington",057,92096,53
12877.0,9166.0,1846.0,1149.0,87.0,0.0,59.0,0.0,87.0,66.0,43.0,23.0,0.0,94.0,0.0,0.0,0.0,0.0,16.0,20.0,42.0,0.0,0.0,2.0,91.0,86.0,"Burlington CCD, Skagit County, Washington",057,90384,53
3254.0,3029.0,135.0,23.0,4.0,5.0,18.0,0.0,2.0,0.0,18.0,4.0,3.0,0.0,0.0,5.0,0.0,0.0,0.0,0.0,0.0,0.0,0.0,0.0,4.0,4.0,"Conway CCD, Skagit County, Washington",057,90768,53
3197.0,2949.0,37.0,139.0,8.0,0.0,50.0,0.0,0.0,0.0,0.0,0.0,0.0,0.0,0.0,0.0,0.0,0.0,0.0,0.0,5.0,7.0,1.0,0.0,0.0,1.0,"La Conner CCD, Skagit County, Washington",057,91536,53
2551.0,2429.0,69.0,8.0,0.0,0.0,24.0,0.0,0.0,0.0,0.0,0.0,0.0,0.0,0.0,0.0,0.0,0.0,0.0,0.0,0.0,11.0,2.0,0.0,8.0,0.0,"Lyman-Hamilton CCD, Skagit County, Washington",057,91776,53
13137.0,12098.0,601.0,250.0,24.0,0.0,54.0,8.0,0.0,0.0,0.0,0.0,0.0,0.0,0.0,0.0,0.0,0.0,7.0,0.0,75.0,0.0,0.0,0.0,19.0,1.0,"Sedro-Woolley CCD, Skagit County, Washington",057,92944,53
1712.0,1575.0,25.0,3.0,0.0,0.0,15.0,0.0,67.0,27.0,0.0,0.0,0.0,0.0,0.0,0.0,0.0,0.0,0.0,0.0,0.0,0.0,0.0,0.0,0.0,0.0,"Clear Lake CCD, Skagit County, Washington",057,90608,53
19868.0,18930.0,254.0,128.0,53.0,22.0,82.0,14.0,44.0,14.0,40.0,6.0,26.0,44.0,41.0,16.0,0.0,5.0,24.0,24.0,66.0,14.0,0.0,0.0,17.0,4.0,"Anacortes CCD, Skagit County, Washington",057,90064,53
5149.0,4881.0,137.0,68.0,20.0,0.0,32.0,3.0,0.0,0.0,0.0,0.0,0.0,0.0,0.0,0.0,0.0,0.0,0.0,6.0,0.0,0.0,0.0,0.0,2.0,0.0,"Springdale CCD, Stevens County, Washington",065,93232,53
5454.0,5341.0,52.0,0.0,0.0,0.0,26.0,0.0,0.0,0.0,0.0,0.0,0.0,0.0,0.0,0.0,0.0,0.0,0.0,9.0,26.0,0.0,0.0,0.0,0.0,0.0,"Chewelah CCD, Stevens County, Washington",065,90560,53
10652.0,10175.0,224.0,14.0,0.0,0.0,32.0,0.0,0.0,106.0,51.0,0.0,0.0,0.0,0.0,1.0,0.0,21.0,0.0,28.0,0.0,0.0,0.0,0.0,0.0,0.0,"Colville CCD, Stevens County, Washington",065,90688,53
1929.0,1832.0,0.0,0.0,0.0,0.0,0.0,0.0,0.0,0.0,0.0,0.0,0.0,0.0,0.0,0.0,0.0,0.0,0.0,0.0,0.0,0.0,0.0,0.0,89.0,8.0,"Spokane Reservation CCD, Stevens County, Washington",065,93216,53
10208.0,9862.0,106.0,25.0,16.0,0.0,38.0,0.0,51.0,0.0,12.0,0.0,0.0,0.0,0.0,0.0,0.0,0.0,39.0,3.0,56.0,0.0,0.0,0.0,0.0,0.0,"Loon Lake CCD, Stevens County, Washington",065,91680,53
6483.0,6318.0,79.0,7.0,10.0,0.0,22.0,3.0,3.0,2.0,21.0,0.0,0.0,0.0,0.0,0.0,0.0,0.0,11.0,0.0,4.0,0.0,0.0,0.0,3.0,0.0,"Kettle Falls CCD, Stevens County, Washington",065,91472,53
342877.0,316578.0,5637.0,2183.0,557.0,117.0,1079.0,212.0,3093.0,3388.0,1051.0,957.0,268.0,417.0,494.0,489.0,384.0,926.0,385.0,334.0,1686.0,1129.0,421.0,264.0,452.0,376.0,"Spokane CCD, Spokane County, Washington",063,93200,53
29290.0,28029.0,322.0,96.0,76.0,0.0,86.0,10.0,224.0,160.0,81.0,15.0,0.0,0.0,25.0,12.0,0.0,0.0,32.0,0.0,70.0,28.0,0.0,0.0,12.0,12.0,"Deer Park CCD, Spokane County, Washington",063,90880,53
2631.0,2593.0,2.0,1.0,0.0,0.0,11.0,0.0,0.0,0.0,0.0,0.0,0.0,0.0,0.0,0.0,0.0,0.0,4.0,17.0,0.0,2.0,0.0,0.0,1.0,0.0,"Rockford CCD, Spokane County, Washington",063,92816,53
2916.0,2906.0,10.0,0.0,0.0,0.0,0.0,0.0,0.0,0.0,0.0,0.0,0.0,0.0,0.0,0.0,0.0,0.0,0.0,0.0,0.0,0.0,0.0,0.0,0.0,0.0,"Valleyford CCD, Spokane County, Washington",063,93584,53
13268.0,12150.0,261.0,162.0,27.0,16.0,51.0,0.0,51.0,203.0,17.0,22.0,39.0,34.0,7.0,19.0,0.0,3.0,49.0,20.0,24.0,43.0,0.0,0.0,63.0,7.0,"Airway Heights CCD, Spokane County, Washington",063,90048,53
10329.0,9778.0,52.0,12.0,9.0,7.0,6.0,20.0,359.0,69.0,8.0,0.0,0.0,0.0,0.0,0.0,0.0,0.0,0.0,0.0,0.0,9.0,0.0,0.0,0.0,0.0,"Colbert CCD, Spokane County, Washington",063,90640,53
16895.0,15938.0,273.0,100.0,13.0,0.0,169.0,22.0,43.0,45.0,76.0,14.0,25.0,0.0,22.0,19.0,32.0,32.0,0.0,16.0,44.0,0.0,12.0,0.0,0.0,0.0,"Liberty Lake CCD, Spokane County, Washington",063,91616,53
5880.0,4987.0,167.0,0.0,0.0,0.0,29.0,13.0,533.0,76.0,0.0,0.0,0.0,0.0,0.0,0.0,45.0,15.0,0.0,15.0,0.0,0.0,0.0,0.0,0.0,0.0,"Mount Spokane CCD, Spokane County, Washington",063,92080,53
2898.0,2823.0,20.0,33.0,3.0,0.0,4.0,0.0,0.0,0.0,1.0,0.0,0.0,0.0,7.0,0.0,0.0,0.0,0.0,1.0,0.0,0.0,0.0,2.0,4.0,0.0,"Odessa CCD, Lincoln County, Washington",043,92304,53
2681.0,2628.0,2.0,0.0,0.0,0.0,4.0,0.0,1.0,7.0,8.0,6.0,0.0,0.0,0.0,0.0,0.0,0.0,0.0,4.0,12.0,1.0,0.0,0.0,8.0,0.0,"Wilbur CCD, Lincoln County, Washington",043,93760,53
4274.0,4168.0,9.0,0.0,0.0,0.0,17.0,0.0,64.0,0.0,0.0,0.0,0.0,0.0,5.0,0.0,0.0,0.0,11.0,0.0,0.0,0.0,0.0,0.0,0.0,0.0,"Davenport CCD, Lincoln County, Washington",043,90848,53
37831.0,28100.0,5172.0,4029.0,29.0,0.0,79.0,0.0,74.0,16.0,70.0,47.0,8.0,18.0,8.0,39.0,0.0,0.0,0.0,0.0,8.0,37.0,0.0,0.0,95.0,2.0,"Wenatchee CCD, Chelan County, Washington",007,93712,53
10744.0,7946.0,1615.0,859.0,0.0,0.0,42.0,0.0,8.0,0.0,58.0,15.0,0.0,0.0,95.0,0.0,0.0,0.0,0.0,0.0,34.0,10.0,0.0,0.0,59.0,3.0,"Cashmere CCD, Chelan County, Washington",007,90448,53
6263.0,5840.0,192.0,104.0,4.0,0.0,40.0,0.0,6.0,15.0,37.0,20.0,0.0,0.0,0.0,0.0,0.0,0.0,0.0,0.0,0.0,0.0,0.0,0.0,5.0,0.0,"Leavenworth-Lake Wenatchee CCD, Chelan County, Washington",007,91600,53
35.0,35.0,0.0,0.0,0.0,0.0,0.0,0.0,0.0,0.0,0.0,0.0,0.0,0.0,0.0,0.0,0.0,0.0,0.0,0.0,0.0,0.0,0.0,0.0,0.0,0.0,"Stehekin CCD, Chelan County, Washington",007,93280,53
29462.0,28300.0,220.0,191.0,73.0,7.0,112.0,6.0,19.0,12.0,95.0,53.0,0.0,33.0,57.0,96.0,6.0,48.0,40.0,0.0,2.0,4.0,0.0,0.0,88.0,0.0,"Port Angeles CCD, Clallam County, Washington",009,92592,53
6152.0,5371.0,189.0,501.0,0.0,0.0,0.0,4.0,0.0,0.0,24.0,0.0,0.0,0.0,0.0,0.0,0.0,0.0,0.0,0.0,30.0,0.0,0.0,0.0,31.0,2.0,"Forks CCD, Clallam County, Washington",009,91168,53
10137.0,9917.0,85.0,61.0,0.0,0.0,39.0,10.0,0.0,0.0,0.0,0.0,0.0,0.0,11.0,0.0,0.0,0.0,0.0,14.0,0.0,0.0,0.0,0.0,0.0,0.0,"Agnew-Carlsborg CCD, Clallam County, Washington",009,90032,53
3454.0,3339.0,39.0,21.0,0.0,0.0,20.0,0.0,5.0,0.0,0.0,0.0,10.0,0.0,0.0,0.0,0.0,0.0,3.0,0.0,0.0,0.0,0.0,0.0,17.0,0.0,"Crescent CCD, Clallam County, Washington",009,90816,53
60094.0,55024.0,2188.0,1332.0,63.0,0.0,83.0,37.0,23.0,9.0,300.0,202.0,0.0,17.0,64.0,78.0,54.0,107.0,129.0,19.0,91.0,133.0,0.0,0.0,41.0,100.0,"Longview-Kelso CCD, Cowlitz County, Washington",015,91664,53
6144.0,5921.0,34.0,10.0,0.0,0.0,15.0,7.0,16.0,0.0,13.0,0.0,0.0,0.0,0.0,0.0,0.0,36.0,12.0,0.0,80.0,0.0,0.0,0.0,0.0,0.0,"Kalama CCD, Cowlitz County, Washington",015,91440,53
4942.0,4818.0,36.0,11.0,0.0,0.0,15.0,0.0,0.0,29.0,0.0,0.0,0.0,0.0,0.0,0.0,0.0,0.0,33.0,0.0,0.0,0.0,0.0,0.0,0.0,0.0,"Rose Valley CCD, Cowlitz County, Washington",015,92864,53
9974.0,8814.0,346.0,584.0,163.0,0.0,10.0,0.0,0.0,0.0,0.0,0.0,16.0,0.0,0.0,0.0,0.0,0.0,0.0,0.0,0.0,0.0,0.0,0.0,31.0,10.0,"Woodland CCD, Cowlitz County, Washington",015,93856,53
14535.0,14099.0,159.0,82.0,0.0,0.0,56.0,29.0,0.0,0.0,37.0,0.0,0.0,0.0,24.0,5.0,0.0,0.0,0.0,0.0,0.0,31.0,0.0,13.0,0.0,0.0,"Castle Rock CCD, Cowlitz County, Washington",015,90464,53
1293.0,1248.0,20.0,2.0,5.0,0.0,0.0,0.0,0.0,0.0,6.0,0.0,0.0,0.0,0.0,0.0,0.0,0.0,0.0,0.0,11.0,0.0,0.0,0.0,1.0,0.0,"Curlew CCD, Ferry County, Washington",019,90832,53
1597.0,1491.0,5.0,0.0,3.0,0.0,0.0,0.0,0.0,0.0,0.0,0.0,0.0,0.0,0.0,0.0,0.0,0.0,0.0,0.0,26.0,9.0,0.0,0.0,63.0,0.0,"Colville Reservation CCD, Ferry County, Washington",019,90704,53
2948.0,2860.0,42.0,28.0,0.0,0.0,1.0,3.0,0.0,0.0,0.0,0.0,0.0,6.0,0.0,0.0,0.0,0.0,0.0,0.0,8.0,0.0,0.0,0.0,0.0,0.0,"Republic CCD, Ferry County, Washington",019,92752,53
1923.0,1684.0,110.0,105.0,19.0,0.0,0.0,0.0,0.0,0.0,2.0,0.0,0.0,0.0,0.0,0.0,0.0,0.0,0.0,3.0,0.0,0.0,0.0,0.0,0.0,0.0,"Entiat CCD, Chelan County, Washington",007,91040,53
4418.0,3170.0,831.0,409.0,0.0,0.0,0.0,0.0,0.0,0.0,8.0,0.0,0.0,0.0,0.0,0.0,0.0,0.0,0.0,0.0,0.0,0.0,0.0,0.0,0.0,0.0,"Malaga CCD, Chelan County, Washington",007,91840,53
2911.0,2041.0,351.0,511.0,0.0,0.0,0.0,0.0,0.0,0.0,0.0,0.0,0.0,0.0,0.0,0.0,0.0,0.0,0.0,0.0,0.0,0.0,0.0,0.0,0.0,8.0,"Manson CCD, Chelan County, Washington",007,91904,53
6046.0,3867.0,1391.0,739.0,18.0,0.0,14.0,0.0,0.0,0.0,17.0,0.0,0.0,0.0,0.0,0.0,0.0,0.0,0.0,0.0,0.0,0.0,0.0,0.0,0.0,0.0,"Chelan CCD, Chelan County, Washington",007,90544,53
984.0,927.0,31.0,6.0,0.0,0.0,0.0,0.0,0.0,0.0,0.0,0.0,0.0,0.0,2.0,0.0,0.0,0.0,0.0,1.0,8.0,2.0,0.0,0.0,7.0,0.0,"West End CCD, Jefferson County, Washington",031,93728,53
104130.0,94684.0,1945.0,849.0,150.0,79.0,317.0,69.0,78.0,21.0,482.0,170.0,77.0,95.0,237.0,113.0,99.0,134.0,2566.0,865.0,583.0,279.0,4.0,7.0,144.0,83.0,"Bremerton CCD, Kitsap County, Washington",035,90288,53
12391.0,12108.0,30.0,0.0,63.0,0.0,14.0,0.0,52.0,0.0,13.0,0.0,0.0,0.0,51.0,32.0,0.0,0.0,3.0,0.0,2.0,15.0,0.0,0.0,8.0,0.0,"Kingston CCD, Kitsap County, Washington",035,91488,53
41841.0,39129.0,978.0,399.0,81.0,0.0,116.0,3.0,68.0,23.0,109.0,49.0,0.0,62.0,15.0,2.0,50.0,50.0,331.0,33.0,165.0,133.0,0.0,28.0,13.0,4.0,"Poulsbo CCD, Kitsap County, Washington",035,92624,53
22420.0,21361.0,256.0,41.0,103.0,26.0,228.0,0.0,43.0,0.0,71.0,0.0,0.0,0.0,92.0,14.0,0.0,50.0,0.0,14.0,55.0,14.0,20.0,3.0,10.0,19.0,"Bainbridge Island CCD, Kitsap County, Washington",035,90120,53
63198.0,59608.0,806.0,184.0,137.0,17.0,355.0,19.0,79.0,31.0,52.0,15.0,52.0,88.0,36.0,96.0,0.0,0.0,659.0,503.0,304.0,138.0,0.0,0.0,19.0,0.0,"Port Orchard CCD, Kitsap County, Washington",035,92608,53
63013.0,54130.0,2306.0,1740.0,33.0,27.0,260.0,18.0,704.0,510.0,303.0,291.0,138.0,222.0,345.0,411.0,255.0,163.0,247.0,76.0,404.0,200.0,47.0,72.0,86.0,25.0,"Enumclaw Plateau CCD, King County, Washington",033,91056,53
64416.0,55637.0,1584.0,669.0,79.0,18.0,146.0,0.0,797.0,516.0,472.0,277.0,172.0,143.0,338.0,303.0,335.0,270.0,607.0,610.0,757.0,247.0,224.0,17.0,131.0,67.0,"Tahoma-Maple Valley CCD, King County, Washington",033,93392,53
1008979.0,742788.0,39557.0,28605.0,5579.0,813.0,5659.0,508.0,7910.0,6000.0,18715.0,8038.0,4051.0,3571.0,14921.0,18397.0,9258.0,14443.0,10060.0,5790.0,17898.0,12575.0,2846.0,2415.0,15972.0,12610.0,"Seattle CCD, King County, Washington",033,92928,53
9375.0,8709.0,147.0,132.0,20.0,0.0,78.0,0.0,11.0,13.0,86.0,0.0,27.0,0.0,0.0,1.0,134.0,0.0,1.0,0.0,0.0,15.0,0.0,1.0,0.0,0.0,"Vashon Island CCD, King County, Washington",033,93616,53
75183.0,54958.0,1917.0,706.0,448.0,83.0,364.0,0.0,856.0,222.0,3928.0,696.0,536.0,420.0,2811.0,2578.0,107.0,134.0,223.0,87.0,2876.0,665.0,80.0,37.0,286.0,165.0,"Issaquah Plateau CCD, King County, Washington",033,91392,53
48700.0,44101.0,1014.0,798.0,241.0,22.0,363.0,19.0,307.0,137.0,576.0,51.0,38.0,13.0,113.0,24.0,28.0,0.0,99.0,0.0,509.0,197.0,14.0,1.0,31.0,4.0,"Snoqualmie Valley CCD, King County, Washington",033,93078,53
1945.0,1619.0,145.0,104.0,0.0,0.0,7.0,0.0,0.0,0.0,0.0,0.0,0.0,0.0,50.0,0.0,0.0,0.0,0.0,0.0,0.0,0.0,0.0,0.0,15.0,5.0,"Naselle CCD, Pacific County, Washington",049,92128,53
1569.0,1535.0,11.0,5.0,0.0,5.0,6.0,0.0,7.0,0.0,0.0,0.0,0.0,0.0,0.0,0.0,0.0,0.0,0.0,0.0,0.0,0.0,0.0,0.0,0.0,0.0,"Willapa Valley CCD, Pacific County, Washington",049,93776,53
7548.0,6215.0,539.0,516.0,26.0,0.0,16.0,0.0,0.0,0.0,0.0,0.0,8.0,0.0,0.0,0.0,0.0,0.0,0.0,26.0,102.0,65.0,0.0,0.0,35.0,0.0,"Raymond CCD, Pacific County, Washington",049,92736,53
10396.0,10047.0,101.0,3.0,5.0,20.0,33.0,0.0,19.0,30.0,61.0,0.0,0.0,0.0,0.0,11.0,0.0,0.0,0.0,0.0,5.0,0.0,10.0,0.0,46.0,5.0,"Newport CCD, Pend Oreille County, Washington",051,92160,53
2066.0,1977.0,65.0,8.0,0.0,0.0,10.0,0.0,0.0,0.0,0.0,0.0,0.0,0.0,0.0,0.0,0.0,0.0,0.0,0.0,6.0,0.0,0.0,0.0,0.0,0.0,"Ione-Metaline Falls CCD, Pend Oreille County, Washington",051,91376,53
5334.0,4929.0,167.0,96.0,29.0,2.0,21.0,2.0,0.0,0.0,30.0,5.0,0.0,0.0,7.0,5.0,0.0,0.0,9.0,0.0,26.0,3.0,0.0,0.0,0.0,3.0,"Orcas CCD, San Juan County, Washington",055,92432,53
2862.0,2672.0,54.0,57.0,20.0,0.0,22.0,0.0,0.0,6.0,21.0,2.0,0.0,0.0,3.0,0.0,0.0,0.0,2.0,0.0,1.0,0.0,0.0,0.0,0.0,2.0,"Lopez CCD, San Juan County, Washington",055,91696,53
1782.0,1755.0,16.0,8.0,3.0,0.0,0.0,0.0,0.0,0.0,0.0,0.0,0.0,0.0,0.0,0.0,0.0,0.0,0.0,0.0,0.0,0.0,0.0,0.0,0.0,0.0,"Stevenson CCD, Skamania County, Washington",059,93312,53
1019.0,984.0,14.0,8.0,0.0,0.0,13.0,0.0,0.0,0.0,0.0,0.0,0.0,0.0,0.0,0.0,0.0,0.0,0.0,0.0,0.0,0.0,0.0,0.0,0.0,0.0,"Rosalia CCD, Whitman County, Washington",075,92848,53
1110.0,1092.0,12.0,1.0,0.0,0.0,4.0,0.0,0.0,0.0,0.0,0.0,0.0,0.0,0.0,0.0,0.0,1.0,0.0,0.0,0.0,0.0,0.0,0.0,0.0,0.0,"Uniontown CCD, Whitman County, Washington",075,93536,53
4883.0,4741.0,46.0,0.0,4.0,0.0,13.0,0.0,0.0,0.0,36.0,0.0,0.0,0.0,0.0,0.0,0.0,11.0,17.0,0.0,15.0,0.0,0.0,0.0,0.0,0.0,"Colfax-Palouse CCD, Whitman County, Washington",075,90656,53
33282.0,27086.0,1335.0,238.0,121.0,0.0,128.0,20.0,564.0,28.0,490.0,153.0,214.0,39.0,822.0,946.0,117.0,59.0,11.0,8.0,273.0,59.0,62.0,344.0,165.0,0.0,"Pullman CCD, Whitman County, Washington",075,92656,53
1622.0,1587.0,16.0,0.0,0.0,1.0,11.0,2.0,0.0,0.0,0.0,0.0,0.0,0.0,0.0,0.0,0.0,0.0,0.0,0.0,0.0,5.0,0.0,0.0,0.0,0.0,"Rock Lake CCD, Whitman County, Washington",075,92832,53
1011.0,942.0,26.0,33.0,8.0,0.0,0.0,2.0,0.0,0.0,0.0,0.0,0.0,0.0,0.0,0.0,0.0,0.0,0.0,0.0,0.0,0.0,0.0,0.0,0.0,0.0,"Tekoa CCD, Whitman County, Washington",075,93424,53
132601.0,91598.0,21745.0,17203.0,99.0,50.0,254.0,73.0,75.0,24.0,190.0,50.0,14.0,161.0,95.0,96.0,68.0,101.0,123.0,48.0,126.0,102.0,44.0,42.0,163.0,57.0,"Yakima CCD, Yakima County, Washington",077,93904,53
2697.0,681.0,1306.0,700.0,0.0,0.0,0.0,0.0,0.0,0.0,0.0,0.0,10.0,0.0,0.0,0.0,0.0,0.0,0.0,0.0,0.0,0.0,0.0,0.0,0.0,0.0,"Mabton CCD, Yakima County, Washington",077,91808,53
49544.0,18663.0,19285.0,11164.0,0.0,0.0,129.0,31.0,32.0,0.0,10.0,0.0,0.0,0.0,0.0,0.0,21.0,64.0,59.0,3.0,0.0,0.0,0.0,0.0,83.0,0.0,"Sunnyside CCD, Yakima County, Washington",077,93344,53
8400.0,5900.0,1733.0,730.0,0.0,0.0,0.0,0.0,0.0,0.0,0.0,0.0,0.0,0.0,0.0,1.0,0.0,0.0,0.0,0.0,36.0,0.0,0.0,0.0,0.0,0.0,"Northeast Yakima CCD, Yakima County, Washington",077,92192,53
3214.0,2645.0,261.0,186.0,0.0,0.0,9.0,9.0,0.0,0.0,0.0,18.0,0.0,0.0,0.0,0.0,0.0,0.0,15.0,0.0,14.0,10.0,0.0,0.0,47.0,0.0,"South Yakima CCD, Yakima County, Washington",077,93184,53
24333.0,10638.0,7960.0,5014.0,8.0,0.0,15.0,0.0,0.0,0.0,14.0,6.0,0.0,0.0,24.0,45.0,0.0,14.0,48.0,60.0,112.0,69.0,0.0,0.0,293.0,13.0,"Toppenish-Wapato CCD, Yakima County, Washington",077,93472,53
6951.0,6276.0,408.0,255.0,0.0,0.0,12.0,0.0,0.0,0.0,0.0,0.0,0.0,0.0,0.0,0.0,0.0,0.0,0.0,0.0,0.0,0.0,0.0,0.0,0.0,0.0,"Northwest Yakima CCD, Yakima County, Washington",077,92240,53
2351.0,2229.0,23.0,8.0,0.0,0.0,0.0,3.0,0.0,0.0,0.0,0.0,0.0,0.0,0.0,0.0,0.0,0.0,0.0,0.0,4.0,13.0,0.0,0.0,71.0,0.0,"Clallam Bay-Neah Bay CCD, Clallam County, Washington",009,90576,53
18370.0,17248.0,140.0,297.0,11.0,0.0,68.0,18.0,17.0,10.0,153.0,35.0,90.0,11.0,15.0,0.0,32.0,8.0,60.0,12.0,73.0,16.0,0.0,0.0,0.0,56.0,"Sequim CCD, Clallam County, Washington",009,92960,53
7492.0,5902.0,740.0,569.0,24.0,0.0,16.0,0.0,167.0,0.0,0.0,0.0,36.0,0.0,4.0,5.0,0.0,0.0,0.0,0.0,0.0,0.0,0.0,0.0,29.0,0.0,"White Salmon CCD, Klickitat County, Washington",039,93744,53
7035.0,6835.0,92.0,67.0,0.0,0.0,0.0,0.0,0.0,0.0,28.0,0.0,0.0,0.0,0.0,0.0,0.0,0.0,13.0,0.0,0.0,0.0,0.0,0.0,0.0,0.0,"Goldendale CCD, Klickitat County, Washington",039,91264,53
2778.0,2647.0,32.0,30.0,0.0,0.0,44.0,0.0,0.0,0.0,7.0,0.0,0.0,0.0,0.0,0.0,0.0,0.0,18.0,0.0,0.0,0.0,0.0,0.0,0.0,0.0,"Ethel CCD, Lewis County, Washington",041,91088,53
4327.0,4233.0,33.0,0.0,0.0,0.0,23.0,0.0,0.0,0.0,0.0,0.0,0.0,0.0,0.0,0.0,0.0,0.0,0.0,0.0,0.0,0.0,0.0,0.0,38.0,0.0,"Mineral CCD, Lewis County, Washington",041,91984,53
4021.0,3692.0,127.0,97.0,7.0,0.0,30.0,8.0,0.0,0.0,0.0,0.0,8.0,11.0,0.0,34.0,0.0,0.0,0.0,0.0,7.0,0.0,0.0,0.0,0.0,0.0,"Logan Hill CCD, Lewis County, Washington",041,91648,53
4040.0,3621.0,179.0,141.0,0.0,0.0,30.0,0.0,9.0,0.0,0.0,0.0,0.0,0.0,0.0,0.0,0.0,0.0,22.0,0.0,0.0,38.0,0.0,0.0,0.0,0.0,"Mossyrock CCD, Lewis County, Washington",041,92048,53
2687.0,2553.0,74.0,49.0,0.0,0.0,0.0,0.0,0.0,0.0,0.0,0.0,0.0,0.0,0.0,0.0,0.0,0.0,11.0,0.0,0.0,0.0,0.0,0.0,0.0,0.0,"Morton CCD, Lewis County, Washington",041,92016,53
3333.0,3273.0,4.0,0.0,0.0,0.0,26.0,0.0,0.0,0.0,9.0,0.0,0.0,0.0,0.0,0.0,0.0,0.0,10.0,0.0,0.0,0.0,0.0,0.0,11.0,0.0,"Bunker CCD, Lewis County, Washington",041,90352,53
2334.0,2321.0,0.0,0.0,0.0,0.0,13.0,0.0,0.0,0.0,0.0,0.0,0.0,0.0,0.0,0.0,0.0,0.0,0.0,0.0,0.0,0.0,0.0,0.0,0.0,0.0,"Big Bottom CCD, Lewis County, Washington",041,90208,53
29386.0,25571.0,1676.0,1709.0,29.0,0.0,56.0,0.0,35.0,15.0,157.0,0.0,0.0,0.0,0.0,0.0,0.0,17.0,21.0,27.0,34.0,11.0,0.0,0.0,26.0,2.0,"Centralia-Chehalis CCD, Lewis County, Washington",041,90512,53
5721.0,2575.0,1297.0,1796.0,0.0,0.0,4.0,0.0,0.0,0.0,41.0,3.0,0.0,0.0,0.0,0.0,0.0,0.0,1.0,0.0,0.0,0.0,0.0,0.0,4.0,0.0,"Bridgeport CCD, Douglas County, Washington",017,90320,53
29267.0,22197.0,3746.0,2678.0,98.0,0.0,96.0,1.0,13.0,26.0,98.0,16.0,0.0,8.0,0.0,37.0,0.0,0.0,0.0,8.0,10.0,13.0,9.0,191.0,22.0,0.0,"East Wenatchee CCD, Douglas County, Washington",017,90944,53
2814.0,2642.0,75.0,31.0,0.0,0.0,5.0,0.0,0.0,0.0,0.0,0.0,0.0,0.0,0.0,0.0,0.0,0.0,0.0,0.0,61.0,0.0,0.0,0.0,0.0,0.0,"Waterville CCD, Douglas County, Washington",017,93696,53
1197.0,1096.0,7.0,10.0,0.0,0.0,0.0,0.0,0.0,0.0,0.0,0.0,0.0,52.0,0.0,1.0,0.0,0.0,0.0,0.0,0.0,0.0,0.0,0.0,0.0,31.0,"Humptulips CCD, Grays Harbor County, Washington",027,91360,53
910.0,816.0,48.0,17.0,3.0,0.0,0.0,0.0,0.0,0.0,0.0,0.0,0.0,0.0,0.0,0.0,0.0,0.0,0.0,0.0,2.0,0.0,0.0,0.0,24.0,0.0,"Quinault Reservation CCD, Grays Harbor County, Washington",027,92704,53
1715.0,1653.0,54.0,0.0,0.0,0.0,8.0,0.0,0.0,0.0,0.0,0.0,0.0,0.0,0.0,0.0,0.0,0.0,0.0,0.0,0.0,0.0,0.0,0.0,0.0,0.0,"Malone-Porter CCD, Grays Harbor County, Washington",027,91856,53
2158.0,2103.0,12.0,0.0,0.0,0.0,25.0,0.0,4.0,0.0,0.0,0.0,0.0,0.0,0.0,0.0,0.0,0.0,6.0,0.0,0.0,0.0,0.0,0.0,8.0,0.0,"Oakville CCD, Grays Harbor County, Washington",027,92288,53
29241.0,25653.0,1257.0,1640.0,43.0,5.0,80.0,0.0,31.0,46.0,72.0,19.0,29.0,59.0,16.0,5.0,9.0,40.0,44.0,12.0,84.0,10.0,23.0,0.0,47.0,17.0,"Aberdeen-Hoquiam CCD, Grays Harbor County, Washington",027,90016,53
6212.0,5423.0,325.0,414.0,0.0,0.0,47.0,0.0,0.0,0.0,0.0,0.0,0.0,0.0,0.0,0.0,0.0,0.0,0.0,0.0,3.0,0.0,0.0,0.0,0.0,0.0,"Elma CCD, Grays Harbor County, Washington",027,91024,53
592.0,581.0,6.0,0.0,0.0,0.0,0.0,0.0,0.0,0.0,0.0,0.0,0.0,0.0,0.0,0.0,0.0,0.0,0.0,0.0,5.0,0.0,0.0,0.0,0.0,0.0,"North River CCD, Grays Harbor County, Washington",027,92208,53
1381.0,1345.0,18.0,17.0,0.0,0.0,0.0,0.0,0.0,0.0,0.0,0.0,0.0,0.0,0.0,1.0,0.0,0.0,0.0,0.0,0.0,0.0,0.0,0.0,0.0,0.0,"Wishkah CCD, Grays Harbor County, Washington",027,93840,53
3390.0,3346.0,14.0,8.0,0.0,0.0,8.0,0.0,0.0,0.0,4.0,0.0,0.0,0.0,6.0,0.0,0.0,0.0,0.0,0.0,0.0,0.0,0.0,0.0,0.0,4.0,"McCleary CCD, Grays Harbor County, Washington",027,91824,53
27347.0,23411.0,1431.0,628.0,71.0,22.0,216.0,50.0,37.0,5.0,78.0,0.0,41.0,68.0,58.0,46.0,19.0,70.0,288.0,141.0,363.0,240.0,24.0,0.0,33.0,7.0,"Fort Lewis-DuPont CCD, Pierce County, Washington",053,91184,53
3580.0,3394.0,39.0,44.0,0.0,0.0,0.0,3.0,0.0,0.0,0.0,8.0,0.0,0.0,0.0,0.0,0.0,0.0,0.0,92.0,0.0,0.0,0.0,0.0,0.0,0.0,"Mount Rainier CCD, Pierce County, Washington",053,92064,53
22030.0,20884.0,513.0,348.0,32.0,7.0,20.0,0.0,9.0,119.0,8.0,2.0,0.0,0.0,0.0,3.0,0.0,8.0,22.0,0.0,21.0,17.0,16.0,0.0,1.0,0.0,"Buckley CCD, Pierce County, Washington",053,90336,53
154280.0,140885.0,3619.0,2095.0,149.0,33.0,537.0,209.0,710.0,422.0,994.0,200.0,294.0,288.0,185.0,295.0,168.0,159.0,590.0,213.0,1257.0,568.0,58.0,51.0,245.0,56.0,"Puyallup CCD, Pierce County, Washington",053,92672,53
14768.0,13875.0,303.0,170.0,54.0,3.0,108.0,56.0,40.0,25.0,15.0,0.0,15.0,15.0,3.0,2.0,0.0,5.0,12.0,3.0,0.0,24.0,0.0,40.0,0.0,0.0,"Roy CCD, Pierce County, Washington",053,92880,53
5450.0,5133.0,124.0,39.0,38.0,0.0,44.0,37.0,0.0,0.0,7.0,0.0,0.0,18.0,0.0,0.0,10.0,0.0,0.0,0.0,0.0,0.0,0.0,0.0,0.0,0.0,"Eatonville CCD, Pierce County, Washington",053,90976,53
48340.0,45481.0,598.0,382.0,90.0,0.0,222.0,42.0,172.0,80.0,295.0,42.0,19.0,126.0,224.0,102.0,46.0,20.0,67.0,5.0,165.0,116.0,0.0,0.0,0.0,46.0,"Gig Harbor Peninsula CCD, Pierce County, Washington",053,91232,53
80685.0,71586.0,2448.0,1430.0,69.0,0.0,639.0,111.0,173.0,41.0,656.0,125.0,267.0,468.0,133.0,109.0,138.0,145.0,439.0,150.0,730.0,367.0,29.0,42.0,327.0,63.0,"Graham-Thrift CCD, Pierce County, Washington",053,91280,53
417262.0,337514.0,19149.0,11336.0,887.0,294.0,2919.0,629.0,3336.0,2684.0,2753.0,1201.0,2730.0,4615.0,1076.0,953.0,1734.0,3644.0,3546.0,2404.0,7160.0,3617.0,447.0,170.0,1736.0,728.0,"Tacoma CCD, Pierce County, Washington",053,93376,53
424.0,392.0,13.0,0.0,0.0,0.0,0.0,0.0,0.0,0.0,0.0,0.0,9.0,10.0,0.0,0.0,0.0,0.0,0.0,0.0,0.0,0.0,0.0,0.0,0.0,0.0,"Skamokawa CCD, Wahkiakum County, Washington",069,92992,53
1049.0,1021.0,0.0,14.0,0.0,0.0,5.0,0.0,9.0,0.0,0.0,0.0,0.0,0.0,0.0,0.0,0.0,0.0,0.0,0.0,0.0,0.0,0.0,0.0,0.0,0.0,"Grays River CCD, Wahkiakum County, Washington",069,91328,53
853.0,853.0,0.0,0.0,0.0,0.0,0.0,0.0,0.0,0.0,0.0,0.0,0.0,0.0,0.0,0.0,0.0,0.0,0.0,0.0,0.0,0.0,0.0,0.0,0.0,0.0,"Puget Island CCD, Wahkiakum County, Washington",069,92640,53
54497.0,25001.0,14038.0,13656.0,60.0,0.0,36.0,0.0,260.0,138.0,70.0,59.0,0.0,24.0,7.0,5.0,297.0,238.0,16.0,0.0,201.0,131.0,0.0,0.0,33.0,227.0,"Pasco CCD, Franklin County, Washington",021,92512,53
1383.0,1002.0,142.0,211.0,3.0,0.0,0.0,0.0,14.0,11.0,0.0,0.0,0.0,0.0,0.0,0.0,0.0,0.0,0.0,0.0,0.0,0.0,0.0,0.0,0.0,0.0,"Kahlotus CCD, Franklin County, Washington",021,91424,53
9140.0,4566.0,1954.0,2403.0,0.0,0.0,7.0,0.0,8.0,0.0,0.0,0.0,0.0,0.0,0.0,0.0,0.0,0.0,59.0,0.0,14.0,113.0,0.0,0.0,16.0,0.0,"Connell CCD, Franklin County, Washington",021,90752,53
15746.0,10487.0,2841.0,1449.0,49.0,0.0,24.0,43.0,287.0,38.0,45.0,2.0,0.0,0.0,0.0,16.0,45.0,95.0,13.0,123.0,73.0,93.0,0.0,0.0,23.0,0.0,"Pasco North CCD, Franklin County, Washington",021,92528,53
2003.0,1768.0,132.0,103.0,0.0,0.0,0.0,0.0,0.0,0.0,0.0,0.0,0.0,0.0,0.0,0.0,0.0,0.0,0.0,0.0,0.0,0.0,0.0,0.0,0.0,0.0,"Touchet CCD, Walla Walla County, Washington",071,93488,53
2674.0,2536.0,55.0,42.0,0.0,0.0,25.0,0.0,0.0,3.0,0.0,0.0,0.0,0.0,0.0,0.0,0.0,0.0,2.0,0.0,11.0,0.0,0.0,0.0,0.0,0.0,"Waitsburg CCD, Walla Walla County, Washington",071,93648,53
1106.0,562.0,121.0,415.0,0.0,0.0,0.0,0.0,0.0,0.0,0.0,0.0,0.0,0.0,0.0,0.0,0.0,0.0,0.0,0.0,0.0,0.0,0.0,7.0,0.0,1.0,"Eureka Flat CCD, Walla Walla County, Washington",071,91104,53
3932.0,3359.0,248.0,315.0,10.0,0.0,0.0,0.0,0.0,0.0,0.0,0.0,0.0,0.0,0.0,0.0,0.0,0.0,0.0,0.0,0.0,0.0,0.0,0.0,0.0,0.0,"Burbank CCD, Walla Walla County, Washington",071,90368,53
46793.0,37811.0,3775.0,3711.0,85.0,58.0,127.0,5.0,260.0,35.0,117.0,0.0,12.0,23.0,85.0,218.0,33.0,31.0,79.0,47.0,108.0,2.0,29.0,48.0,61.0,33.0,"Walla Walla-College Place CCD, Walla Walla County, Washington",071,93664,53
1057.0,920.0,74.0,63.0,0.0,0.0,0.0,0.0,0.0,0.0,0.0,0.0,0.0,0.0,0.0,0.0,0.0,0.0,0.0,0.0,0.0,0.0,0.0,0.0,0.0,0.0,"Wilson Creek CCD, Grant County, Washington",025,93792,53
16524.0,13512.0,1270.0,1037.0,24.0,0.0,36.0,0.0,284.0,110.0,9.0,0.0,18.0,0.0,0.0,18.0,0.0,0.0,30.0,0.0,50.0,56.0,0.0,0.0,70.0,0.0,"Ephrata-Soap Lake CCD, Grant County, Washington",025,91072,53
1810.0,1596.0,108.0,10.0,0.0,0.0,0.0,0.0,59.0,22.0,0.0,0.0,0.0,0.0,0.0,0.0,0.0,0.0,10.0,0.0,5.0,0.0,0.0,0.0,0.0,0.0,"Gloyd CCD, Grant County, Washington",025,91248,53
32899.0,24895.0,4083.0,2661.0,33.0,0.0,50.0,0.0,351.0,212.0,83.0,17.0,11.0,6.0,0.0,0.0,40.0,128.0,3.0,0.0,151.0,152.0,0.0,0.0,8.0,15.0,"Moses Lake CCD, Grant County, Washington",025,92032,53
9767.0,3735.0,3222.0,2753.0,9.0,18.0,0.0,0.0,0.0,0.0,0.0,0.0,0.0,16.0,0.0,0.0,0.0,0.0,0.0,0.0,14.0,0.0,0.0,0.0,0.0,0.0,"Quincy CCD, Grant County, Washington",025,92720,53
2442.0,1422.0,489.0,523.0,0.0,0.0,0.0,0.0,0.0,0.0,5.0,0.0,0.0,0.0,0.0,0.0,0.0,0.0,0.0,0.0,0.0,0.0,0.0,0.0,0.0,3.0,"George CCD, Grant County, Washington",025,91200,53
2174.0,2114.0,24.0,8.0,5.0,0.0,4.0,0.0,0.0,0.0,0.0,0.0,0.0,0.0,0.0,0.0,0.0,0.0,2.0,0.0,0.0,0.0,0.0,0.0,16.0,1.0,"Grand Coulee CCD, Grant County, Washington",025,91296,53
3387.0,1623.0,1007.0,731.0,0.0,5.0,9.0,0.0,0.0,0.0,8.0,0.0,0.0,0.0,0.0,0.0,0.0,0.0,0.0,0.0,0.0,0.0,0.0,0.0,0.0,4.0,"Warden CCD, Grant County, Washington",025,93680,53
1541.0,1541.0,0.0,0.0,0.0,0.0,0.0,0.0,0.0,0.0,0.0,0.0,0.0,0.0,0.0,0.0,0.0,0.0,0.0,0.0,0.0,0.0,0.0,0.0,0.0,0.0,"Coulee City CCD, Grant County, Washington",025,90784,53
4950.0,4596.0,74.0,58.0,20.0,0.0,0.0,4.0,16.0,0.0,28.0,0.0,5.0,0.0,5.0,0.0,0.0,28.0,0.0,0.0,41.0,0.0,0.0,0.0,60.0,15.0,"Lummi Reservation CCD, Whatcom County, Washington",073,91760,53
883.0,848.0,5.0,0.0,10.0,0.0,0.0,0.0,9.0,0.0,11.0,0.0,0.0,0.0,0.0,0.0,0.0,0.0,0.0,0.0,0.0,0.0,0.0,0.0,0.0,0.0,"Lummi Island CCD, Whatcom County, Washington",073,91744,53
110852.0,98170.0,3650.0,1484.0,450.0,50.0,421.0,50.0,934.0,626.0,1013.0,358.0,301.0,33.0,382.0,303.0,366.0,601.0,157.0,185.0,495.0,625.0,18.0,0.0,180.0,0.0,"Bellingham CCD, Whatcom County, Washington",073,90176,53
31415.0,26791.0,1712.0,1275.0,65.0,23.0,123.0,17.0,245.0,162.0,331.0,180.0,0.0,0.0,44.0,51.0,0.0,0.0,27.0,52.0,130.0,137.0,0.0,0.0,33.0,17.0,"Ferndale CCD, Whatcom County, Washington",073,91152,53
16432.0,14656.0,557.0,539.0,29.0,14.0,191.0,0.0,8.0,0.0,131.0,162.0,0.0,0.0,0.0,12.0,0.0,0.0,37.0,0.0,96.0,0.0,0.0,0.0,0.0,0.0,"Lynden CCD, Whatcom County, Washington",073,91792,53
19104.0,17228.0,378.0,89.0,26.0,0.0,267.0,16.0,288.0,130.0,177.0,223.0,0.0,0.0,0.0,0.0,40.0,0.0,156.0,19.0,24.0,27.0,0.0,0.0,16.0,0.0,"Blaine CCD, Whatcom County, Washington",073,90224,53
7874.0,6850.0,297.0,385.0,59.0,0.0,29.0,0.0,95.0,54.0,2.0,3.0,11.0,31.0,0.0,6.0,0.0,0.0,3.0,2.0,26.0,14.0,0.0,0.0,7.0,0.0,"East Whatcom CCD, Whatcom County, Washington",073,90960,53
